pion_3pt/beta6.20_mu-0.2770_ms-0.2400_L24x72/resource/tunecache_error.tsv
tunecache	1.1.0	1.1.0--sm_80	cpu_arch=x86_64,gpu_arch=sm_80,cuda_version=11.4.152	# Last updated Tue Mar  4 20:17:37 2025

          volume	name	aux	block.x	block.y	block.z	grid.x	grid.y	grid.z	shared_bytes	aux.x	aux.y	aux.z	aux.w	time	comment
