pion_3pt/beta6.20_mu-0.2770_ms-0.2400_L24x72/resource/tunecache.tsv
tunecache	1.1.0	1.1.0-c3781bc-dirty-sm_80	cpu_arch=x86_64,gpu_arch=sm_80,cuda_version=11.4.152	# Last updated Tue Mar  4 23:59:45 2025

          volume	name	aux	block.x	block.y	block.z	grid.x	grid.y	grid.z	shared_bytes	aux.x	aux.y	aux.z	aux.w	time	comment
     12x24x24x36	N4quda15CopyColorSpinorILi4ELi3ENS_11colorspinor11FloatNOrderIdLi4ELi3ELi2ELb0ELb0EEENS1_16QDPJITDiracOrderIdLi4ELi3EEESt5tupleIJRNS_16ColorSpinorFieldERKS7_19QudaFieldLocation_sPdPKdEEEE	GPU-offline,cmem,vol=248832,parity=1,precision=8,order=11,Ns=4,Nc=3vol=248832,parity=1,precision=8,order=2,Ns=4,Nc=3,NonRelBasis	640	1	1	389	1	1	0	-1	-1	-1	-1	7.73514e-05	# 0.00 Gflop/s, 1235.29 GB/s, tuning took 0.019014 seconds at Tue Mar  4 23:59:43 2025
     12x24x24x36	N4quda15CopyColorSpinorILi4ELi3ENS_11colorspinor11FloatNOrderIdLi4ELi3ELi2ELb0ELb0EEES3_St5tupleIJRNS_16ColorSpinorFieldERKS5_19QudaFieldLocation_sPdPKdEEEE	GPU-offline,cmem,vol=248832,parity=1,precision=8,order=2,Ns=4,Nc=3vol=248832,parity=1,precision=8,order=2,Ns=4,Nc=3,PreserveBasis	32	1	1	7776	1	1	0	-1	-1	-1	-1	7.69463e-05	# 0.00 Gflop/s, 1241.79 GB/s, tuning took 0.019619 seconds at Sun Aug 18 11:54:36 2024
     12x24x24x36	N4quda15CopyColorSpinorILi4ELi3ENS_11colorspinor11FloatNOrderIfLi4ELi3ELi4ELb0ELb0EEENS2_IdLi4ELi3ELi2ELb0ELb0EEESt5tupleIJRNS_16ColorSpinorFieldERKS6_19QudaFieldLocation_sPfPKdEEEE	GPU-offline,cmem,vol=248832,parity=1,precision=8,order=2,Ns=4,Nc=3vol=248832,parity=1,precision=4,order=4,Ns=4,Nc=3,PreserveBasis	416	1	1	599	1	1	0	-1	-1	-1	-1	5.70027e-05	# 0.00 Gflop/s, 1257.20 GB/s, tuning took 0.017014 seconds at Sun Aug 18 11:54:36 2024
     12x24x24x36	N4quda15CopyColorSpinorILi4ELi3ENS_11colorspinor11FloatNOrderIfLi4ELi3ELi4ELb0ELb0EEES3_St5tupleIJRNS_16ColorSpinorFieldERKS5_19QudaFieldLocation_sPfPKfEEEE	GPU-offline,cmem,vol=248832,parity=1,precision=4,order=4,Ns=4,Nc=3vol=248832,parity=1,precision=4,order=4,Ns=4,Nc=3,NonRelBasis	288	1	1	864	1	1	0	-1	-1	-1	-1	3.64983e-05	# 0.00 Gflop/s, 1308.99 GB/s, tuning took 0.014696 seconds at Sun Aug 18 11:54:44 2024
     12x24x24x36	N4quda15CopyColorSpinorILi4ELi3ENS_11colorspinor11FloatNOrderIfLi4ELi3ELi4ELb0ELb0EEES3_St5tupleIJRNS_16ColorSpinorFieldERKS5_19QudaFieldLocation_sPfPKfEEEE	GPU-offline,cmem,vol=248832,parity=1,precision=4,order=4,Ns=4,Nc=3vol=248832,parity=1,precision=4,order=4,Ns=4,Nc=3,PreserveBasis	96	1	1	2592	1	1	0	-1	-1	-1	-1	3.64251e-05	# 0.00 Gflop/s, 1311.61 GB/s, tuning took 0.014785 seconds at Sun Aug 18 11:47:20 2024
     12x24x24x36	N4quda15CopyColorSpinorILi4ELi3ENS_11colorspinor11FloatNOrderIfLi4ELi3ELi4ELb0ELb0EEES3_St5tupleIJRNS_16ColorSpinorFieldERKS5_19QudaFieldLocation_sPfPKfEEEE	GPU-offline,cmem,vol=248832,parity=1,precision=4,order=4,Ns=4,Nc=3vol=248832,parity=1,precision=4,order=4,Ns=4,Nc=3,RelBasis	128	1	1	1944	1	1	0	-1	-1	-1	-1	3.72297e-05	# 0.00 Gflop/s, 1283.27 GB/s, tuning took 0.015009 seconds at Sun Aug 18 11:54:36 2024
     12x24x24x36	N4quda15CopyColorSpinorILi4ELi3ENS_11colorspinor16QDPJITDiracOrderIdLi4ELi3EEENS1_11FloatNOrderIdLi4ELi3ELi2ELb0ELb0EEESt5tupleIJRNS_16ColorSpinorFieldERKS7_19QudaFieldLocation_sPdPKdEEEE	GPU-offline,cmem,vol=248832,parity=1,precision=8,order=2,Ns=4,Nc=3vol=248832,parity=1,precision=8,order=11,Ns=4,Nc=3,RelBasis	832	1	1	300	1	1	0	-1	-1	-1	-1	7.66537e-05	# 0.00 Gflop/s, 1246.53 GB/s, tuning took 0.019561 seconds at Sun Aug 18 11:55:27 2024
     12x24x24x36	N4quda26WilsonCloverPreconditionedINS_15WilsonCloverArgIdLi3ELi4EL21QudaReconstructType_s12EEEEE	policy,GPU-offline,vol=248832,parity=1,precision=8,order=2,Ns=4,Nc=3,commDim=0001,topo=1112,order=01,p2p=3,gdr=0,nvshmem=0,pol=110000111100110000	32	1	1	1	1	1	0	0	1	0	-1	0.000351232	# 1292.22 Gflop/s, 2040.35 GB/s, tuning took 0.066403 seconds at Sun Aug 18 11:55:07 2024
     12x24x24x36	N4quda26WilsonCloverPreconditionedINS_15WilsonCloverArgIdLi3ELi4EL21QudaReconstructType_s12EEEEE	policy,GPU-offline,vol=248832,parity=1,precision=8,order=2,Ns=4,Nc=3,commDim=0001,xpay,topo=1112,order=01,p2p=3,gdr=0,nvshmem=0,pol=110000111100110000	32	1	1	1	1	1	0	1	1	0	-1	0.000378197	# 1231.67 Gflop/s, 1894.87 GB/s, tuning took 0.075122 seconds at Sun Aug 18 11:55:25 2024
     12x24x24x36	N4quda26WilsonCloverPreconditionedINS_15WilsonCloverArgIdLi3ELi4EL21QudaReconstructType_s12EEEEE	policy_kernel=exterior_all,GPU-offline,vol=248832,parity=1,precision=8,order=2,Ns=4,Nc=3,commDim=0001	32	1	1	432	1	1	5564	-1	-1	-1	-1	1.36734e-05	# 691.53 Gflop/s, 1164.69 GB/s, tuning took 0.029691 seconds at Sun Aug 18 11:54:46 2024
     12x24x24x36	N4quda26WilsonCloverPreconditionedINS_15WilsonCloverArgIdLi3ELi4EL21QudaReconstructType_s12EEEEE	policy_kernel=exterior_all,GPU-offline,vol=248832,parity=1,precision=8,order=2,Ns=4,Nc=3,commDim=0001,xpay	32	1	1	432	1	1	23845	-1	-1	-1	-1	1.3568e-05	# 721.36 Gflop/s, 1173.74 GB/s, tuning took 0.029447 seconds at Sun Aug 18 11:55:07 2024
     12x24x24x36	N4quda26WilsonCloverPreconditionedINS_15WilsonCloverArgIdLi3ELi4EL21QudaReconstructType_s12EEEEE	policy_kernel=exterior_all,GPU-offline,vol=248832,parity=1,precision=8,order=2,Ns=4,Nc=3,commDim=0001,xpay,zero_copy,p2p=0	16	1	1	864	1	1	83457	-1	-1	-1	-1	0.000120832	# 81.00 Gflop/s, 131.80 GB/s, tuning took 0.124705 seconds at Sun Aug 18 11:55:08 2024
     12x24x24x36	N4quda26WilsonCloverPreconditionedINS_15WilsonCloverArgIdLi3ELi4EL21QudaReconstructType_s12EEEEE	policy_kernel=exterior_all,GPU-offline,vol=248832,parity=1,precision=8,order=2,Ns=4,Nc=3,commDim=0001,xpay,zero_copy,p2p=1	32	1	1	432	1	1	6955	-1	-1	-1	-1	1.34875e-05	# 725.66 Gflop/s, 1180.74 GB/s, tuning took 0.029398 seconds at Sun Aug 18 11:55:13 2024
     12x24x24x36	N4quda26WilsonCloverPreconditionedINS_15WilsonCloverArgIdLi3ELi4EL21QudaReconstructType_s12EEEEE	policy_kernel=exterior_all,GPU-offline,vol=248832,parity=1,precision=8,order=2,Ns=4,Nc=3,commDim=0001,zero_copy,p2p=0	64	1	1	216	1	1	83457	-1	-1	-1	-1	0.000120946	# 78.18 Gflop/s, 131.67 GB/s, tuning took 0.124857 seconds at Sun Aug 18 11:54:46 2024
     12x24x24x36	N4quda26WilsonCloverPreconditionedINS_15WilsonCloverArgIdLi3ELi4EL21QudaReconstructType_s12EEEEE	policy_kernel=exterior_all,GPU-offline,vol=248832,parity=1,precision=8,order=2,Ns=4,Nc=3,commDim=0001,zero_copy,p2p=1	32	1	1	432	1	1	5756	-1	-1	-1	-1	1.36885e-05	# 690.77 Gflop/s, 1163.41 GB/s, tuning took 0.029337 seconds at Sun Aug 18 11:54:51 2024
     12x24x24x36	N4quda26WilsonCloverPreconditionedINS_15WilsonCloverArgIdLi3ELi4EL21QudaReconstructType_s12EEEEE	policy_kernel=exterior_t,GPU-offline,vol=248832,parity=1,precision=8,order=2,Ns=4,Nc=3,commDim=0001	128	1	1	108	1	1	11128	-1	-1	-1	-1	1.28465e-05	# 736.04 Gflop/s, 1239.65 GB/s, tuning took 0.029333 seconds at Sun Aug 18 11:54:46 2024
     12x24x24x36	N4quda26WilsonCloverPreconditionedINS_15WilsonCloverArgIdLi3ELi4EL21QudaReconstructType_s12EEEEE	policy_kernel=exterior_t,GPU-offline,vol=248832,parity=1,precision=8,order=2,Ns=4,Nc=3,commDim=0001,xpay	32	1	1	432	1	1	6420	-1	-1	-1	-1	1.31103e-05	# 746.54 Gflop/s, 1214.71 GB/s, tuning took 0.029350 seconds at Sun Aug 18 11:55:07 2024
     12x24x24x36	N4quda26WilsonCloverPreconditionedINS_15WilsonCloverArgIdLi3ELi4EL21QudaReconstructType_s12EEEEE	policy_kernel=exterior_t,GPU-offline,vol=248832,parity=1,precision=8,order=2,Ns=4,Nc=3,commDim=0001,xpay,zero_copy,p2p=0	16	1	1	864	1	1	83457	-1	-1	-1	-1	0.000120149	# 81.46 Gflop/s, 132.55 GB/s, tuning took 0.124136 seconds at Sun Aug 18 11:55:07 2024
     12x24x24x36	N4quda26WilsonCloverPreconditionedINS_15WilsonCloverArgIdLi3ELi4EL21QudaReconstructType_s12EEEEE	policy_kernel=exterior_t,GPU-offline,vol=248832,parity=1,precision=8,order=2,Ns=4,Nc=3,commDim=0001,xpay,zero_copy,p2p=1	32	1	1	432	1	1	5564	-1	-1	-1	-1	1.23581e-05	# 791.98 Gflop/s, 1288.64 GB/s, tuning took 0.028376 seconds at Sun Aug 18 11:55:13 2024
     12x24x24x36	N4quda26WilsonCloverPreconditionedINS_15WilsonCloverArgIdLi3ELi4EL21QudaReconstructType_s12EEEEE	policy_kernel=exterior_t,GPU-offline,vol=248832,parity=1,precision=8,order=2,Ns=4,Nc=3,commDim=0001,zero_copy,p2p=0	16	1	1	864	1	1	83457	-1	-1	-1	-1	0.000119694	# 79.00 Gflop/s, 133.05 GB/s, tuning took 0.123629 seconds at Sun Aug 18 11:54:46 2024
     12x24x24x36	N4quda26WilsonCloverPreconditionedINS_15WilsonCloverArgIdLi3ELi4EL21QudaReconstructType_s12EEEEE	policy_kernel=exterior_t,GPU-offline,vol=248832,parity=1,precision=8,order=2,Ns=4,Nc=3,commDim=0001,zero_copy,p2p=1	32	1	1	432	1	1	5962	-1	-1	-1	-1	1.19769e-05	# 789.49 Gflop/s, 1329.66 GB/s, tuning took 0.027861 seconds at Sun Aug 18 11:54:51 2024
     12x24x24x36	N4quda26WilsonCloverPreconditionedINS_15WilsonCloverArgIdLi3ELi4EL21QudaReconstructType_s12EEEEE	policy_kernel=interior,GPU-offline,vol=248832,parity=1,precision=8,order=2,Ns=4,Nc=3,commDim=0001,comm=0001	32	1	1	7776	1	1	6182	-1	-1	-1	-1	0.000314112	# 1415.88 Gflop/s, 2230.77 GB/s, tuning took 0.367143 seconds at Sun Aug 18 11:54:46 2024
     12x24x24x36	N4quda26WilsonCloverPreconditionedINS_15WilsonCloverArgIdLi3ELi4EL21QudaReconstructType_s12EEEEE	policy_kernel=interior,GPU-offline,vol=248832,parity=1,precision=8,order=2,Ns=4,Nc=3,commDim=0001,comm=0001,host-device	32	1	1	7776	1	1	5385	5	-1	-1	-1	0.000315392	# 1410.66 Gflop/s, 2234.34 GB/s, tuning took 4.645886 seconds at Sun Aug 18 11:54:56 2024
     12x24x24x36	N4quda26WilsonCloverPreconditionedINS_15WilsonCloverArgIdLi3ELi4EL21QudaReconstructType_s12EEEEE	policy_kernel=interior,GPU-offline,vol=248832,parity=1,precision=8,order=2,Ns=4,Nc=3,commDim=0001,comm=0001,host-host	32	1	1	7776	1	1	5217	5	-1	-1	-1	0.000315136	# 1411.81 Gflop/s, 2236.15 GB/s, tuning took 5.173550 seconds at Sun Aug 18 11:54:51 2024
     12x24x24x36	N4quda26WilsonCloverPreconditionedINS_15WilsonCloverArgIdLi3ELi4EL21QudaReconstructType_s12EEEEE	policy_kernel=interior,GPU-offline,vol=248832,parity=1,precision=8,order=2,Ns=4,Nc=3,commDim=0001,comm=0001,host-remote	64	1	1	3888	1	1	11923	2	-1	-1	-1	0.000314368	# 1415.26 Gflop/s, 2241.62 GB/s, tuning took 6.020541 seconds at Sun Aug 18 11:55:07 2024
     12x24x24x36	N4quda26WilsonCloverPreconditionedINS_15WilsonCloverArgIdLi3ELi4EL21QudaReconstructType_s12EEEEE	policy_kernel=interior,GPU-offline,vol=248832,parity=1,precision=8,order=2,Ns=4,Nc=3,commDim=0001,xpay,comm=0001	64	1	1	3888	1	1	7258	-1	-1	-1	-1	0.000346112	# 1319.49 Gflop/s, 2024.52 GB/s, tuning took 0.395981 seconds at Sun Aug 18 11:55:07 2024
     12x24x24x36	N4quda26WilsonCloverPreconditionedINS_15WilsonCloverArgIdLi3ELi4EL21QudaReconstructType_s12EEEEE	policy_kernel=interior,GPU-offline,vol=248832,parity=1,precision=8,order=2,Ns=4,Nc=3,commDim=0001,xpay,comm=0001,host-device	32	1	1	7776	1	1	5217	4	-1	-1	-1	0.000346112	# 1319.96 Gflop/s, 2036.02 GB/s, tuning took 5.040058 seconds at Sun Aug 18 11:55:18 2024
     12x24x24x36	N4quda26WilsonCloverPreconditionedINS_15WilsonCloverArgIdLi3ELi4EL21QudaReconstructType_s12EEEEE	policy_kernel=interior,GPU-offline,vol=248832,parity=1,precision=8,order=2,Ns=4,Nc=3,commDim=0001,xpay,comm=0001,host-host	32	1	1	7776	1	1	5217	6	-1	-1	-1	0.00034816	# 1312.20 Gflop/s, 2024.05 GB/s, tuning took 5.563994 seconds at Sun Aug 18 11:55:13 2024
     12x24x24x36	N4quda26WilsonCloverPreconditionedINS_15WilsonCloverArgIdLi3ELi4EL21QudaReconstructType_s12EEEEE	policy_kernel=interior,GPU-offline,vol=248832,parity=1,precision=8,order=2,Ns=4,Nc=3,commDim=0001,xpay,comm=0001,host-remote	64	1	1	3888	1	1	5564	2	-1	-1	-1	0.000347477	# 1314.78 Gflop/s, 2028.02 GB/s, tuning took 6.433599 seconds at Sun Aug 18 11:55:25 2024
     12x24x24x36	N4quda26WilsonCloverPreconditionedINS_15WilsonCloverArgIfLi3ELi4EL21QudaReconstructType_s12EEEEE	policy,GPU-offline,vol=248832,parity=1,precision=4,order=4,Ns=4,Nc=3,commDim=0001,dagger,topo=1112,order=01,p2p=3,gdr=0,nvshmem=0,pol=110000111100110000	32	1	1	1	1	1	0	0	1	0	-1	0.000235315	# 1928.77 Gflop/s, 1522.72 GB/s, tuning took 0.040565 seconds at Sun Aug 18 11:47:10 2024
     12x24x24x36	N4quda26WilsonCloverPreconditionedINS_15WilsonCloverArgIfLi3ELi4EL21QudaReconstructType_s12EEEEE	policy,GPU-offline,vol=248832,parity=1,precision=4,order=4,Ns=4,Nc=3,commDim=0001,topo=1112,order=01,p2p=3,gdr=0,nvshmem=0,pol=110000111100110000	32	1	1	1	1	1	0	0	1	0	-1	0.00023552	# 1927.10 Gflop/s, 1521.39 GB/s, tuning took 0.041192 seconds at Sun Aug 18 11:46:48 2024
     12x24x24x36	N4quda26WilsonCloverPreconditionedINS_15WilsonCloverArgIfLi3ELi4EL21QudaReconstructType_s12EEEEE	policy,GPU-offline,vol=248832,parity=1,precision=4,order=4,Ns=4,Nc=3,commDim=0001,xpay,topo=1112,order=01,p2p=3,gdr=0,nvshmem=0,pol=110000111100110000	32	1	1	1	1	1	0	7	1	0	-1	0.000237568	# 1960.76 Gflop/s, 1508.28 GB/s, tuning took 0.041140 seconds at Sun Aug 18 11:46:58 2024
     12x24x24x36	N4quda26WilsonCloverPreconditionedINS_15WilsonCloverArgIfLi3ELi4EL21QudaReconstructType_s12EEEEE	policy_kernel=exterior_all,GPU-offline,vol=248832,parity=1,precision=4,order=4,Ns=4,Nc=3,commDim=0001	128	1	1	108	1	1	13910	-1	-1	-1	-1	1.20859e-05	# 782.37 Gflop/s, 658.84 GB/s, tuning took 0.030213 seconds at Sun Aug 18 11:46:39 2024
     12x24x24x36	N4quda26WilsonCloverPreconditionedINS_15WilsonCloverArgIfLi3ELi4EL21QudaReconstructType_s12EEEEE	policy_kernel=exterior_all,GPU-offline,vol=248832,parity=1,precision=4,order=4,Ns=4,Nc=3,commDim=0001,dagger	32	1	1	432	1	1	8785	-1	-1	-1	-1	1.19377e-05	# 792.08 Gflop/s, 667.02 GB/s, tuning took 0.030421 seconds at Sun Aug 18 11:46:59 2024
     12x24x24x36	N4quda26WilsonCloverPreconditionedINS_15WilsonCloverArgIfLi3ELi4EL21QudaReconstructType_s12EEEEE	policy_kernel=exterior_all,GPU-offline,vol=248832,parity=1,precision=4,order=4,Ns=4,Nc=3,commDim=0001,dagger,zero_copy,p2p=0	96	1	1	144	1	1	83457	-1	-1	-1	-1	6.62187e-05	# 142.79 Gflop/s, 120.25 GB/s, tuning took 0.085691 seconds at Sun Aug 18 11:46:59 2024
     12x24x24x36	N4quda26WilsonCloverPreconditionedINS_15WilsonCloverArgIfLi3ELi4EL21QudaReconstructType_s12EEEEE	policy_kernel=exterior_all,GPU-offline,vol=248832,parity=1,precision=4,order=4,Ns=4,Nc=3,commDim=0001,dagger,zero_copy,p2p=1	32	1	1	432	1	1	5756	-1	-1	-1	-1	1.18473e-05	# 798.12 Gflop/s, 672.11 GB/s, tuning took 0.029996 seconds at Sun Aug 18 11:47:02 2024
     12x24x24x36	N4quda26WilsonCloverPreconditionedINS_15WilsonCloverArgIfLi3ELi4EL21QudaReconstructType_s12EEEEE	policy_kernel=exterior_all,GPU-offline,vol=248832,parity=1,precision=4,order=4,Ns=4,Nc=3,commDim=0001,xpay	32	1	1	432	1	1	7949	-1	-1	-1	-1	1.23149e-05	# 794.76 Gflop/s, 646.58 GB/s, tuning took 0.030568 seconds at Sun Aug 18 11:46:48 2024
     12x24x24x36	N4quda26WilsonCloverPreconditionedINS_15WilsonCloverArgIfLi3ELi4EL21QudaReconstructType_s12EEEEE	policy_kernel=exterior_all,GPU-offline,vol=248832,parity=1,precision=4,order=4,Ns=4,Nc=3,commDim=0001,xpay,zero_copy,p2p=0	96	1	1	144	1	1	83457	-1	-1	-1	-1	6.63552e-05	# 147.50 Gflop/s, 120.00 GB/s, tuning took 0.085979 seconds at Sun Aug 18 11:46:49 2024
     12x24x24x36	N4quda26WilsonCloverPreconditionedINS_15WilsonCloverArgIfLi3ELi4EL21QudaReconstructType_s12EEEEE	policy_kernel=exterior_all,GPU-offline,vol=248832,parity=1,precision=4,order=4,Ns=4,Nc=3,commDim=0001,xpay,zero_copy,p2p=1	32	1	1	432	1	1	8346	-1	-1	-1	-1	1.23149e-05	# 794.76 Gflop/s, 646.58 GB/s, tuning took 0.030383 seconds at Sun Aug 18 11:46:52 2024
     12x24x24x36	N4quda26WilsonCloverPreconditionedINS_15WilsonCloverArgIfLi3ELi4EL21QudaReconstructType_s12EEEEE	policy_kernel=exterior_all,GPU-offline,vol=248832,parity=1,precision=4,order=4,Ns=4,Nc=3,commDim=0001,zero_copy,p2p=0	96	1	1	144	1	1	83457	-1	-1	-1	-1	6.63552e-05	# 142.50 Gflop/s, 120.00 GB/s, tuning took 0.085891 seconds at Sun Aug 18 11:46:39 2024
     12x24x24x36	N4quda26WilsonCloverPreconditionedINS_15WilsonCloverArgIfLi3ELi4EL21QudaReconstructType_s12EEEEE	policy_kernel=exterior_all,GPU-offline,vol=248832,parity=1,precision=4,order=4,Ns=4,Nc=3,commDim=0001,zero_copy,p2p=1	32	1	1	432	1	1	15174	-1	-1	-1	-1	1.20994e-05	# 781.50 Gflop/s, 658.10 GB/s, tuning took 0.029938 seconds at Sun Aug 18 11:46:42 2024
     12x24x24x36	N4quda26WilsonCloverPreconditionedINS_15WilsonCloverArgIfLi3ELi4EL21QudaReconstructType_s12EEEEE	policy_kernel=exterior_t,GPU-offline,vol=248832,parity=1,precision=4,order=4,Ns=4,Nc=3,commDim=0001	128	1	1	108	1	1	16692	-1	-1	-1	-1	1.07895e-05	# 876.37 Gflop/s, 738.00 GB/s, tuning took 0.029263 seconds at Sun Aug 18 11:46:39 2024
     12x24x24x36	N4quda26WilsonCloverPreconditionedINS_15WilsonCloverArgIfLi3ELi4EL21QudaReconstructType_s12EEEEE	policy_kernel=exterior_t,GPU-offline,vol=248832,parity=1,precision=4,order=4,Ns=4,Nc=3,commDim=0001,dagger	32	1	1	432	1	1	7587	-1	-1	-1	-1	1.11733e-05	# 846.27 Gflop/s, 712.65 GB/s, tuning took 0.029699 seconds at Sun Aug 18 11:46:59 2024
     12x24x24x36	N4quda26WilsonCloverPreconditionedINS_15WilsonCloverArgIfLi3ELi4EL21QudaReconstructType_s12EEEEE	policy_kernel=exterior_t,GPU-offline,vol=248832,parity=1,precision=4,order=4,Ns=4,Nc=3,commDim=0001,dagger,zero_copy,p2p=0	128	1	1	108	1	1	20865	-1	-1	-1	-1	6.5664e-05	# 144.00 Gflop/s, 121.26 GB/s, tuning took 0.085898 seconds at Sun Aug 18 11:46:59 2024
     12x24x24x36	N4quda26WilsonCloverPreconditionedINS_15WilsonCloverArgIfLi3ELi4EL21QudaReconstructType_s12EEEEE	policy_kernel=exterior_t,GPU-offline,vol=248832,parity=1,precision=4,order=4,Ns=4,Nc=3,commDim=0001,dagger,zero_copy,p2p=1	128	1	1	108	1	1	10433	-1	-1	-1	-1	1.05773e-05	# 893.95 Gflop/s, 752.80 GB/s, tuning took 0.028544 seconds at Sun Aug 18 11:47:02 2024
     12x24x24x36	N4quda26WilsonCloverPreconditionedINS_15WilsonCloverArgIfLi3ELi4EL21QudaReconstructType_s12EEEEE	policy_kernel=exterior_t,GPU-offline,vol=248832,parity=1,precision=4,order=4,Ns=4,Nc=3,commDim=0001,xpay	32	1	1	432	1	1	5564	-1	-1	-1	-1	1.14584e-05	# 854.17 Gflop/s, 694.91 GB/s, tuning took 0.029818 seconds at Sun Aug 18 11:46:48 2024
     12x24x24x36	N4quda26WilsonCloverPreconditionedINS_15WilsonCloverArgIfLi3ELi4EL21QudaReconstructType_s12EEEEE	policy_kernel=exterior_t,GPU-offline,vol=248832,parity=1,precision=4,order=4,Ns=4,Nc=3,commDim=0001,xpay,zero_copy,p2p=0	16	1	1	864	1	1	41729	-1	-1	-1	-1	6.59456e-05	# 148.42 Gflop/s, 120.75 GB/s, tuning took 0.085367 seconds at Sun Aug 18 11:46:48 2024
     12x24x24x36	N4quda26WilsonCloverPreconditionedINS_15WilsonCloverArgIfLi3ELi4EL21QudaReconstructType_s12EEEEE	policy_kernel=exterior_t,GPU-offline,vol=248832,parity=1,precision=4,order=4,Ns=4,Nc=3,commDim=0001,xpay,zero_copy,p2p=1	128	1	1	108	1	1	10433	-1	-1	-1	-1	1.10517e-05	# 885.60 Gflop/s, 720.49 GB/s, tuning took 0.029176 seconds at Sun Aug 18 11:46:52 2024
     12x24x24x36	N4quda26WilsonCloverPreconditionedINS_15WilsonCloverArgIfLi3ELi4EL21QudaReconstructType_s12EEEEE	policy_kernel=exterior_t,GPU-offline,vol=248832,parity=1,precision=4,order=4,Ns=4,Nc=3,commDim=0001,zero_copy,p2p=0	128	1	1	108	1	1	55638	-1	-1	-1	-1	6.5664e-05	# 144.00 Gflop/s, 121.26 GB/s, tuning took 0.085788 seconds at Sun Aug 18 11:46:39 2024
     12x24x24x36	N4quda26WilsonCloverPreconditionedINS_15WilsonCloverArgIfLi3ELi4EL21QudaReconstructType_s12EEEEE	policy_kernel=exterior_t,GPU-offline,vol=248832,parity=1,precision=4,order=4,Ns=4,Nc=3,commDim=0001,zero_copy,p2p=1	128	1	1	108	1	1	41729	-1	-1	-1	-1	1.05412e-05	# 897.02 Gflop/s, 755.38 GB/s, tuning took 0.028605 seconds at Sun Aug 18 11:46:42 2024
     12x24x24x36	N4quda26WilsonCloverPreconditionedINS_15WilsonCloverArgIfLi3ELi4EL21QudaReconstructType_s12EEEEE	policy_kernel=interior,GPU-offline,vol=248832,parity=1,precision=4,order=4,Ns=4,Nc=3,commDim=0001,comm=0001	32	1	1	7776	1	1	7949	-1	-1	-1	-1	0.000160183	# 2776.49 Gflop/s, 2187.22 GB/s, tuning took 0.213730 seconds at Sun Aug 18 11:46:39 2024
     12x24x24x36	N4quda26WilsonCloverPreconditionedINS_15WilsonCloverArgIfLi3ELi4EL21QudaReconstructType_s12EEEEE	policy_kernel=interior,GPU-offline,vol=248832,parity=1,precision=4,order=4,Ns=4,Nc=3,commDim=0001,comm=0001,host-device	32	1	1	7776	1	1	5385	7	-1	-1	-1	0.000160183	# 2777.52 Gflop/s, 2199.65 GB/s, tuning took 2.678753 seconds at Sun Aug 18 11:46:45 2024
     12x24x24x36	N4quda26WilsonCloverPreconditionedINS_15WilsonCloverArgIfLi3ELi4EL21QudaReconstructType_s12EEEEE	policy_kernel=interior,GPU-offline,vol=248832,parity=1,precision=4,order=4,Ns=4,Nc=3,commDim=0001,comm=0001,host-host	128	1	1	1944	1	1	11128	1	-1	-1	-1	0.000160475	# 2772.46 Gflop/s, 2195.64 GB/s, tuning took 2.939220 seconds at Sun Aug 18 11:46:42 2024
     12x24x24x36	N4quda26WilsonCloverPreconditionedINS_15WilsonCloverArgIfLi3ELi4EL21QudaReconstructType_s12EEEEE	policy_kernel=interior,GPU-offline,vol=248832,parity=1,precision=4,order=4,Ns=4,Nc=3,commDim=0001,comm=0001,host-remote	128	1	1	1944	1	1	12840	1	-1	-1	-1	0.000160329	# 2774.99 Gflop/s, 2197.64 GB/s, tuning took 3.254835 seconds at Sun Aug 18 11:46:48 2024
     12x24x24x36	N4quda26WilsonCloverPreconditionedINS_15WilsonCloverArgIfLi3ELi4EL21QudaReconstructType_s12EEEEE	policy_kernel=interior,GPU-offline,vol=248832,parity=1,precision=4,order=4,Ns=4,Nc=3,commDim=0001,dagger,comm=0001	32	1	1	7776	1	1	6182	-1	-1	-1	-1	0.000160183	# 2776.49 Gflop/s, 2187.22 GB/s, tuning took 0.214282 seconds at Sun Aug 18 11:46:59 2024
     12x24x24x36	N4quda26WilsonCloverPreconditionedINS_15WilsonCloverArgIfLi3ELi4EL21QudaReconstructType_s12EEEEE	policy_kernel=interior,GPU-offline,vol=248832,parity=1,precision=4,order=4,Ns=4,Nc=3,commDim=0001,dagger,comm=0001,host-device	32	1	1	7776	1	1	0	8	-1	-1	-1	0.000160768	# 2767.41 Gflop/s, 2191.64 GB/s, tuning took 2.688752 seconds at Sun Aug 18 11:47:05 2024
     12x24x24x36	N4quda26WilsonCloverPreconditionedINS_15WilsonCloverArgIfLi3ELi4EL21QudaReconstructType_s12EEEEE	policy_kernel=interior,GPU-offline,vol=248832,parity=1,precision=4,order=4,Ns=4,Nc=3,commDim=0001,dagger,comm=0001,host-host	128	1	1	1944	1	1	18546	1	-1	-1	-1	0.000161207	# 2759.88 Gflop/s, 2185.68 GB/s, tuning took 2.948827 seconds at Sun Aug 18 11:47:02 2024
     12x24x24x36	N4quda26WilsonCloverPreconditionedINS_15WilsonCloverArgIfLi3ELi4EL21QudaReconstructType_s12EEEEE	policy_kernel=interior,GPU-offline,vol=248832,parity=1,precision=4,order=4,Ns=4,Nc=3,commDim=0001,dagger,comm=0001,host-remote	128	1	1	1944	1	1	16692	1	-1	-1	-1	0.000160622	# 2769.93 Gflop/s, 2193.64 GB/s, tuning took 3.251028 seconds at Sun Aug 18 11:47:10 2024
     12x24x24x36	N4quda26WilsonCloverPreconditionedINS_15WilsonCloverArgIfLi3ELi4EL21QudaReconstructType_s12EEEEE	policy_kernel=interior,GPU-offline,vol=248832,parity=1,precision=4,order=4,Ns=4,Nc=3,commDim=0001,xpay,comm=0001	128	1	1	1944	1	1	0	-1	-1	-1	-1	0.000177152	# 2577.95 Gflop/s, 1977.71 GB/s, tuning took 0.229986 seconds at Sun Aug 18 11:46:48 2024
     12x24x24x36	N4quda26WilsonCloverPreconditionedINS_15WilsonCloverArgIfLi3ELi4EL21QudaReconstructType_s12EEEEE	policy_kernel=interior,GPU-offline,vol=248832,parity=1,precision=4,order=4,Ns=4,Nc=3,commDim=0001,xpay,comm=0001,host-device	32	1	1	7776	1	1	5217	8	-1	-1	-1	0.000178176	# 2564.07 Gflop/s, 1977.52 GB/s, tuning took 2.894809 seconds at Sun Aug 18 11:46:55 2024
     12x24x24x36	N4quda26WilsonCloverPreconditionedINS_15WilsonCloverArgIfLi3ELi4EL21QudaReconstructType_s12EEEEE	policy_kernel=interior,GPU-offline,vol=248832,parity=1,precision=4,order=4,Ns=4,Nc=3,commDim=0001,xpay,comm=0001,host-host	128	1	1	1944	1	1	11923	1	-1	-1	-1	0.000178005	# 2566.53 Gflop/s, 1979.41 GB/s, tuning took 3.163907 seconds at Sun Aug 18 11:46:52 2024
     12x24x24x36	N4quda26WilsonCloverPreconditionedINS_15WilsonCloverArgIfLi3ELi4EL21QudaReconstructType_s12EEEEE	policy_kernel=interior,GPU-offline,vol=248832,parity=1,precision=4,order=4,Ns=4,Nc=3,commDim=0001,xpay,comm=0001,host-remote	128	1	1	1944	1	1	18546	1	-1	-1	-1	0.000177835	# 2568.99 Gflop/s, 1981.31 GB/s, tuning took 3.486443 seconds at Sun Aug 18 11:46:58 2024
     12x24x24x36	N4quda4PackIdLi3ELb1EEE	policy_kernel,vol=248832,parity=1,precision=8,order=2,Ns=4,Nc=3,comm=0001,topo=1112,order=01,nFace=1,device-device	288	1	1	53	1	1	0	-1	-1	-1	-1	5.73033e-06	# 28.95 Gflop/s, 694.78 GB/s, tuning took 0.244595 seconds at Sun Aug 18 11:54:45 2024
     12x24x24x36	N4quda4PackIdLi3ELb1EEE	policy_kernel,vol=248832,parity=1,precision=8,order=2,Ns=4,Nc=3,comm=0001,topo=1112,order=01,nFace=1,device-remote	64	1	1	1	1	1	0	-1	-1	-1	-1	0.000184661	# 0.90 Gflop/s, 21.56 GB/s, tuning took 4.540957 seconds at Sun Aug 18 11:55:01 2024
     12x24x24x36	N4quda4PackIdLi3ELb1EEE	policy_kernel,vol=248832,parity=1,precision=8,order=2,Ns=4,Nc=3,comm=0001,topo=1112,order=01,nFace=1,host-device	384	1	1	3	1	1	0	-1	-1	-1	-1	1.89544e-05	# 8.75 Gflop/s, 210.05 GB/s, tuning took 0.022757 seconds at Sun Aug 18 11:54:51 2024
     12x24x24x36	N4quda4PackIdLi3ELb1EEE	policy_kernel,vol=248832,parity=1,precision=8,order=2,Ns=4,Nc=3,comm=0001,topo=1112,order=01,nFace=1,host-host	96	1	1	1	1	1	0	-1	-1	-1	-1	0.000105472	# 1.57 Gflop/s, 37.75 GB/s, tuning took 0.044237 seconds at Sun Aug 18 11:54:46 2024
     12x24x24x36	N4quda4PackIdLi3ELb1EEE	policy_kernel,vol=248832,parity=1,precision=8,order=2,Ns=4,Nc=3,comm=0001,topo=1112,order=01,nFace=1,host-remote	96	1	1	1	1	1	0	-1	-1	-1	-1	0.000184149	# 0.90 Gflop/s, 21.62 GB/s, tuning took 0.070778 seconds at Sun Aug 18 11:55:01 2024
     12x24x24x36	N4quda4PackIfLi3ELb1EEE	policy_kernel,vol=248832,parity=1,precision=4,order=4,Ns=4,Nc=3,comm=0001,topo=1112,order=01,dagger,nFace=1,device-device	960	1	1	43	1	1	0	-1	-1	-1	-1	5.17654e-06	# 32.05 Gflop/s, 384.55 GB/s, tuning took 0.227524 seconds at Sun Aug 18 11:46:59 2024
     12x24x24x36	N4quda4PackIfLi3ELb1EEE	policy_kernel,vol=248832,parity=1,precision=4,order=4,Ns=4,Nc=3,comm=0001,topo=1112,order=01,dagger,nFace=1,device-remote	96	1	1	1	1	1	0	-1	-1	-1	-1	9.07636e-05	# 1.83 Gflop/s, 21.93 GB/s, tuning took 2.340215 seconds at Sun Aug 18 11:47:07 2024
     12x24x24x36	N4quda4PackIfLi3ELb1EEE	policy_kernel,vol=248832,parity=1,precision=4,order=4,Ns=4,Nc=3,comm=0001,topo=1112,order=01,dagger,nFace=1,host-device	672	1	1	3	1	1	0	-1	-1	-1	-1	1.20455e-05	# 13.77 Gflop/s, 165.26 GB/s, tuning took 0.018661 seconds at Sun Aug 18 11:47:02 2024
     12x24x24x36	N4quda4PackIfLi3ELb1EEE	policy_kernel,vol=248832,parity=1,precision=4,order=4,Ns=4,Nc=3,comm=0001,topo=1112,order=01,dagger,nFace=1,host-host	128	1	1	1	1	1	0	-1	-1	-1	-1	5.48409e-05	# 3.02 Gflop/s, 36.30 GB/s, tuning took 0.028829 seconds at Sun Aug 18 11:46:59 2024
     12x24x24x36	N4quda4PackIfLi3ELb1EEE	policy_kernel,vol=248832,parity=1,precision=4,order=4,Ns=4,Nc=3,comm=0001,topo=1112,order=01,dagger,nFace=1,host-remote	128	1	1	1	1	1	0	-1	-1	-1	-1	9.12291e-05	# 1.82 Gflop/s, 21.82 GB/s, tuning took 0.041181 seconds at Sun Aug 18 11:47:07 2024
     12x24x24x36	N4quda4PackIfLi3ELb1EEE	policy_kernel,vol=248832,parity=1,precision=4,order=4,Ns=4,Nc=3,comm=0001,topo=1112,order=01,nFace=1,device-device	960	1	1	43	1	1	0	-1	-1	-1	-1	5.18282e-06	# 32.01 Gflop/s, 384.09 GB/s, tuning took 0.225395 seconds at Sun Aug 18 11:46:27 2024
     12x24x24x36	N4quda4PackIfLi3ELb1EEE	policy_kernel,vol=248832,parity=1,precision=4,order=4,Ns=4,Nc=3,comm=0001,topo=1112,order=01,nFace=1,device-remote	96	1	1	1	1	1	0	-1	-1	-1	-1	9.0624e-05	# 1.83 Gflop/s, 21.97 GB/s, tuning took 2.335032 seconds at Sun Aug 18 11:46:35 2024
     12x24x24x36	N4quda4PackIfLi3ELb1EEE	policy_kernel,vol=248832,parity=1,precision=4,order=4,Ns=4,Nc=3,comm=0001,topo=1112,order=01,nFace=1,host-device	576	1	1	3	1	1	0	-1	-1	-1	-1	1.17306e-05	# 14.14 Gflop/s, 169.70 GB/s, tuning took 0.018426 seconds at Sun Aug 18 11:46:30 2024
     12x24x24x36	N4quda4PackIfLi3ELb1EEE	policy_kernel,vol=248832,parity=1,precision=4,order=4,Ns=4,Nc=3,comm=0001,topo=1112,order=01,nFace=1,host-host	128	1	1	1	1	1	0	-1	-1	-1	-1	5.4784e-05	# 3.03 Gflop/s, 36.34 GB/s, tuning took 0.028737 seconds at Sun Aug 18 11:46:27 2024
     12x24x24x36	N4quda4PackIfLi3ELb1EEE	policy_kernel,vol=248832,parity=1,precision=4,order=4,Ns=4,Nc=3,comm=0001,topo=1112,order=01,nFace=1,host-remote	96	1	1	1	1	1	0	-1	-1	-1	-1	8.98327e-05	# 1.85 Gflop/s, 22.16 GB/s, tuning took 0.041077 seconds at Sun Aug 18 11:46:35 2024
     12x24x24x36	N4quda4blas10CdotNormABIdfEE	GPU-offline,vol=248832,parity=1,precision=4,order=4,Ns=4,Nc=3	384	1	1	210	1	1	0	-1	-1	-1	-1	4.62581e-05	# 1032.81 Gflop/s, 1032.81 GB/s, tuning took 0.373407 seconds at Sun Aug 18 11:54:44 2024
     12x24x24x36	N4quda4blas10caxpyxmaz_IfEE	GPU-offline,vol=248832,parity=1,precision=4,order=4,Ns=4,Nc=3	800	1	1	216	1	1	0	-1	-1	-1	-1	9.4208e-05	# 507.13 Gflop/s, 1267.83 GB/s, tuning took 0.021278 seconds at Sun Aug 18 11:54:44 2024
     12x24x24x36	N4quda4blas10multiaxpy_IfEE	GPU-offline,cmem,vol=248832,parity=1,precision=4,order=4,Ns=4,Nc=3,Nxz=1,Nyw=1	992	1	1	216	1	1	0	1	0	0	0	5.96932e-05	# 200.09 Gflop/s, 1200.53 GB/s, tuning took 0.018089 seconds at Sun Aug 18 11:47:21 2024
     12x24x24x36	N4quda4blas11axpbyzNorm2IddEE	GPU-offline,vol=248832,parity=1,precision=8,order=2,Ns=4,Nc=3	480	1	1	192	1	1	0	-1	-1	-1	-1	0.00011685	# 204.43 Gflop/s, 1226.59 GB/s, tuning took 0.764548 seconds at Sun Aug 18 11:55:26 2024
     12x24x24x36	N4quda4blas11axpbyzNorm2IdfEE	GPU-offline,vol=248832,parity=1,precision=4,order=4,Ns=4,Nc=3	992	1	1	192	1	1	0	-1	-1	-1	-1	6.25242e-05	# 382.06 Gflop/s, 1146.17 GB/s, tuning took 0.422161 seconds at Sun Aug 18 11:47:20 2024
     12x24x24x36	N4quda4blas11multicaxpy_IdEE	GPU-offline,cmem,vol=248832,parity=1,precision=4,order=4,Ns=4,Nc=3,vol=248832,parity=1,precision=8,order=2,Ns=4,Nc=3,Nxz=1,Nyw=1	288	1	1	216	1	1	0	1	0	0	0	9.84902e-05	# 242.54 Gflop/s, 1212.70 GB/s, tuning took 0.019094 seconds at Sun Aug 18 11:54:45 2024
     12x24x24x36	N4quda4blas11multicaxpy_IdEE	GPU-offline,cmem,vol=248832,parity=1,precision=4,order=4,Ns=4,Nc=3,vol=248832,parity=1,precision=8,order=2,Ns=4,Nc=3,Nxz=2,Nyw=1	288	1	1	216	1	1	0	1	0	0	0	0.000115598	# 413.29 Gflop/s, 1239.87 GB/s, tuning took 0.020181 seconds at Sun Aug 18 11:55:26 2024
     12x24x24x36	N4quda4blas13cabxpyzaxnormIdfEE	GPU-offline,vol=248832,parity=1,precision=4,order=4,Ns=4,Nc=3	992	1	1	192	1	1	0	-1	-1	-1	-1	8.25501e-05	# 723.44 Gflop/s, 1157.50 GB/s, tuning took 0.485238 seconds at Sun Aug 18 11:54:45 2024
     12x24x24x36	N4quda4blas15tripleCGUpdate_IfEE	GPU-offline,vol=248832,parity=1,precision=4,order=4,Ns=4,Nc=3	960	1	1	216	1	1	0	-1	-1	-1	-1	0.000130048	# 275.53 Gflop/s, 1285.80 GB/s, tuning took 0.025108 seconds at Sun Aug 18 11:47:21 2024
     12x24x24x36	N4quda4blas18tripleCGReduction_IdfEE	GPU-offline,vol=248832,parity=1,precision=4,order=4,Ns=4,Nc=3	384	1	1	108	1	1	0	-1	-1	-1	-1	6.144e-05	# 583.20 Gflop/s, 1166.40 GB/s, tuning took 0.421981 seconds at Sun Aug 18 11:47:21 2024
     12x24x24x36	N4quda4blas23HeavyQuarkResidualNorm_IdfEE	GPU-offline,vol=248832,parity=1,precision=4,order=4,Ns=4,Nc=3	448	1	1	96	1	1	0	-1	-1	-1	-1	4.55012e-05	# 524.99 Gflop/s, 1049.99 GB/s, tuning took 0.306097 seconds at Sun Aug 18 11:47:22 2024
     12x24x24x36	N4quda4blas4CdotIdfEE	GPU-offline,vol=248832,parity=1,precision=4,order=4,Ns=4,Nc=3	384	1	1	174	1	1	0	-1	-1	-1	-1	4.52341e-05	# 528.09 Gflop/s, 1056.19 GB/s, tuning took 0.365045 seconds at Sun Aug 18 11:47:21 2024
     12x24x24x36	N4quda4blas4axy_IfEE	GPU-offline,vol=248832,parity=1,precision=4,order=4,Ns=4,Nc=3	928	1	1	216	1	1	0	-1	-1	-1	-1	1.94084e-05	# 307.70 Gflop/s, 2461.60 GB/s, tuning took 0.013303 seconds at Sun Aug 18 11:54:44 2024
     12x24x24x36	N4quda4blas5Norm2IddEE	GPU-offline,vol=248832,parity=1,precision=8,order=2,Ns=4,Nc=3	1024	1	1	96	1	1	0	-1	-1	-1	-1	4.36758e-05	# 273.47 Gflop/s, 1093.87 GB/s, tuning took 0.504940 seconds at Sun Aug 18 11:54:36 2024
     12x24x24x36	N4quda4blas5Norm2IdfEE	GPU-offline,vol=248832,parity=1,precision=4,order=4,Ns=4,Nc=3	1024	1	1	192	1	1	0	-1	-1	-1	-1	1.45687e-05	# 819.83 Gflop/s, 1639.67 GB/s, tuning took 0.175848 seconds at Sun Aug 18 11:46:39 2024
     12x24x24x36	N4quda4blas6caxpy_IfEE	GPU-offline,vol=248832,parity=1,precision=4,order=4,Ns=4,Nc=3	1024	1	1	216	1	1	0	-1	-1	-1	-1	5.49547e-05	# 434.68 Gflop/s, 1304.05 GB/s, tuning took 0.016890 seconds at Sun Aug 18 11:47:21 2024
     12x24x24x36	N4quda4blas7axpbyz_IfEE	GPU-offline,vol=248832,parity=1,precision=4,order=4,Ns=4,Nc=3	1024	1	1	216	1	1	0	-1	-1	-1	-1	5.50265e-05	# 325.59 Gflop/s, 1302.35 GB/s, tuning took 0.017658 seconds at Sun Aug 18 11:47:21 2024
     12x24x24x36	N4quda4blas9axpyZpbx_IfEE	GPU-offline,vol=248832,parity=1,precision=4,order=4,Ns=4,Nc=3	768	1	1	216	1	1	0	-1	-1	-1	-1	9.40218e-05	# 254.07 Gflop/s, 1270.34 GB/s, tuning took 0.021218 seconds at Sun Aug 18 11:47:21 2024
     12x24x24x36	N4quda6CloverIfLi3EEE	GPU-offline,cmem,vol=248832,parity=1,precision=4,order=4,Ns=4,Nc=3	64	1	1	3888	1	1	1586	-1	-1	-1	-1	8.32e-05	# 1507.35 Gflop/s, 1244.16 GB/s, tuning took 0.077000 seconds at Sun Aug 18 11:46:26 2024
     12x24x24x36	N4quda6WilsonINS_9WilsonArgIfLi3ELi4EL21QudaReconstructType_s12EEEEE	policy,GPU-offline,vol=248832,parity=1,precision=4,order=4,Ns=4,Nc=3,commDim=0001,xpay,dagger,topo=1112,order=01,p2p=3,gdr=0,nvshmem=0,pol=110000111100110000	32	1	1	1	1	1	0	8	1	0	-1	0.000173739	# 1959.28 Gflop/s, 1649.92 GB/s, tuning took 0.034671 seconds at Sun Aug 18 11:47:20 2024
     12x24x24x36	N4quda6WilsonINS_9WilsonArgIfLi3ELi4EL21QudaReconstructType_s12EEEEE	policy,GPU-offline,vol=248832,parity=1,precision=4,order=4,Ns=4,Nc=3,commDim=0001,xpay,topo=1112,order=01,p2p=3,gdr=0,nvshmem=0,pol=110000111100110000	32	1	1	1	1	1	0	0	1	0	-1	0.000174763	# 1947.80 Gflop/s, 1640.25 GB/s, tuning took 0.040684 seconds at Sun Aug 18 11:46:38 2024
     12x24x24x36	N4quda6WilsonINS_9WilsonArgIfLi3ELi4EL21QudaReconstructType_s12EEEEE	policy_kernel=exterior_all,GPU-offline,vol=248832,parity=1,precision=4,order=4,Ns=4,Nc=3,commDim=0001,xpay	32	1	1	432	1	1	6677	-1	-1	-1	-1	7.68445e-06	# 366.99 Gflop/s, 518.10 GB/s, tuning took 0.025600 seconds at Sun Aug 18 11:46:27 2024
     12x24x24x36	N4quda6WilsonINS_9WilsonArgIfLi3ELi4EL21QudaReconstructType_s12EEEEE	policy_kernel=exterior_all,GPU-offline,vol=248832,parity=1,precision=4,order=4,Ns=4,Nc=3,commDim=0001,xpay,dagger	176	1	1	79	1	1	16692	-1	-1	-1	-1	7.61322e-06	# 370.42 Gflop/s, 522.95 GB/s, tuning took 0.026044 seconds at Sun Aug 18 11:47:11 2024
     12x24x24x36	N4quda6WilsonINS_9WilsonArgIfLi3ELi4EL21QudaReconstructType_s12EEEEE	policy_kernel=exterior_all,GPU-offline,vol=248832,parity=1,precision=4,order=4,Ns=4,Nc=3,commDim=0001,xpay,dagger,zero_copy,p2p=0	32	1	1	432	1	1	41729	-1	-1	-1	-1	6.2592e-05	# 45.06 Gflop/s, 63.61 GB/s, tuning took 0.098003 seconds at Sun Aug 18 11:47:11 2024
     12x24x24x36	N4quda6WilsonINS_9WilsonArgIfLi3ELi4EL21QudaReconstructType_s12EEEEE	policy_kernel=exterior_all,GPU-offline,vol=248832,parity=1,precision=4,order=4,Ns=4,Nc=3,commDim=0001,xpay,dagger,zero_copy,p2p=1	80	1	1	173	1	1	11128	-1	-1	-1	-1	7.75569e-06	# 363.62 Gflop/s, 513.34 GB/s, tuning took 0.025908 seconds at Sun Aug 18 11:47:14 2024
     12x24x24x36	N4quda6WilsonINS_9WilsonArgIfLi3ELi4EL21QudaReconstructType_s12EEEEE	policy_kernel=exterior_all,GPU-offline,vol=248832,parity=1,precision=4,order=4,Ns=4,Nc=3,commDim=0001,xpay,zero_copy,p2p=0	80	1	1	173	1	1	83457	-1	-1	-1	-1	6.2656e-05	# 45.01 Gflop/s, 63.54 GB/s, tuning took 0.097990 seconds at Sun Aug 18 11:46:27 2024
     12x24x24x36	N4quda6WilsonINS_9WilsonArgIfLi3ELi4EL21QudaReconstructType_s12EEEEE	policy_kernel=exterior_all,GPU-offline,vol=248832,parity=1,precision=4,order=4,Ns=4,Nc=3,commDim=0001,xpay,zero_copy,p2p=1	48	1	1	288	1	1	8346	-1	-1	-1	-1	7.66664e-06	# 367.84 Gflop/s, 519.30 GB/s, tuning took 0.025590 seconds at Sun Aug 18 11:46:30 2024
     12x24x24x36	N4quda6WilsonINS_9WilsonArgIfLi3ELi4EL21QudaReconstructType_s12EEEEE	policy_kernel=exterior_t,GPU-offline,vol=248832,parity=1,precision=4,order=4,Ns=4,Nc=3,commDim=0001,xpay	208	1	1	67	1	1	23845	-1	-1	-1	-1	6.76153e-06	# 417.08 Gflop/s, 588.82 GB/s, tuning took 0.025571 seconds at Sun Aug 18 11:46:27 2024
     12x24x24x36	N4quda6WilsonINS_9WilsonArgIfLi3ELi4EL21QudaReconstructType_s12EEEEE	policy_kernel=exterior_t,GPU-offline,vol=248832,parity=1,precision=4,order=4,Ns=4,Nc=3,commDim=0001,xpay,dagger	32	1	1	432	1	1	16692	-1	-1	-1	-1	7.27485e-06	# 387.65 Gflop/s, 547.27 GB/s, tuning took 0.026163 seconds at Sun Aug 18 11:47:11 2024
     12x24x24x36	N4quda6WilsonINS_9WilsonArgIfLi3ELi4EL21QudaReconstructType_s12EEEEE	policy_kernel=exterior_t,GPU-offline,vol=248832,parity=1,precision=4,order=4,Ns=4,Nc=3,commDim=0001,xpay,dagger,zero_copy,p2p=0	32	1	1	432	1	1	5217	-1	-1	-1	-1	6.2336e-05	# 45.24 Gflop/s, 63.87 GB/s, tuning took 0.100722 seconds at Sun Aug 18 11:47:11 2024
     12x24x24x36	N4quda6WilsonINS_9WilsonArgIfLi3ELi4EL21QudaReconstructType_s12EEEEE	policy_kernel=exterior_t,GPU-offline,vol=248832,parity=1,precision=4,order=4,Ns=4,Nc=3,commDim=0001,xpay,dagger,zero_copy,p2p=1	32	1	1	432	1	1	27819	-1	-1	-1	-1	7.07642e-06	# 398.52 Gflop/s, 562.62 GB/s, tuning took 0.025324 seconds at Sun Aug 18 11:47:14 2024
     12x24x24x36	N4quda6WilsonINS_9WilsonArgIfLi3ELi4EL21QudaReconstructType_s12EEEEE	policy_kernel=exterior_t,GPU-offline,vol=248832,parity=1,precision=4,order=4,Ns=4,Nc=3,commDim=0001,xpay,zero_copy,p2p=0	224	1	1	62	1	1	41729	-1	-1	-1	-1	6.2272e-05	# 45.29 Gflop/s, 63.93 GB/s, tuning took 0.100348 seconds at Sun Aug 18 11:46:27 2024
     12x24x24x36	N4quda6WilsonINS_9WilsonArgIfLi3ELi4EL21QudaReconstructType_s12EEEEE	policy_kernel=exterior_t,GPU-offline,vol=248832,parity=1,precision=4,order=4,Ns=4,Nc=3,commDim=0001,xpay,zero_copy,p2p=1	208	1	1	67	1	1	27819	-1	-1	-1	-1	6.76934e-06	# 416.60 Gflop/s, 588.14 GB/s, tuning took 0.025421 seconds at Sun Aug 18 11:46:30 2024
     12x24x24x36	N4quda6WilsonINS_9WilsonArgIfLi3ELi4EL21QudaReconstructType_s12EEEEE	policy_kernel=interior,GPU-offline,vol=248832,parity=1,precision=4,order=4,Ns=4,Nc=3,commDim=0001,xpay,comm=0001	48	1	1	5184	1	1	5385	-1	-1	-1	-1	0.000133888	# 2526.33 Gflop/s, 2111.27 GB/s, tuning took 0.207504 seconds at Sun Aug 18 11:46:27 2024
     12x24x24x36	N4quda6WilsonINS_9WilsonArgIfLi3ELi4EL21QudaReconstructType_s12EEEEE	policy_kernel=interior,GPU-offline,vol=248832,parity=1,precision=4,order=4,Ns=4,Nc=3,commDim=0001,xpay,comm=0001,host-device	48	1	1	5184	1	1	5564	10	-1	-1	-1	0.000134528	# 2515.55 Gflop/s, 2116.02 GB/s, tuning took 2.561891 seconds at Sun Aug 18 11:46:33 2024
     12x24x24x36	N4quda6WilsonINS_9WilsonArgIfLi3ELi4EL21QudaReconstructType_s12EEEEE	policy_kernel=interior,GPU-offline,vol=248832,parity=1,precision=4,order=4,Ns=4,Nc=3,commDim=0001,xpay,comm=0001,host-host	240	1	1	1037	1	1	55638	1	-1	-1	-1	0.000136064	# 2487.15 Gflop/s, 2092.13 GB/s, tuning took 2.858342 seconds at Sun Aug 18 11:46:30 2024
     12x24x24x36	N4quda6WilsonINS_9WilsonArgIfLi3ELi4EL21QudaReconstructType_s12EEEEE	policy_kernel=interior,GPU-offline,vol=248832,parity=1,precision=4,order=4,Ns=4,Nc=3,commDim=0001,xpay,comm=0001,host-remote	48	1	1	5184	1	1	6182	4	-1	-1	-1	0.000136576	# 2477.83 Gflop/s, 2084.29 GB/s, tuning took 3.234042 seconds at Sun Aug 18 11:46:38 2024
     12x24x24x36	N4quda6WilsonINS_9WilsonArgIfLi3ELi4EL21QudaReconstructType_s12EEEEE	policy_kernel=interior,GPU-offline,vol=248832,parity=1,precision=4,order=4,Ns=4,Nc=3,commDim=0001,xpay,dagger,comm=0001	160	1	1	1556	1	1	41729	-1	-1	-1	-1	0.00013504	# 2504.78 Gflop/s, 2093.26 GB/s, tuning took 0.209907 seconds at Sun Aug 18 11:47:11 2024
     12x24x24x36	N4quda6WilsonINS_9WilsonArgIfLi3ELi4EL21QudaReconstructType_s12EEEEE	policy_kernel=interior,GPU-offline,vol=248832,parity=1,precision=4,order=4,Ns=4,Nc=3,commDim=0001,xpay,dagger,comm=0001,host-device	160	1	1	1556	1	1	41729	3	-1	-1	-1	0.000135552	# 2496.54 Gflop/s, 2100.03 GB/s, tuning took 2.597757 seconds at Sun Aug 18 11:47:16 2024
     12x24x24x36	N4quda6WilsonINS_9WilsonArgIfLi3ELi4EL21QudaReconstructType_s12EEEEE	policy_kernel=interior,GPU-offline,vol=248832,parity=1,precision=4,order=4,Ns=4,Nc=3,commDim=0001,xpay,dagger,comm=0001,host-host	160	1	1	1556	1	1	41729	1	-1	-1	-1	0.000135936	# 2489.49 Gflop/s, 2094.10 GB/s, tuning took 2.884256 seconds at Sun Aug 18 11:47:14 2024
     12x24x24x36	N4quda6WilsonINS_9WilsonArgIfLi3ELi4EL21QudaReconstructType_s12EEEEE	policy_kernel=interior,GPU-offline,vol=248832,parity=1,precision=4,order=4,Ns=4,Nc=3,commDim=0001,xpay,dagger,comm=0001,host-remote	160	1	1	1556	1	1	41729	1	-1	-1	-1	0.00013568	# 2494.19 Gflop/s, 2098.05 GB/s, tuning took 3.253904 seconds at Sun Aug 18 11:47:20 2024
12x24x24x36,8x8x8x18	N4quda14RestrictLaunchIffLi4ELi3ELi2ELi24EEE	GPU-offline,vol=248832,parity=1,precision=4,order=4,Ns=4,Nc=3,vol=9216,parity=2,precision=4,order=2,Ns=2,Nc=24	32	1	6	9216	1	1	0	8	-1	-1	-1	0.000644779	# 889.16 Gflop/s, 933.24 GB/s, tuning took 4.971939 seconds at Sun Aug 18 11:54:41 2024
     12x24x24x72	N4quda15CopyColorSpinorILi4ELi3ENS_11colorspinor11FloatNOrderIfLi4ELi3ELi4ELb0ELb0EEES3_St5tupleIJRNS_16ColorSpinorFieldERKS5_19QudaFieldLocation_sPfPKfEEEE	GPU-offline,cmem,vol=497664,parity=1,precision=4,order=4,Ns=4,Nc=3vol=497664,parity=1,precision=4,order=4,Ns=4,Nc=3,PreserveBasis	32	1	1	15552	1	1	0	-1	-1	-1	-1	7.59954e-05	# 0.00 Gflop/s, 1257.33 GB/s, tuning took 0.019551 seconds at Tue Mar  4 23:52:39 2025
     12x24x24x72	N4quda26WilsonCloverPreconditionedINS_15WilsonCloverArgIfLi3ELi4EL21QudaReconstructType_s12EEEEE	policy,GPU-offline,vol=497664,parity=1,precision=4,order=4,Ns=4,Nc=3,commDim=0000,dagger,topo=1111,order=0,p2p=0,gdr=0,nvshmem=0,pol=110000111100110000	32	1	1	1	1	1	0	1	0	0	-1	0.000336213	# 2699.89 Gflop/s, 2131.49 GB/s, tuning took 0.019193 seconds at Tue Mar  4 23:52:38 2025
     12x24x24x72	N4quda26WilsonCloverPreconditionedINS_15WilsonCloverArgIfLi3ELi4EL21QudaReconstructType_s12EEEEE	policy,GPU-offline,vol=497664,parity=1,precision=4,order=4,Ns=4,Nc=3,commDim=0000,topo=1111,order=0,p2p=0,gdr=0,nvshmem=0,pol=110000111100110000	32	1	1	1	1	1	0	9	0	0	-1	0.000338261	# 2683.54 Gflop/s, 2118.59 GB/s, tuning took 0.019274 seconds at Tue Mar  4 23:52:37 2025
     12x24x24x72	N4quda26WilsonCloverPreconditionedINS_15WilsonCloverArgIfLi3ELi4EL21QudaReconstructType_s12EEEEE	policy,GPU-offline,vol=497664,parity=1,precision=4,order=4,Ns=4,Nc=3,commDim=0000,xpay,topo=1111,order=0,p2p=0,gdr=0,nvshmem=0,pol=110000111100110000	32	1	1	1	1	1	0	7	0	0	-1	0.000367275	# 2536.59 Gflop/s, 1951.23 GB/s, tuning took 0.020868 seconds at Tue Mar  4 23:52:37 2025
     12x24x24x72	N4quda26WilsonCloverPreconditionedINS_15WilsonCloverArgIfLi3ELi4EL21QudaReconstructType_s12EEEEE	policy_kernel=interior,GPU-offline,vol=497664,parity=1,precision=4,order=4,Ns=4,Nc=3,commDim=0000,comm=0000	32	1	1	15552	1	1	7258	-1	-1	-1	-1	0.000334336	# 2715.05 Gflop/s, 2143.46 GB/s, tuning took 0.423638 seconds at Tue Mar  4 23:52:37 2025
     12x24x24x72	N4quda26WilsonCloverPreconditionedINS_15WilsonCloverArgIfLi3ELi4EL21QudaReconstructType_s12EEEEE	policy_kernel=interior,GPU-offline,vol=497664,parity=1,precision=4,order=4,Ns=4,Nc=3,commDim=0000,dagger,comm=0000	32	1	1	15552	1	1	10433	-1	-1	-1	-1	0.000333824	# 2719.21 Gflop/s, 2146.75 GB/s, tuning took 0.428357 seconds at Tue Mar  4 23:52:38 2025
     12x24x24x72	N4quda26WilsonCloverPreconditionedINS_15WilsonCloverArgIfLi3ELi4EL21QudaReconstructType_s12EEEEE	policy_kernel=interior,GPU-offline,vol=497664,parity=1,precision=4,order=4,Ns=4,Nc=3,commDim=0000,xpay,comm=0000	32	1	1	15552	1	1	6182	-1	-1	-1	-1	0.000364885	# 2553.21 Gflop/s, 1964.00 GB/s, tuning took 0.459914 seconds at Tue Mar  4 23:52:37 2025
     12x24x24x72	N4quda4blas10multiaxpy_IfEE	GPU-offline,cmem,vol=497664,parity=1,precision=4,order=4,Ns=4,Nc=3,Nxz=1,Nyw=1	448	1	1	216	1	1	0	1	0	0	0	0.000114802	# 208.08 Gflop/s, 1248.48 GB/s, tuning took 0.024530 seconds at Tue Mar  4 23:52:40 2025
     12x24x24x72	N4quda4blas11axpbyzNorm2IdfEE	GPU-offline,vol=497664,parity=1,precision=4,order=4,Ns=4,Nc=3	1024	1	1	96	1	1	0	-1	-1	-1	-1	0.000117077	# 408.07 Gflop/s, 1224.21 GB/s, tuning took 0.790041 seconds at Tue Mar  4 23:52:39 2025
     12x24x24x72	N4quda4blas15tripleCGUpdate_IfEE	GPU-offline,vol=497664,parity=1,precision=4,order=4,Ns=4,Nc=3	864	1	1	216	1	1	0	-1	-1	-1	-1	0.000254208	# 281.91 Gflop/s, 1315.58 GB/s, tuning took 0.038392 seconds at Tue Mar  4 23:52:40 2025
     12x24x24x72	N4quda4blas18tripleCGReduction_IdfEE	GPU-offline,vol=497664,parity=1,precision=4,order=4,Ns=4,Nc=3	608	1	1	192	1	1	0	-1	-1	-1	-1	0.00011049	# 648.60 Gflop/s, 1297.20 GB/s, tuning took 0.780974 seconds at Tue Mar  4 23:52:40 2025
     12x24x24x72	N4quda4blas23HeavyQuarkResidualNorm_IdfEE	GPU-offline,vol=497664,parity=1,precision=4,order=4,Ns=4,Nc=3	608	1	1	192	1	1	0	-1	-1	-1	-1	7.8848e-05	# 605.92 Gflop/s, 1211.84 GB/s, tuning took 0.539333 seconds at Tue Mar  4 23:52:41 2025
     12x24x24x72	N4quda4blas4CdotIdfEE	GPU-offline,vol=497664,parity=1,precision=4,order=4,Ns=4,Nc=3	736	1	1	96	1	1	0	-1	-1	-1	-1	7.97932e-05	# 598.74 Gflop/s, 1197.49 GB/s, tuning took 0.670433 seconds at Tue Mar  4 23:52:40 2025
     12x24x24x72	N4quda4blas5Norm2IdfEE	GPU-offline,vol=497664,parity=1,precision=4,order=4,Ns=4,Nc=3	608	1	1	192	1	1	0	-1	-1	-1	-1	4.46553e-05	# 534.94 Gflop/s, 1069.88 GB/s, tuning took 0.538515 seconds at Tue Mar  4 23:52:36 2025
     12x24x24x72	N4quda4blas6caxpy_IfEE	GPU-offline,vol=497664,parity=1,precision=4,order=4,Ns=4,Nc=3	384	1	1	216	1	1	0	-1	-1	-1	-1	0.00011008	# 434.01 Gflop/s, 1302.03 GB/s, tuning took 0.024306 seconds at Tue Mar  4 23:52:41 2025
     12x24x24x72	N4quda4blas7axpbyz_IfEE	GPU-offline,vol=497664,parity=1,precision=4,order=4,Ns=4,Nc=3	384	1	1	216	1	1	0	-1	-1	-1	-1	0.00011049	# 324.30 Gflop/s, 1297.20 GB/s, tuning took 0.024379 seconds at Tue Mar  4 23:52:40 2025
     12x24x24x72	N4quda4blas9axpyZpbx_IfEE	GPU-offline,vol=497664,parity=1,precision=4,order=4,Ns=4,Nc=3	416	1	1	216	1	1	0	-1	-1	-1	-1	0.000183467	# 260.41 Gflop/s, 1302.03 GB/s, tuning took 0.031721 seconds at Tue Mar  4 23:52:41 2025
     12x24x24x72	N4quda6CloverIfLi3EEE	GPU-offline,cmem,vol=497664,parity=1,precision=4,order=4,Ns=4,Nc=3	64	1	1	7776	1	1	1537	-1	-1	-1	-1	0.000156965	# 1597.96 Gflop/s, 1318.95 GB/s, tuning took 0.135960 seconds at Tue Mar  4 23:52:35 2025
     12x24x24x72	N4quda6WilsonINS_9WilsonArgIfLi3ELi4EL21QudaReconstructType_s12EEEEE	policy,GPU-offline,vol=497664,parity=1,precision=4,order=4,Ns=4,Nc=3,commDim=0000,xpay,dagger,topo=1111,order=0,p2p=0,gdr=0,nvshmem=0,pol=110000111100110000	32	1	1	1	1	1	0	8	0	0	-1	0.000274944	# 2476.16 Gflop/s, 2085.18 GB/s, tuning took 0.018026 seconds at Tue Mar  4 23:52:38 2025
     12x24x24x72	N4quda6WilsonINS_9WilsonArgIfLi3ELi4EL21QudaReconstructType_s12EEEEE	policy,GPU-offline,vol=497664,parity=1,precision=4,order=4,Ns=4,Nc=3,commDim=0000,xpay,topo=1111,order=0,p2p=0,gdr=0,nvshmem=0,pol=110000111100110000	32	1	1	1	1	1	0	6	0	0	-1	0.000274944	# 2476.16 Gflop/s, 2085.18 GB/s, tuning took 0.018175 seconds at Tue Mar  4 23:52:36 2025
     12x24x24x72	N4quda6WilsonINS_9WilsonArgIfLi3ELi4EL21QudaReconstructType_s12EEEEE	policy_kernel=interior,GPU-offline,vol=497664,parity=1,precision=4,order=4,Ns=4,Nc=3,commDim=0000,xpay,comm=0000	432	1	1	1152	1	1	83457	-1	-1	-1	-1	0.000274944	# 2476.16 Gflop/s, 2085.18 GB/s, tuning took 0.409698 seconds at Tue Mar  4 23:52:36 2025
     12x24x24x72	N4quda6WilsonINS_9WilsonArgIfLi3ELi4EL21QudaReconstructType_s12EEEEE	policy_kernel=interior,GPU-offline,vol=497664,parity=1,precision=4,order=4,Ns=4,Nc=3,commDim=0000,xpay,dagger,comm=0000	128	1	1	3888	1	1	33383	-1	-1	-1	-1	0.000275712	# 2469.26 Gflop/s, 2079.38 GB/s, tuning took 0.412531 seconds at Tue Mar  4 23:52:38 2025
     24x24x24x36	N4quda10BlockOrthoIffLi4ELi2ELi3ELi2ELi24EEE	GPU-offline,cmem,vol=497664,parity=2,precision=4,order=4,Ns=4,Nc=72,block_size=3x3x3x2,n_block_ortho=1,mVec=4	64	1	1	9216	1	2	0	1	-1	-1	-1	0.012545	# 2170.76 Gflop/s, 1233.90 GB/s, tuning took 3.110915 seconds at Sun Aug 18 11:47:36 2024
     24x24x24x36	N4quda10CalculateYILb0EL19QudaFieldLocation_s2ENS_13CalculateYArgILb0EfLi4ELi2ELi3ELi24ENS_5gauge10FieldOrderIfLi48ELi2EL21QudaGaugeFieldOrder_s2ELb1EfEENS4_IfLi48ELi2ELS5_2ELb1EiEENS4_IfLi3ELi1ELS5_2ELb1EfEENS_11colorspinor12FieldOrderCBIfLi4ELi3ELi24EL16QudaFieldOrder_s4EffLb0ELb0EEESC_SC_NS_6clover10FieldOrderIfLi3ELi4EL22QudaCloverFieldOrder_s4EEEEEEE	GPU-offline,cmem,vol=497664,parity=2,precision=4,order=4,Ns=4,Nc=72,comm=0001,computeAV,Dynamic,GPU-device	32	2	2	7776	2	12	0	1	0	0	0	0.00269244	# 2555.20 Gflop/s, 1419.55 GB/s, tuning took 9.209345 seconds at Sun Aug 18 11:47:46 2024
     24x24x24x36	N4quda10CalculateYILb0EL19QudaFieldLocation_s2ENS_13CalculateYArgILb0EfLi4ELi2ELi3ELi24ENS_5gauge10FieldOrderIfLi48ELi2EL21QudaGaugeFieldOrder_s2ELb1EfEENS4_IfLi48ELi2ELS5_2ELb1EiEENS4_IfLi3ELi1ELS5_2ELb1EfEENS_11colorspinor12FieldOrderCBIfLi4ELi3ELi24EL16QudaFieldOrder_s4EffLb0ELb0EEESC_SC_NS_6clover10FieldOrderIfLi3ELi4EL22QudaCloverFieldOrder_s4EEEEEEE	GPU-offline,cmem,vol=497664,parity=2,precision=4,order=4,Ns=4,Nc=72,comm=0001,computeUV,tile_size=3x2x1,dim=0,dir=back,nFace=1,GPU-device	32	1	4	7776	2	3	0	1	1	1	1	0.00176674	# 1947.00 Gflop/s, 1135.75 GB/s, tuning took 2.728228 seconds at Sun Aug 18 11:49:09 2024
     24x24x24x36	N4quda10CalculateYILb0EL19QudaFieldLocation_s2ENS_13CalculateYArgILb0EfLi4ELi2ELi3ELi24ENS_5gauge10FieldOrderIfLi48ELi2EL21QudaGaugeFieldOrder_s2ELb1EfEENS4_IfLi48ELi2ELS5_2ELb1EiEENS4_IfLi3ELi1ELS5_2ELb1EfEENS_11colorspinor12FieldOrderCBIfLi4ELi3ELi24EL16QudaFieldOrder_s4EffLb0ELb0EEESC_SC_NS_6clover10FieldOrderIfLi3ELi4EL22QudaCloverFieldOrder_s4EEEEEEE	GPU-offline,cmem,vol=497664,parity=2,precision=4,order=4,Ns=4,Nc=72,comm=0001,computeUV,tile_size=3x2x1,dim=0,dir=fwd,nFace=1,GPU-device	32	1	4	7776	2	3	0	1	0	0	0	0.00176845	# 1945.13 Gflop/s, 1134.66 GB/s, tuning took 2.731133 seconds at Sun Aug 18 11:47:49 2024
     24x24x24x36	N4quda10CalculateYILb0EL19QudaFieldLocation_s2ENS_13CalculateYArgILb0EfLi4ELi2ELi3ELi24ENS_5gauge10FieldOrderIfLi48ELi2EL21QudaGaugeFieldOrder_s2ELb1EfEENS4_IfLi48ELi2ELS5_2ELb1EiEENS4_IfLi3ELi1ELS5_2ELb1EfEENS_11colorspinor12FieldOrderCBIfLi4ELi3ELi24EL16QudaFieldOrder_s4EffLb0ELb0EEESC_SC_NS_6clover10FieldOrderIfLi3ELi4EL22QudaCloverFieldOrder_s4EEEEEEE	GPU-offline,cmem,vol=497664,parity=2,precision=4,order=4,Ns=4,Nc=72,comm=0001,computeUV,tile_size=3x2x1,dim=1,dir=back,nFace=1,GPU-device	32	1	4	7776	2	3	0	1	1	1	1	0.00177391	# 1939.14 Gflop/s, 1131.16 GB/s, tuning took 2.747862 seconds at Sun Aug 18 11:49:28 2024
     24x24x24x36	N4quda10CalculateYILb0EL19QudaFieldLocation_s2ENS_13CalculateYArgILb0EfLi4ELi2ELi3ELi24ENS_5gauge10FieldOrderIfLi48ELi2EL21QudaGaugeFieldOrder_s2ELb1EfEENS4_IfLi48ELi2ELS5_2ELb1EiEENS4_IfLi3ELi1ELS5_2ELb1EfEENS_11colorspinor12FieldOrderCBIfLi4ELi3ELi24EL16QudaFieldOrder_s4EffLb0ELb0EEESC_SC_NS_6clover10FieldOrderIfLi3ELi4EL22QudaCloverFieldOrder_s4EEEEEEE	GPU-offline,cmem,vol=497664,parity=2,precision=4,order=4,Ns=4,Nc=72,comm=0001,computeUV,tile_size=3x2x1,dim=1,dir=fwd,nFace=1,GPU-device	32	1	4	7776	2	3	0	1	1	1	1	0.00177596	# 1936.90 Gflop/s, 1129.86 GB/s, tuning took 2.730805 seconds at Sun Aug 18 11:48:11 2024
     24x24x24x36	N4quda10CalculateYILb0EL19QudaFieldLocation_s2ENS_13CalculateYArgILb0EfLi4ELi2ELi3ELi24ENS_5gauge10FieldOrderIfLi48ELi2EL21QudaGaugeFieldOrder_s2ELb1EfEENS4_IfLi48ELi2ELS5_2ELb1EiEENS4_IfLi3ELi1ELS5_2ELb1EfEENS_11colorspinor12FieldOrderCBIfLi4ELi3ELi24EL16QudaFieldOrder_s4EffLb0ELb0EEESC_SC_NS_6clover10FieldOrderIfLi3ELi4EL22QudaCloverFieldOrder_s4EEEEEEE	GPU-offline,cmem,vol=497664,parity=2,precision=4,order=4,Ns=4,Nc=72,comm=0001,computeUV,tile_size=3x2x1,dim=2,dir=back,nFace=1,GPU-device	32	1	4	7776	2	3	0	1	1	1	1	0.00176094	# 1953.42 Gflop/s, 1139.50 GB/s, tuning took 2.714486 seconds at Sun Aug 18 11:49:47 2024
     24x24x24x36	N4quda10CalculateYILb0EL19QudaFieldLocation_s2ENS_13CalculateYArgILb0EfLi4ELi2ELi3ELi24ENS_5gauge10FieldOrderIfLi48ELi2EL21QudaGaugeFieldOrder_s2ELb1EfEENS4_IfLi48ELi2ELS5_2ELb1EiEENS4_IfLi3ELi1ELS5_2ELb1EfEENS_11colorspinor12FieldOrderCBIfLi4ELi3ELi24EL16QudaFieldOrder_s4EffLb0ELb0EEESC_SC_NS_6clover10FieldOrderIfLi3ELi4EL22QudaCloverFieldOrder_s4EEEEEEE	GPU-offline,cmem,vol=497664,parity=2,precision=4,order=4,Ns=4,Nc=72,comm=0001,computeUV,tile_size=3x2x1,dim=2,dir=fwd,nFace=1,GPU-device	32	1	4	7776	2	3	0	1	1	1	1	0.00176094	# 1953.42 Gflop/s, 1139.50 GB/s, tuning took 2.713887 seconds at Sun Aug 18 11:48:30 2024
     24x24x24x36	N4quda10CalculateYILb0EL19QudaFieldLocation_s2ENS_13CalculateYArgILb0EfLi4ELi2ELi3ELi24ENS_5gauge10FieldOrderIfLi48ELi2EL21QudaGaugeFieldOrder_s2ELb1EfEENS4_IfLi48ELi2ELS5_2ELb1EiEENS4_IfLi3ELi1ELS5_2ELb1EfEENS_11colorspinor12FieldOrderCBIfLi4ELi3ELi24EL16QudaFieldOrder_s4EffLb0ELb0EEESC_SC_NS_6clover10FieldOrderIfLi3ELi4EL22QudaCloverFieldOrder_s4EEEEEEE	GPU-offline,cmem,vol=497664,parity=2,precision=4,order=4,Ns=4,Nc=72,comm=0001,computeUV,tile_size=3x2x1,dim=3,dir=back,nFace=1,GPU-device	32	1	4	7776	2	3	0	1	1	1	1	0.00176128	# 1953.04 Gflop/s, 1139.27 GB/s, tuning took 2.723357 seconds at Sun Aug 18 11:50:07 2024
     24x24x24x36	N4quda10CalculateYILb0EL19QudaFieldLocation_s2ENS_13CalculateYArgILb0EfLi4ELi2ELi3ELi24ENS_5gauge10FieldOrderIfLi48ELi2EL21QudaGaugeFieldOrder_s2ELb1EfEENS4_IfLi48ELi2ELS5_2ELb1EiEENS4_IfLi3ELi1ELS5_2ELb1EfEENS_11colorspinor12FieldOrderCBIfLi4ELi3ELi24EL16QudaFieldOrder_s4EffLb0ELb0EEESC_SC_NS_6clover10FieldOrderIfLi3ELi4EL22QudaCloverFieldOrder_s4EEEEEEE	GPU-offline,cmem,vol=497664,parity=2,precision=4,order=4,Ns=4,Nc=72,comm=0001,computeUV,tile_size=3x2x1,dim=3,dir=fwd,nFace=1,GPU-device	32	1	4	7776	2	3	0	1	1	1	1	0.00176469	# 1949.26 Gflop/s, 1137.07 GB/s, tuning took 2.722102 seconds at Sun Aug 18 11:48:49 2024
     24x24x24x36	N4quda10CalculateYILb0EL19QudaFieldLocation_s2ENS_13CalculateYArgILb0EfLi4ELi2ELi3ELi24ENS_5gauge10FieldOrderIfLi48ELi2EL21QudaGaugeFieldOrder_s2ELb1EfEENS4_IfLi48ELi2ELS5_2ELb1EiEENS4_IfLi3ELi1ELS5_2ELb1EfEENS_11colorspinor12FieldOrderCBIfLi4ELi3ELi24EL16QudaFieldOrder_s4EffLb0ELb0EEESC_SC_NS_6clover10FieldOrderIfLi3ELi4EL22QudaCloverFieldOrder_s4EEEEEEE	GPU-offline,cmem,vol=497664,parity=2,precision=4,order=4,Ns=4,Nc=72,comm=0001,computeVUV,tile_size=4x2x1,dim=0,dir=back,nFace=1,bidirectional,GPU-device,coarse_vol=8x8x8x18	27	1	3	9216	2	2	16385	4	1	1	0	0.0164536	# 3345.02 Gflop/s, 3427.61 GB/s, tuning took 15.532498 seconds at Sun Aug 18 11:49:25 2024
     24x24x24x36	N4quda10CalculateYILb0EL19QudaFieldLocation_s2ENS_13CalculateYArgILb0EfLi4ELi2ELi3ELi24ENS_5gauge10FieldOrderIfLi48ELi2EL21QudaGaugeFieldOrder_s2ELb1EfEENS4_IfLi48ELi2ELS5_2ELb1EiEENS4_IfLi3ELi1ELS5_2ELb1EfEENS_11colorspinor12FieldOrderCBIfLi4ELi3ELi24EL16QudaFieldOrder_s4EffLb0ELb0EEESC_SC_NS_6clover10FieldOrderIfLi3ELi4EL22QudaCloverFieldOrder_s4EEEEEEE	GPU-offline,cmem,vol=497664,parity=2,precision=4,order=4,Ns=4,Nc=72,comm=0001,computeVUV,tile_size=4x2x1,dim=0,dir=fwd,nFace=1,bidirectional,GPU-device,coarse_vol=8x8x8x18	27	1	3	9216	2	2	16385	4	1	1	0	0.0164516	# 3345.43 Gflop/s, 3428.04 GB/s, tuning took 15.548798 seconds at Sun Aug 18 11:48:05 2024
     24x24x24x36	N4quda10CalculateYILb0EL19QudaFieldLocation_s2ENS_13CalculateYArgILb0EfLi4ELi2ELi3ELi24ENS_5gauge10FieldOrderIfLi48ELi2EL21QudaGaugeFieldOrder_s2ELb1EfEENS4_IfLi48ELi2ELS5_2ELb1EiEENS4_IfLi3ELi1ELS5_2ELb1EfEENS_11colorspinor12FieldOrderCBIfLi4ELi3ELi24EL16QudaFieldOrder_s4EffLb0ELb0EEESC_SC_NS_6clover10FieldOrderIfLi3ELi4EL22QudaCloverFieldOrder_s4EEEEEEE	GPU-offline,cmem,vol=497664,parity=2,precision=4,order=4,Ns=4,Nc=72,comm=0001,computeVUV,tile_size=4x2x1,dim=1,dir=back,nFace=1,bidirectional,GPU-device,coarse_vol=8x8x8x18	27	1	3	9216	2	2	16385	4	1	1	0	0.016468	# 3342.10 Gflop/s, 3424.62 GB/s, tuning took 15.590913 seconds at Sun Aug 18 11:49:44 2024
     24x24x24x36	N4quda10CalculateYILb0EL19QudaFieldLocation_s2ENS_13CalculateYArgILb0EfLi4ELi2ELi3ELi24ENS_5gauge10FieldOrderIfLi48ELi2EL21QudaGaugeFieldOrder_s2ELb1EfEENS4_IfLi48ELi2ELS5_2ELb1EiEENS4_IfLi3ELi1ELS5_2ELb1EfEENS_11colorspinor12FieldOrderCBIfLi4ELi3ELi24EL16QudaFieldOrder_s4EffLb0ELb0EEESC_SC_NS_6clover10FieldOrderIfLi3ELi4EL22QudaCloverFieldOrder_s4EEEEEEE	GPU-offline,cmem,vol=497664,parity=2,precision=4,order=4,Ns=4,Nc=72,comm=0001,computeVUV,tile_size=4x2x1,dim=1,dir=fwd,nFace=1,bidirectional,GPU-device,coarse_vol=8x8x8x18	27	1	3	9216	2	2	16385	4	1	1	0	0.0164314	# 3349.53 Gflop/s, 3432.24 GB/s, tuning took 15.572516 seconds at Sun Aug 18 11:48:27 2024
     24x24x24x36	N4quda10CalculateYILb0EL19QudaFieldLocation_s2ENS_13CalculateYArgILb0EfLi4ELi2ELi3ELi24ENS_5gauge10FieldOrderIfLi48ELi2EL21QudaGaugeFieldOrder_s2ELb1EfEENS4_IfLi48ELi2ELS5_2ELb1EiEENS4_IfLi3ELi1ELS5_2ELb1EfEENS_11colorspinor12FieldOrderCBIfLi4ELi3ELi24EL16QudaFieldOrder_s4EffLb0ELb0EEESC_SC_NS_6clover10FieldOrderIfLi3ELi4EL22QudaCloverFieldOrder_s4EEEEEEE	GPU-offline,cmem,vol=497664,parity=2,precision=4,order=4,Ns=4,Nc=72,comm=0001,computeVUV,tile_size=4x2x1,dim=2,dir=back,nFace=1,bidirectional,GPU-device,coarse_vol=8x8x8x18	27	1	3	9216	2	2	16385	4	1	1	0	0.0164656	# 3342.59 Gflop/s, 3425.12 GB/s, tuning took 15.513371 seconds at Sun Aug 18 11:50:04 2024
     24x24x24x36	N4quda10CalculateYILb0EL19QudaFieldLocation_s2ENS_13CalculateYArgILb0EfLi4ELi2ELi3ELi24ENS_5gauge10FieldOrderIfLi48ELi2EL21QudaGaugeFieldOrder_s2ELb1EfEENS4_IfLi48ELi2ELS5_2ELb1EiEENS4_IfLi3ELi1ELS5_2ELb1EfEENS_11colorspinor12FieldOrderCBIfLi4ELi3ELi24EL16QudaFieldOrder_s4EffLb0ELb0EEESC_SC_NS_6clover10FieldOrderIfLi3ELi4EL22QudaCloverFieldOrder_s4EEEEEEE	GPU-offline,cmem,vol=497664,parity=2,precision=4,order=4,Ns=4,Nc=72,comm=0001,computeVUV,tile_size=4x2x1,dim=2,dir=fwd,nFace=1,bidirectional,GPU-device,coarse_vol=8x8x8x18	27	1	3	9216	2	2	16385	4	1	1	0	0.0165325	# 3329.06 Gflop/s, 3411.26 GB/s, tuning took 15.552734 seconds at Sun Aug 18 11:48:46 2024
     24x24x24x36	N4quda10CalculateYILb0EL19QudaFieldLocation_s2ENS_13CalculateYArgILb0EfLi4ELi2ELi3ELi24ENS_5gauge10FieldOrderIfLi48ELi2EL21QudaGaugeFieldOrder_s2ELb1EfEENS4_IfLi48ELi2ELS5_2ELb1EiEENS4_IfLi3ELi1ELS5_2ELb1EfEENS_11colorspinor12FieldOrderCBIfLi4ELi3ELi24EL16QudaFieldOrder_s4EffLb0ELb0EEESC_SC_NS_6clover10FieldOrderIfLi3ELi4EL22QudaCloverFieldOrder_s4EEEEEEE	GPU-offline,cmem,vol=497664,parity=2,precision=4,order=4,Ns=4,Nc=72,comm=0001,computeVUV,tile_size=4x2x1,dim=3,dir=back,nFace=1,bidirectional,GPU-device,coarse_vol=8x8x8x18	27	1	3	9216	2	2	16385	4	1	1	0	0.0165062	# 3334.36 Gflop/s, 3416.69 GB/s, tuning took 15.524709 seconds at Sun Aug 18 11:50:23 2024
     24x24x24x36	N4quda10CalculateYILb0EL19QudaFieldLocation_s2ENS_13CalculateYArgILb0EfLi4ELi2ELi3ELi24ENS_5gauge10FieldOrderIfLi48ELi2EL21QudaGaugeFieldOrder_s2ELb1EfEENS4_IfLi48ELi2ELS5_2ELb1EiEENS4_IfLi3ELi1ELS5_2ELb1EfEENS_11colorspinor12FieldOrderCBIfLi4ELi3ELi24EL16QudaFieldOrder_s4EffLb0ELb0EEESC_SC_NS_6clover10FieldOrderIfLi3ELi4EL22QudaCloverFieldOrder_s4EEEEEEE	GPU-offline,cmem,vol=497664,parity=2,precision=4,order=4,Ns=4,Nc=72,comm=0001,computeVUV,tile_size=4x2x1,dim=3,dir=fwd,nFace=1,bidirectional,GPU-device,coarse_vol=8x8x8x18	27	1	3	9216	2	2	16385	4	1	1	0	0.0164564	# 3344.46 Gflop/s, 3427.04 GB/s, tuning took 15.518220 seconds at Sun Aug 18 11:49:05 2024
     24x24x24x36	N4quda10CopyCloverINS_6clover11FloatNOrderIdLi72ELi2ELb0ELb1ELb0EEENS1_11QDPJITOrderIdLi72EEEddEE	GPU-offline,cmem,vol=497664precision=8Nc=3	64	1	1	3888	2	1	1821	-1	-1	-1	-1	0.0003264	# 0.00 Gflop/s, 1561.30 GB/s, tuning took 0.285705 seconds at Sun Aug 18 11:46:25 2024
     24x24x24x36	N4quda10CopyCloverINS_6clover11FloatNOrderIdLi72ELi2ELb0ELb1ELb0EEENS1_11QDPJITOrderIdLi72EEEddEE	GPU-offline,cmem,vol=497664precision=8Nc=3,compute_diagonal	480	1	1	519	2	1	16385	-1	-1	-1	-1	1.83609e-05	# 0.00 Gflop/s, 0.06 GB/s, tuning took 0.031645 seconds at Sun Aug 18 11:46:25 2024
     24x24x24x36	N4quda10CopyCloverINS_6clover11FloatNOrderIfLi72ELi4ELb0ELb1ELb0EEENS2_IdLi72ELi2ELb0ELb1ELb0EEEfdEE	GPU-offline,cmem,vol=497664precision=8Nc=3	64	2	1	3888	1	1	0	-1	-1	-1	-1	0.000246374	# 0.00 Gflop/s, 1357.41 GB/s, tuning took 0.235667 seconds at Sun Aug 18 11:46:26 2024
     24x24x24x36	N4quda11SpinorNoiseIfLi4ELi3EEE	GPU-offline,vol=497664,parity=2,precision=4,order=4,Ns=4,Nc=3,uniform	64	1	1	3888	2	1	1756	-1	-1	-1	-1	8.33707e-05	# 0.00 Gflop/s, 573.05 GB/s, tuning took 0.138404 seconds at Sun Aug 18 11:46:26 2024
     24x24x24x36	N4quda12ExtractGhostIdLi3ENS_5gauge11FloatNOrderIdLi18ELi2ELi12EL20QudaStaggeredPhase_s0ELb1EL19QudaGhostExchange_sn2147483648ELb0EEEEE	GPU-offline,cmem,vol=497664stride=259200precision=8geometry=4Nc=3,extract	32	1	5	648	1	2	0	-1	-1	-1	-1	9.80425e-06	# 0.00 Gflop/s, 1488.96 GB/s, tuning took 0.041055 seconds at Sun Aug 18 11:46:24 2024
     24x24x24x36	N4quda12WilsonCloverINS_15WilsonCloverArgIfLi3ELi4EL21QudaReconstructType_s12ELb0EEEEE	policy,GPU-offline,vol=497664,parity=2,precision=4,order=4,Ns=4,Nc=3,commDim=0001,xpay,dagger,topo=1112,order=01,p2p=3,gdr=0,nvshmem=0,pol=110000111100110000	32	1	1	1	1	1	0	1	1	0	-1	0.000326656	# 2852.01 Gflop/s, 2193.86 GB/s, tuning took 0.057111 seconds at Sun Aug 18 11:53:19 2024
     24x24x24x36	N4quda12WilsonCloverINS_15WilsonCloverArgIfLi3ELi4EL21QudaReconstructType_s12ELb0EEEEE	policy,GPU-offline,vol=497664,parity=2,precision=4,order=4,Ns=4,Nc=3,commDim=0001,xpay,topo=1112,order=01,p2p=3,gdr=0,nvshmem=0,pol=110000111100110000	32	1	1	1	1	1	0	0	1	0	-1	0.00032512	# 2865.49 Gflop/s, 2204.22 GB/s, tuning took 0.055894 seconds at Sun Aug 18 11:52:41 2024
     24x24x24x36	N4quda12WilsonCloverINS_15WilsonCloverArgIfLi3ELi4EL21QudaReconstructType_s12ELb0EEEEE	policy_kernel=exterior_all,GPU-offline,vol=497664,parity=2,precision=4,order=4,Ns=4,Nc=3,commDim=0001,xpay	336	1	1	42	1	2	55638	-1	-1	-1	-1	8.5499e-06	# 659.68 Gflop/s, 931.31 GB/s, tuning took 0.037391 seconds at Sun Aug 18 11:52:04 2024
     24x24x24x36	N4quda12WilsonCloverINS_15WilsonCloverArgIfLi3ELi4EL21QudaReconstructType_s12ELb0EEEEE	policy_kernel=exterior_all,GPU-offline,vol=497664,parity=2,precision=4,order=4,Ns=4,Nc=3,commDim=0001,xpay,dagger	336	1	1	42	1	2	83457	-1	-1	-1	-1	8.5499e-06	# 659.68 Gflop/s, 931.31 GB/s, tuning took 0.037440 seconds at Sun Aug 18 11:52:42 2024
     24x24x24x36	N4quda12WilsonCloverINS_15WilsonCloverArgIfLi3ELi4EL21QudaReconstructType_s12ELb0EEEEE	policy_kernel=exterior_all,GPU-offline,vol=497664,parity=2,precision=4,order=4,Ns=4,Nc=3,commDim=0001,xpay,dagger,zero_copy,p2p=0	16	1	1	864	1	2	20865	-1	-1	-1	-1	0.000117077	# 48.17 Gflop/s, 68.01 GB/s, tuning took 0.245136 seconds at Sun Aug 18 11:52:43 2024
     24x24x24x36	N4quda12WilsonCloverINS_15WilsonCloverArgIfLi3ELi4EL21QudaReconstructType_s12ELb0EEEEE	policy_kernel=exterior_all,GPU-offline,vol=497664,parity=2,precision=4,order=4,Ns=4,Nc=3,commDim=0001,xpay,dagger,zero_copy,p2p=1	336	1	1	42	1	2	41729	-1	-1	-1	-1	8.48031e-06	# 665.09 Gflop/s, 938.95 GB/s, tuning took 0.037347 seconds at Sun Aug 18 11:52:53 2024
     24x24x24x36	N4quda12WilsonCloverINS_15WilsonCloverArgIfLi3ELi4EL21QudaReconstructType_s12ELb0EEEEE	policy_kernel=exterior_all,GPU-offline,vol=497664,parity=2,precision=4,order=4,Ns=4,Nc=3,commDim=0001,xpay,zero_copy,p2p=0	80	1	2	173	1	1	20865	-1	-1	-1	-1	0.000116964	# 48.22 Gflop/s, 68.08 GB/s, tuning took 0.245198 seconds at Sun Aug 18 11:52:04 2024
     24x24x24x36	N4quda12WilsonCloverINS_15WilsonCloverArgIfLi3ELi4EL21QudaReconstructType_s12ELb0EEEEE	policy_kernel=exterior_all,GPU-offline,vol=497664,parity=2,precision=4,order=4,Ns=4,Nc=3,commDim=0001,xpay,zero_copy,p2p=1	352	1	1	40	1	2	55638	-1	-1	-1	-1	8.53996e-06	# 660.45 Gflop/s, 932.40 GB/s, tuning took 0.037279 seconds at Sun Aug 18 11:52:14 2024
     24x24x24x36	N4quda12WilsonCloverINS_15WilsonCloverArgIfLi3ELi4EL21QudaReconstructType_s12ELb0EEEEE	policy_kernel=exterior_t,GPU-offline,vol=497664,parity=2,precision=4,order=4,Ns=4,Nc=3,commDim=0001,xpay	64	1	1	216	1	2	5564	-1	-1	-1	-1	8.11684e-06	# 694.87 Gflop/s, 981.00 GB/s, tuning took 0.036827 seconds at Sun Aug 18 11:52:04 2024
     24x24x24x36	N4quda12WilsonCloverINS_15WilsonCloverArgIfLi3ELi4EL21QudaReconstructType_s12ELb0EEEEE	policy_kernel=exterior_t,GPU-offline,vol=497664,parity=2,precision=4,order=4,Ns=4,Nc=3,commDim=0001,xpay,dagger	320	1	1	44	1	2	33383	-1	-1	-1	-1	8.03229e-06	# 702.19 Gflop/s, 991.33 GB/s, tuning took 0.036292 seconds at Sun Aug 18 11:52:42 2024
     24x24x24x36	N4quda12WilsonCloverINS_15WilsonCloverArgIfLi3ELi4EL21QudaReconstructType_s12ELb0EEEEE	policy_kernel=exterior_t,GPU-offline,vol=497664,parity=2,precision=4,order=4,Ns=4,Nc=3,commDim=0001,xpay,dagger,zero_copy,p2p=0	32	1	1	432	1	2	33383	-1	-1	-1	-1	0.000116395	# 48.46 Gflop/s, 68.41 GB/s, tuning took 0.252217 seconds at Sun Aug 18 11:52:42 2024
     24x24x24x36	N4quda12WilsonCloverINS_15WilsonCloverArgIfLi3ELi4EL21QudaReconstructType_s12ELb0EEEEE	policy_kernel=exterior_t,GPU-offline,vol=497664,parity=2,precision=4,order=4,Ns=4,Nc=3,commDim=0001,xpay,dagger,zero_copy,p2p=1	32	1	1	432	1	2	20865	-1	-1	-1	-1	7.93835e-06	# 710.50 Gflop/s, 1003.06 GB/s, tuning took 0.035469 seconds at Sun Aug 18 11:52:52 2024
     24x24x24x36	N4quda12WilsonCloverINS_15WilsonCloverArgIfLi3ELi4EL21QudaReconstructType_s12ELb0EEEEE	policy_kernel=exterior_t,GPU-offline,vol=497664,parity=2,precision=4,order=4,Ns=4,Nc=3,commDim=0001,xpay,zero_copy,p2p=0	32	1	1	432	1	2	33383	-1	-1	-1	-1	0.000116395	# 48.46 Gflop/s, 68.41 GB/s, tuning took 0.252289 seconds at Sun Aug 18 11:52:04 2024
     24x24x24x36	N4quda12WilsonCloverINS_15WilsonCloverArgIfLi3ELi4EL21QudaReconstructType_s12ELb0EEEEE	policy_kernel=exterior_t,GPU-offline,vol=497664,parity=2,precision=4,order=4,Ns=4,Nc=3,commDim=0001,xpay,zero_copy,p2p=1	64	1	1	216	1	2	9819	-1	-1	-1	-1	7.98532e-06	# 706.32 Gflop/s, 997.16 GB/s, tuning took 0.035752 seconds at Sun Aug 18 11:52:14 2024
     24x24x24x36	N4quda12WilsonCloverINS_15WilsonCloverArgIfLi3ELi4EL21QudaReconstructType_s12ELb0EEEEE	policy_kernel=interior,GPU-offline,vol=497664,parity=2,precision=4,order=4,Ns=4,Nc=3,commDim=0001,xpay,comm=0001	64	1	2	3888	1	1	16692	-1	-1	-1	-1	0.000250368	# 3703.80 Gflop/s, 2830.53 GB/s, tuning took 0.690024 seconds at Sun Aug 18 11:52:03 2024
     24x24x24x36	N4quda12WilsonCloverINS_15WilsonCloverArgIfLi3ELi4EL21QudaReconstructType_s12ELb0EEEEE	policy_kernel=interior,GPU-offline,vol=497664,parity=2,precision=4,order=4,Ns=4,Nc=3,commDim=0001,xpay,comm=0001,host-device	64	1	2	3888	1	1	0	9	-1	-1	-1	0.000253542	# 3658.74 Gflop/s, 2810.79 GB/s, tuning took 9.009523 seconds at Sun Aug 18 11:52:23 2024
     24x24x24x36	N4quda12WilsonCloverINS_15WilsonCloverArgIfLi3ELi4EL21QudaReconstructType_s12ELb0EEEEE	policy_kernel=interior,GPU-offline,vol=497664,parity=2,precision=4,order=4,Ns=4,Nc=3,commDim=0001,xpay,comm=0001,host-host	96	1	2	2592	1	1	0	1	-1	-1	-1	0.000253747	# 3655.79 Gflop/s, 2808.52 GB/s, tuning took 9.685875 seconds at Sun Aug 18 11:52:14 2024
     24x24x24x36	N4quda12WilsonCloverINS_15WilsonCloverArgIfLi3ELi4EL21QudaReconstructType_s12ELb0EEEEE	policy_kernel=interior,GPU-offline,vol=497664,parity=2,precision=4,order=4,Ns=4,Nc=3,commDim=0001,xpay,comm=0001,host-remote	64	1	2	3888	1	1	11923	1	-1	-1	-1	0.000251699	# 3685.53 Gflop/s, 2831.38 GB/s, tuning took 10.868649 seconds at Sun Aug 18 11:52:41 2024
     24x24x24x36	N4quda12WilsonCloverINS_15WilsonCloverArgIfLi3ELi4EL21QudaReconstructType_s12ELb0EEEEE	policy_kernel=interior,GPU-offline,vol=497664,parity=2,precision=4,order=4,Ns=4,Nc=3,commDim=0001,xpay,dagger,comm=0001	96	1	2	2592	1	1	0	-1	-1	-1	-1	0.000252723	# 3669.29 Gflop/s, 2804.15 GB/s, tuning took 0.690329 seconds at Sun Aug 18 11:52:42 2024
     24x24x24x36	N4quda12WilsonCloverINS_15WilsonCloverArgIfLi3ELi4EL21QudaReconstructType_s12ELb0EEEEE	policy_kernel=interior,GPU-offline,vol=497664,parity=2,precision=4,order=4,Ns=4,Nc=3,commDim=0001,xpay,dagger,comm=0001,host-device	64	1	2	3888	1	1	0	10	-1	-1	-1	0.000254976	# 3638.17 Gflop/s, 2794.99 GB/s, tuning took 8.861275 seconds at Sun Aug 18 11:53:01 2024
     24x24x24x36	N4quda12WilsonCloverINS_15WilsonCloverArgIfLi3ELi4EL21QudaReconstructType_s12ELb0EEEEE	policy_kernel=interior,GPU-offline,vol=497664,parity=2,precision=4,order=4,Ns=4,Nc=3,commDim=0001,xpay,dagger,comm=0001,host-host	64	1	2	3888	1	1	11128	1	-1	-1	-1	0.000254362	# 3646.96 Gflop/s, 2801.74 GB/s, tuning took 9.648014 seconds at Sun Aug 18 11:52:52 2024
     24x24x24x36	N4quda12WilsonCloverINS_15WilsonCloverArgIfLi3ELi4EL21QudaReconstructType_s12ELb0EEEEE	policy_kernel=interior,GPU-offline,vol=497664,parity=2,precision=4,order=4,Ns=4,Nc=3,commDim=0001,xpay,dagger,comm=0001,host-remote	64	1	2	3888	1	1	13910	1	-1	-1	-1	0.000252672	# 3671.34 Gflop/s, 2820.47 GB/s, tuning took 10.829935 seconds at Sun Aug 18 11:53:19 2024
     24x24x24x36	N4quda15CopyColorSpinorILi4ELi3ENS_11colorspinor11FloatNOrderIfLi4ELi3ELi4ELb0ELb0EEES3_St5tupleIJRNS_16ColorSpinorFieldERKS5_19QudaFieldLocation_sPfPKfEEEE	GPU-offline,cmem,vol=497664,parity=2,precision=4,order=4,Ns=4,Nc=3vol=497664,parity=2,precision=4,order=4,Ns=4,Nc=3,NonRelBasis	32	1	1	7776	2	1	0	-1	-1	-1	-1	7.59223e-05	# 0.00 Gflop/s, 1258.54 GB/s, tuning took 0.023304 seconds at Sun Aug 18 11:46:26 2024
     24x24x24x36	N4quda15CopyColorSpinorILi4ELi3ENS_11colorspinor11FloatNOrderIfLi4ELi3ELi4ELb0ELb0EEES3_St5tupleIJRNS_16ColorSpinorFieldERKS5_19QudaFieldLocation_sPfPKfEEEE	GPU-offline,cmem,vol=497664,parity=2,precision=4,order=4,Ns=4,Nc=3vol=497664,parity=2,precision=4,order=4,Ns=4,Nc=3,RelBasis	32	1	1	7776	2	1	0	-1	-1	-1	-1	7.53371e-05	# 0.00 Gflop/s, 1268.32 GB/s, tuning took 0.023290 seconds at Sun Aug 18 11:46:26 2024
     24x24x24x36	N4quda4PackIfLi3ELb1EEE	policy_kernel,vol=497664,parity=2,precision=4,order=4,Ns=4,Nc=3,comm=0001,topo=1112,order=01,dagger,nFace=1,device-device	512	1	1	29	1	2	0	-1	-1	-1	-1	5.62183e-06	# 59.02 Gflop/s, 708.19 GB/s, tuning took 0.358151 seconds at Sun Aug 18 11:52:41 2024
     24x24x24x36	N4quda4PackIfLi3ELb1EEE	policy_kernel,vol=497664,parity=2,precision=4,order=4,Ns=4,Nc=3,comm=0001,topo=1112,order=01,dagger,nFace=1,device-remote	64	1	2	1	1	1	0	-1	-1	-1	-1	0.000183467	# 1.81 Gflop/s, 21.70 GB/s, tuning took 6.833627 seconds at Sun Aug 18 11:53:08 2024
     24x24x24x36	N4quda4PackIfLi3ELb1EEE	policy_kernel,vol=497664,parity=2,precision=4,order=4,Ns=4,Nc=3,comm=0001,topo=1112,order=01,dagger,nFace=1,host-device	576	1	1	3	1	2	0	-1	-1	-1	-1	1.20859e-05	# 27.45 Gflop/s, 329.42 GB/s, tuning took 0.026003 seconds at Sun Aug 18 11:52:52 2024
     24x24x24x36	N4quda4PackIfLi3ELb1EEE	policy_kernel,vol=497664,parity=2,precision=4,order=4,Ns=4,Nc=3,comm=0001,topo=1112,order=01,dagger,nFace=1,host-host	64	1	2	1	1	1	0	-1	-1	-1	-1	0.00010537	# 3.15 Gflop/s, 37.78 GB/s, tuning took 0.060330 seconds at Sun Aug 18 11:52:42 2024
     24x24x24x36	N4quda4PackIfLi3ELb1EEE	policy_kernel,vol=497664,parity=2,precision=4,order=4,Ns=4,Nc=3,comm=0001,topo=1112,order=01,dagger,nFace=1,host-remote	64	1	2	1	1	1	0	-1	-1	-1	-1	0.000183979	# 1.80 Gflop/s, 21.64 GB/s, tuning took 0.098746 seconds at Sun Aug 18 11:53:08 2024
     24x24x24x36	N4quda4PackIfLi3ELb1EEE	policy_kernel,vol=497664,parity=2,precision=4,order=4,Ns=4,Nc=3,comm=0001,topo=1112,order=01,nFace=1,device-device	960	1	1	27	1	2	0	-1	-1	-1	-1	5.64895e-06	# 58.73 Gflop/s, 704.79 GB/s, tuning took 0.356549 seconds at Sun Aug 18 11:52:03 2024
     24x24x24x36	N4quda4PackIfLi3ELb1EEE	policy_kernel,vol=497664,parity=2,precision=4,order=4,Ns=4,Nc=3,comm=0001,topo=1112,order=01,nFace=1,device-remote	64	1	2	1	1	1	0	-1	-1	-1	-1	0.000183296	# 1.81 Gflop/s, 21.72 GB/s, tuning took 6.834698 seconds at Sun Aug 18 11:52:30 2024
     24x24x24x36	N4quda4PackIfLi3ELb1EEE	policy_kernel,vol=497664,parity=2,precision=4,order=4,Ns=4,Nc=3,comm=0001,topo=1112,order=01,nFace=1,host-device	576	1	1	3	1	2	0	-1	-1	-1	-1	1.23465e-05	# 26.87 Gflop/s, 322.46 GB/s, tuning took 0.026429 seconds at Sun Aug 18 11:52:14 2024
     24x24x24x36	N4quda4PackIfLi3ELb1EEE	policy_kernel,vol=497664,parity=2,precision=4,order=4,Ns=4,Nc=3,comm=0001,topo=1112,order=01,nFace=1,host-host	96	1	2	1	1	1	0	-1	-1	-1	-1	0.00010537	# 3.15 Gflop/s, 37.78 GB/s, tuning took 0.060311 seconds at Sun Aug 18 11:52:04 2024
     24x24x24x36	N4quda4PackIfLi3ELb1EEE	policy_kernel,vol=497664,parity=2,precision=4,order=4,Ns=4,Nc=3,comm=0001,topo=1112,order=01,nFace=1,host-remote	64	1	2	1	1	1	0	-1	-1	-1	-1	0.000183808	# 1.81 Gflop/s, 21.66 GB/s, tuning took 0.098626 seconds at Sun Aug 18 11:52:30 2024
     24x24x24x36	N4quda4blas11axpbyzNorm2IdfEE	GPU-offline,vol=497664,parity=2,precision=4,order=4,Ns=4,Nc=3	512	1	1	192	1	1	0	-1	-1	-1	-1	0.000117077	# 408.07 Gflop/s, 1224.21 GB/s, tuning took 0.785952 seconds at Sun Aug 18 11:51:44 2024
     24x24x24x36	N4quda4blas12MaxDeviationIdfEE	GPU-offline,vol=497664,parity=2,precision=4,order=4,Ns=4,Nc=3	608	1	1	108	1	1	0	-1	-1	-1	-1	7.9872e-05	# 0.00 Gflop/s, 1196.31 GB/s, tuning took 0.684940 seconds at Sun Aug 18 11:51:43 2024
     24x24x24x36	N4quda4blas4CdotIdfEE	GPU-offline,vol=497664,parity=2,precision=4,order=4,Ns=4,Nc=3	608	1	1	108	1	1	0	-1	-1	-1	-1	7.92418e-05	# 602.91 Gflop/s, 1205.82 GB/s, tuning took 0.667271 seconds at Sun Aug 18 11:47:32 2024
     24x24x24x36	N4quda4blas4axy_IfEE	GPU-offline,vol=497664,parity=2,precision=4,order=4,Ns=4,Nc=3	288	2	1	216	1	1	0	-1	-1	-1	-1	7.59223e-05	# 157.32 Gflop/s, 1258.54 GB/s, tuning took 0.023766 seconds at Sun Aug 18 11:47:32 2024
     24x24x24x36	N4quda4blas5Norm2IdfEE	GPU-offline,vol=497664,parity=2,precision=4,order=4,Ns=4,Nc=3	640	1	1	192	1	1	0	-1	-1	-1	-1	4.46998e-05	# 534.41 Gflop/s, 1068.81 GB/s, tuning took 0.537127 seconds at Sun Aug 18 11:47:32 2024
     24x24x24x36	N4quda4blas6caxpy_IfEE	GPU-offline,vol=497664,parity=2,precision=4,order=4,Ns=4,Nc=3	224	1	1	216	2	1	0	-1	-1	-1	-1	0.000109773	# 435.22 Gflop/s, 1305.67 GB/s, tuning took 0.029323 seconds at Sun Aug 18 11:47:32 2024
     24x24x24x36	N4quda7RNGInitE	GPU-offline,vol=497664,parity=2,precision=4,order=4,Ns=4,Nc=3	160	2	1	1556	1	1	0	-1	-1	-1	-1	0.00498005	# 0.00 Gflop/s, 0.00 GB/s, tuning took 0.680649 seconds at Sun Aug 18 11:46:26 2024
     24x24x24x36	N4quda9CopyGaugeINS_12CopyGaugeArgIddLi18ELb0ENS_5gauge11FloatNOrderIdLi18ELi2ELi12EL20QudaStaggeredPhase_s0ELb1EL19QudaGhostExchange_sn2147483648ELb0EEENS2_11QDPJITOrderIdLi18EEEEEEE	GPU-offline,cmem,vol=497664stride=248832precision=8geometry=4Nc=3,vol=497664stride=259200precision=8geometry=4Nc=3	96	1	1	2592	1	8	0	-1	-1	-1	-1	0.000283392	# 0.00 Gflop/s, 1713.95 GB/s, tuning took 0.502118 seconds at Sun Aug 18 11:46:24 2024
     24x24x24x36	N4quda9CopyGaugeINS_12CopyGaugeArgIddLi18ELb0ENS_5gauge11FloatNOrderIdLi18ELi2ELi12EL20QudaStaggeredPhase_s0ELb1EL19QudaGhostExchange_sn2147483648ELb0EEES6_EEEE	GPU-offline,cmem,vol=497664stride=259200precision=8geometry=4Nc=3,vol=497664stride=259200precision=8geometry=4Nc=3,ghost	32	1	2	324	1	4	0	-1	-1	-1	-1	7.1347e-06	# 0.00 Gflop/s, 2131.33 GB/s, tuning took 0.028106 seconds at Sun Aug 18 11:46:25 2024
     24x24x24x36	N4quda9CopyGaugeINS_12CopyGaugeArgIfdLi18ELb0ENS_5gauge11FloatNOrderIfLi18ELi4ELi12EL20QudaStaggeredPhase_s0ELb1EL19QudaGhostExchange_sn2147483648ELb0EEENS3_IdLi18ELi2ELi12ELS4_0ELb1ELS5_n2147483648ELb0EEEEEEE	GPU-offline,cmem,vol=497664stride=259200precision=8geometry=4Nc=3,vol=497664stride=259200precision=4geometry=4Nc=3	32	1	7	7776	1	2	0	-1	-1	-1	-1	0.00021033	# 0.00 Gflop/s, 1419.67 GB/s, tuning took 0.377184 seconds at Sun Aug 18 11:46:25 2024
     24x24x24x36	N4quda9CopyGaugeINS_12CopyGaugeArgIfdLi18ELb0ENS_5gauge11FloatNOrderIfLi18ELi4ELi12EL20QudaStaggeredPhase_s0ELb1EL19QudaGhostExchange_sn2147483648ELb0EEENS3_IdLi18ELi2ELi12ELS4_0ELb1ELS5_n2147483648ELb0EEEEEEE	GPU-offline,cmem,vol=497664stride=259200precision=8geometry=4Nc=3,vol=497664stride=259200precision=4geometry=4Nc=3,ghost	96	1	1	108	1	8	0	-1	-1	-1	-1	5.97577e-06	# 0.00 Gflop/s, 1908.51 GB/s, tuning took 0.027299 seconds at Sun Aug 18 11:46:25 2024
     24x24x24x36	N4quda9CopyGaugeINS_12CopyGaugeArgIffLi18ELb0ENS_5gauge11FloatNOrderIfLi18ELi2ELi18EL20QudaStaggeredPhase_s0ELb1EL19QudaGhostExchange_sn2147483648ELb0EEENS3_IfLi18ELi4ELi12ELS4_0ELb1ELS5_n2147483648ELb0EEEEEEE	GPU-offline,cmem,vol=497664stride=259200precision=4geometry=4Nc=3,vol=497664stride=259200precision=4geometry=4Nc=3	32	1	1	7776	1	8	0	-1	-1	-1	-1	0.000187392	# 0.00 Gflop/s, 1327.87 GB/s, tuning took 0.340615 seconds at Sun Aug 18 11:47:37 2024
     24x24x24x36	N4quda9CopyGaugeINS_12CopyGaugeArgIffLi18ELb0ENS_5gauge11FloatNOrderIfLi18ELi2ELi18EL20QudaStaggeredPhase_s0ELb1EL19QudaGhostExchange_sn2147483648ELb0EEENS3_IfLi18ELi4ELi12ELS4_0ELb1ELS5_n2147483648ELb0EEEEEEE	GPU-offline,cmem,vol=497664stride=259200precision=4geometry=4Nc=3,vol=497664stride=259200precision=4geometry=4Nc=3,ghost	128	1	2	81	1	4	0	-1	-1	-1	-1	6.85533e-06	# 0.00 Gflop/s, 1386.37 GB/s, tuning took 0.028234 seconds at Sun Aug 18 11:47:37 2024
     24x24x24x36	N4quda9GhostPackIffL16QudaFieldOrder_s4ELi4ELi72EEE	GPU-offline,vol=497664,parity=2,precision=4,order=4,Ns=4,Nc=72,halo_prec=4,comm=0001,topo=1112,order=01,dest=00000011,nFace=1,spins_per_thread=2,colors_per_thread=4,shmem=0	32	1	1	432	36	2	0	-1	-1	-1	-1	0.000105472	# 0.00 Gflop/s, 603.96 GB/s, tuning took 0.069336 seconds at Sun Aug 18 11:47:37 2024
24x24x24x36,8x8x8x18	N4quda14RestrictLaunchIffLi4ELi3ELi2ELi24EEE	GPU-offline,vol=497664,parity=2,precision=4,order=4,Ns=4,Nc=3,vol=9216,parity=2,precision=4,order=2,Ns=2,Nc=24	64	1	3	9216	1	2	0	28	-1	-1	-1	0.00147115	# 779.40 Gflop/s, 815.64 GB/s, tuning took 11.065459 seconds at Sun Aug 18 11:51:41 2024
     24x24x24x72	N4quda10BlockOrthoIffLi4ELi2ELi3ELi2ELi24EEE	GPU-offline,cmem,vol=995328,parity=2,precision=4,order=4,Ns=4,Nc=72,block_size=3x3x3x2,n_block_ortho=1,mVec=4	64	1	1	18432	1	2	0	1	-1	-1	-1	0.0246675	# 2207.94 Gflop/s, 1255.04 GB/s, tuning took 6.194875 seconds at Tue Mar  4 23:52:56 2025
     24x24x24x72	N4quda10CalculateYILb0EL19QudaFieldLocation_s2ENS_13CalculateYArgILb0EfLi4ELi2ELi3ELi24ENS_5gauge10FieldOrderIfLi48ELi2EL21QudaGaugeFieldOrder_s2ELb1EfEENS4_IfLi48ELi2ELS5_2ELb1EiEENS4_IfLi3ELi1ELS5_2ELb1EfEENS_11colorspinor12FieldOrderCBIfLi4ELi3ELi24EL16QudaFieldOrder_s4EffLb0ELb0EEESC_SC_NS_6clover10FieldOrderIfLi3ELi4EL22QudaCloverFieldOrder_s4EEEEEEE	GPU-offline,cmem,vol=995328,parity=2,precision=4,order=4,Ns=4,Nc=72,comm=0000,computeAV,Dynamic,GPU-device	64	2	2	7776	2	12	0	1	0	0	0	0.00567706	# 2423.69 Gflop/s, 1346.49 GB/s, tuning took 18.229130 seconds at Tue Mar  4 23:53:15 2025
     24x24x24x72	N4quda10CalculateYILb0EL19QudaFieldLocation_s2ENS_13CalculateYArgILb0EfLi4ELi2ELi3ELi24ENS_5gauge10FieldOrderIfLi48ELi2EL21QudaGaugeFieldOrder_s2ELb1EfEENS4_IfLi48ELi2ELS5_2ELb1EiEENS4_IfLi3ELi1ELS5_2ELb1EfEENS_11colorspinor12FieldOrderCBIfLi4ELi3ELi24EL16QudaFieldOrder_s4EffLb0ELb0EEESC_SC_NS_6clover10FieldOrderIfLi3ELi4EL22QudaCloverFieldOrder_s4EEEEEEE	GPU-offline,cmem,vol=995328,parity=2,precision=4,order=4,Ns=4,Nc=72,comm=0000,computeUV,tile_size=3x2x1,dim=0,dir=back,nFace=1,GPU-device	32	1	4	15552	2	3	0	1	1	1	1	0.00353519	# 1946.06 Gflop/s, 1135.20 GB/s, tuning took 5.413726 seconds at Tue Mar  4 23:56:01 2025
     24x24x24x72	N4quda10CalculateYILb0EL19QudaFieldLocation_s2ENS_13CalculateYArgILb0EfLi4ELi2ELi3ELi24ENS_5gauge10FieldOrderIfLi48ELi2EL21QudaGaugeFieldOrder_s2ELb1EfEENS4_IfLi48ELi2ELS5_2ELb1EiEENS4_IfLi3ELi1ELS5_2ELb1EfEENS_11colorspinor12FieldOrderCBIfLi4ELi3ELi24EL16QudaFieldOrder_s4EffLb0ELb0EEESC_SC_NS_6clover10FieldOrderIfLi3ELi4EL22QudaCloverFieldOrder_s4EEEEEEE	GPU-offline,cmem,vol=995328,parity=2,precision=4,order=4,Ns=4,Nc=72,comm=0000,computeUV,tile_size=3x2x1,dim=0,dir=fwd,nFace=1,GPU-device	32	1	4	15552	2	3	0	1	0	0	0	0.00352222	# 1953.23 Gflop/s, 1139.38 GB/s, tuning took 5.423443 seconds at Tue Mar  4 23:53:21 2025
     24x24x24x72	N4quda10CalculateYILb0EL19QudaFieldLocation_s2ENS_13CalculateYArgILb0EfLi4ELi2ELi3ELi24ENS_5gauge10FieldOrderIfLi48ELi2EL21QudaGaugeFieldOrder_s2ELb1EfEENS4_IfLi48ELi2ELS5_2ELb1EiEENS4_IfLi3ELi1ELS5_2ELb1EfEENS_11colorspinor12FieldOrderCBIfLi4ELi3ELi24EL16QudaFieldOrder_s4EffLb0ELb0EEESC_SC_NS_6clover10FieldOrderIfLi3ELi4EL22QudaCloverFieldOrder_s4EEEEEEE	GPU-offline,cmem,vol=995328,parity=2,precision=4,order=4,Ns=4,Nc=72,comm=0000,computeUV,tile_size=3x2x1,dim=1,dir=back,nFace=1,GPU-device	32	1	4	15552	2	3	0	1	1	1	1	0.0035427	# 1941.94 Gflop/s, 1132.80 GB/s, tuning took 5.462184 seconds at Tue Mar  4 23:56:40 2025
     24x24x24x72	N4quda10CalculateYILb0EL19QudaFieldLocation_s2ENS_13CalculateYArgILb0EfLi4ELi2ELi3ELi24ENS_5gauge10FieldOrderIfLi48ELi2EL21QudaGaugeFieldOrder_s2ELb1EfEENS4_IfLi48ELi2ELS5_2ELb1EiEENS4_IfLi3ELi1ELS5_2ELb1EfEENS_11colorspinor12FieldOrderCBIfLi4ELi3ELi24EL16QudaFieldOrder_s4EffLb0ELb0EEESC_SC_NS_6clover10FieldOrderIfLi3ELi4EL22QudaCloverFieldOrder_s4EEEEEEE	GPU-offline,cmem,vol=995328,parity=2,precision=4,order=4,Ns=4,Nc=72,comm=0000,computeUV,tile_size=3x2x1,dim=1,dir=fwd,nFace=1,GPU-device	32	1	4	15552	2	3	0	1	1	1	1	0.00353075	# 1948.51 Gflop/s, 1136.63 GB/s, tuning took 5.428507 seconds at Tue Mar  4 23:54:04 2025
     24x24x24x72	N4quda10CalculateYILb0EL19QudaFieldLocation_s2ENS_13CalculateYArgILb0EfLi4ELi2ELi3ELi24ENS_5gauge10FieldOrderIfLi48ELi2EL21QudaGaugeFieldOrder_s2ELb1EfEENS4_IfLi48ELi2ELS5_2ELb1EiEENS4_IfLi3ELi1ELS5_2ELb1EfEENS_11colorspinor12FieldOrderCBIfLi4ELi3ELi24EL16QudaFieldOrder_s4EffLb0ELb0EEESC_SC_NS_6clover10FieldOrderIfLi3ELi4EL22QudaCloverFieldOrder_s4EEEEEEE	GPU-offline,cmem,vol=995328,parity=2,precision=4,order=4,Ns=4,Nc=72,comm=0000,computeUV,tile_size=3x2x1,dim=2,dir=fwd,nFace=1,GPU-device	32	1	4	15552	2	3	0	1	1	1	1	0.00350686	# 1961.79 Gflop/s, 1144.38 GB/s, tuning took 5.393247 seconds at Tue Mar  4 23:54:43 2025
     24x24x24x72	N4quda10CalculateYILb0EL19QudaFieldLocation_s2ENS_13CalculateYArgILb0EfLi4ELi2ELi3ELi24ENS_5gauge10FieldOrderIfLi48ELi2EL21QudaGaugeFieldOrder_s2ELb1EfEENS4_IfLi48ELi2ELS5_2ELb1EiEENS4_IfLi3ELi1ELS5_2ELb1EfEENS_11colorspinor12FieldOrderCBIfLi4ELi3ELi24EL16QudaFieldOrder_s4EffLb0ELb0EEESC_SC_NS_6clover10FieldOrderIfLi3ELi4EL22QudaCloverFieldOrder_s4EEEEEEE	GPU-offline,cmem,vol=995328,parity=2,precision=4,order=4,Ns=4,Nc=72,comm=0000,computeUV,tile_size=3x2x1,dim=3,dir=fwd,nFace=1,GPU-device	32	1	4	15552	2	3	0	1	1	1	1	0.00350618	# 1962.17 Gflop/s, 1144.60 GB/s, tuning took 5.411315 seconds at Tue Mar  4 23:55:22 2025
     24x24x24x72	N4quda10CalculateYILb0EL19QudaFieldLocation_s2ENS_13CalculateYArgILb0EfLi4ELi2ELi3ELi24ENS_5gauge10FieldOrderIfLi48ELi2EL21QudaGaugeFieldOrder_s2ELb1EfEENS4_IfLi48ELi2ELS5_2ELb1EiEENS4_IfLi3ELi1ELS5_2ELb1EfEENS_11colorspinor12FieldOrderCBIfLi4ELi3ELi24EL16QudaFieldOrder_s4EffLb0ELb0EEESC_SC_NS_6clover10FieldOrderIfLi3ELi4EL22QudaCloverFieldOrder_s4EEEEEEE	GPU-offline,cmem,vol=995328,parity=2,precision=4,order=4,Ns=4,Nc=72,comm=0000,computeVUV,tile_size=4x2x1,dim=0,dir=back,nFace=1,bidirectional,GPU-device,coarse_vol=8x8x8x36	27	1	3	18432	2	2	16384	4	1	1	0	0.032667	# 3369.62 Gflop/s, 3452.82 GB/s, tuning took 31.399556 seconds at Tue Mar  4 23:56:33 2025
     24x24x24x72	N4quda10CalculateYILb0EL19QudaFieldLocation_s2ENS_13CalculateYArgILb0EfLi4ELi2ELi3ELi24ENS_5gauge10FieldOrderIfLi48ELi2EL21QudaGaugeFieldOrder_s2ELb1EfEENS4_IfLi48ELi2ELS5_2ELb1EiEENS4_IfLi3ELi1ELS5_2ELb1EfEENS_11colorspinor12FieldOrderCBIfLi4ELi3ELi24EL16QudaFieldOrder_s4EffLb0ELb0EEESC_SC_NS_6clover10FieldOrderIfLi3ELi4EL22QudaCloverFieldOrder_s4EEEEEEE	GPU-offline,cmem,vol=995328,parity=2,precision=4,order=4,Ns=4,Nc=72,comm=0000,computeVUV,tile_size=4x2x1,dim=0,dir=fwd,nFace=1,bidirectional,GPU-device,coarse_vol=8x8x8x36	27	1	3	18432	2	2	16384	4	1	1	0	0.0323922	# 3398.21 Gflop/s, 3482.11 GB/s, tuning took 31.046236 seconds at Tue Mar  4 23:53:53 2025
     24x24x24x72	N4quda10CalculateYILb0EL19QudaFieldLocation_s2ENS_13CalculateYArgILb0EfLi4ELi2ELi3ELi24ENS_5gauge10FieldOrderIfLi48ELi2EL21QudaGaugeFieldOrder_s2ELb1EfEENS4_IfLi48ELi2ELS5_2ELb1EiEENS4_IfLi3ELi1ELS5_2ELb1EfEENS_11colorspinor12FieldOrderCBIfLi4ELi3ELi24EL16QudaFieldOrder_s4EffLb0ELb0EEESC_SC_NS_6clover10FieldOrderIfLi3ELi4EL22QudaCloverFieldOrder_s4EEEEEEE	GPU-offline,cmem,vol=995328,parity=2,precision=4,order=4,Ns=4,Nc=72,comm=0000,computeVUV,tile_size=4x2x1,dim=1,dir=fwd,nFace=1,bidirectional,GPU-device,coarse_vol=8x8x8x36	27	1	3	18432	2	2	16385	4	1	1	0	0.0327052	# 3365.68 Gflop/s, 3448.79 GB/s, tuning took 31.079244 seconds at Tue Mar  4 23:54:37 2025
     24x24x24x72	N4quda10CalculateYILb0EL19QudaFieldLocation_s2ENS_13CalculateYArgILb0EfLi4ELi2ELi3ELi24ENS_5gauge10FieldOrderIfLi48ELi2EL21QudaGaugeFieldOrder_s2ELb1EfEENS4_IfLi48ELi2ELS5_2ELb1EiEENS4_IfLi3ELi1ELS5_2ELb1EfEENS_11colorspinor12FieldOrderCBIfLi4ELi3ELi24EL16QudaFieldOrder_s4EffLb0ELb0EEESC_SC_NS_6clover10FieldOrderIfLi3ELi4EL22QudaCloverFieldOrder_s4EEEEEEE	GPU-offline,cmem,vol=995328,parity=2,precision=4,order=4,Ns=4,Nc=72,comm=0000,computeVUV,tile_size=4x2x1,dim=2,dir=fwd,nFace=1,bidirectional,GPU-device,coarse_vol=8x8x8x36	27	1	3	18432	2	2	16384	4	1	1	0	0.0328762	# 3348.18 Gflop/s, 3430.85 GB/s, tuning took 31.064626 seconds at Tue Mar  4 23:55:16 2025
     24x24x24x72	N4quda10CalculateYILb0EL19QudaFieldLocation_s2ENS_13CalculateYArgILb0EfLi4ELi2ELi3ELi24ENS_5gauge10FieldOrderIfLi48ELi2EL21QudaGaugeFieldOrder_s2ELb1EfEENS4_IfLi48ELi2ELS5_2ELb1EiEENS4_IfLi3ELi1ELS5_2ELb1EfEENS_11colorspinor12FieldOrderCBIfLi4ELi3ELi24EL16QudaFieldOrder_s4EffLb0ELb0EEESC_SC_NS_6clover10FieldOrderIfLi3ELi4EL22QudaCloverFieldOrder_s4EEEEEEE	GPU-offline,cmem,vol=995328,parity=2,precision=4,order=4,Ns=4,Nc=72,comm=0000,computeVUV,tile_size=4x2x1,dim=3,dir=fwd,nFace=1,bidirectional,GPU-device,coarse_vol=8x8x8x36	27	1	3	18432	2	2	16385	4	1	1	0	0.0327526	# 3360.81 Gflop/s, 3443.79 GB/s, tuning took 30.993440 seconds at Tue Mar  4 23:55:54 2025
     24x24x24x72	N4quda10CopyCloverINS_6clover11FloatNOrderIdLi72ELi2ELb0ELb1ELb0EEENS1_11QDPJITOrderIdLi72EEEddEE	GPU-offline,cmem,vol=995328precision=8Nc=3	64	1	1	7776	2	1	1586	-1	-1	-1	-1	0.000646144	# 0.00 Gflop/s, 1577.38 GB/s, tuning took 0.555232 seconds at Tue Mar  4 23:52:33 2025
     24x24x24x72	N4quda10CopyCloverINS_6clover11FloatNOrderIdLi72ELi2ELb0ELb1ELb0EEENS1_11QDPJITOrderIdLi72EEEddEE	GPU-offline,cmem,vol=995328precision=8Nc=3,compute_diagonal	288	1	1	1728	2	1	9831	-1	-1	-1	-1	1.92732e-05	# 0.00 Gflop/s, 0.05 GB/s, tuning took 0.038757 seconds at Tue Mar  4 23:52:32 2025
     24x24x24x72	N4quda10CopyCloverINS_6clover11FloatNOrderIfLi72ELi4ELb0ELb1ELb0EEENS2_IdLi72ELi2ELb0ELb1ELb0EEEfdEE	GPU-offline,cmem,vol=995328precision=8Nc=3	64	1	1	7776	2	1	0	-1	-1	-1	-1	0.0004864	# 0.00 Gflop/s, 1375.12 GB/s, tuning took 0.454270 seconds at Tue Mar  4 23:52:33 2025
     24x24x24x72	N4quda11SpinorNoiseIfLi4ELi3EEE	GPU-offline,vol=995328,parity=2,precision=4,order=4,Ns=4,Nc=3,uniform	96	1	1	5184	2	1	3781	-1	-1	-1	-1	0.000160329	# 0.00 Gflop/s, 595.97 GB/s, tuning took 0.258330 seconds at Tue Mar  4 23:52:35 2025
     24x24x24x72	N4quda12ExtractGhostIdLi3ENS_5gauge11FloatNOrderIdLi18ELi2ELi12EL20QudaStaggeredPhase_s0ELb1EL19QudaGhostExchange_sn2147483648ELb0EEEEE	GPU-offline,cmem,vol=995328stride=518400precision=8geometry=4Nc=3,extract	32	1	2	1296	1	4	0	-1	-1	-1	-1	3.51086e-05	# 0.00 Gflop/s, 756.00 GB/s, tuning took 0.081423 seconds at Tue Mar  4 23:52:31 2025
     24x24x24x72	N4quda15CopyColorSpinorILi4ELi3ENS_11colorspinor11FloatNOrderIfLi4ELi3ELi4ELb0ELb0EEES3_St5tupleIJRNS_16ColorSpinorFieldERKS5_19QudaFieldLocation_sPfPKfEEEE	GPU-offline,cmem,vol=995328,parity=2,precision=4,order=4,Ns=4,Nc=3vol=995328,parity=2,precision=4,order=4,Ns=4,Nc=3,NonRelBasis	32	1	1	15552	2	1	0	-1	-1	-1	-1	0.000145993	# 0.00 Gflop/s, 1308.99 GB/s, tuning took 0.033930 seconds at Tue Mar  4 23:52:35 2025
     24x24x24x72	N4quda15CopyColorSpinorILi4ELi3ENS_11colorspinor11FloatNOrderIfLi4ELi3ELi4ELb0ELb0EEES3_St5tupleIJRNS_16ColorSpinorFieldERKS5_19QudaFieldLocation_sPfPKfEEEE	GPU-offline,cmem,vol=995328,parity=2,precision=4,order=4,Ns=4,Nc=3vol=995328,parity=2,precision=4,order=4,Ns=4,Nc=3,RelBasis	32	1	1	15552	2	1	0	-1	-1	-1	-1	0.000145262	# 0.00 Gflop/s, 1315.58 GB/s, tuning took 0.033943 seconds at Tue Mar  4 23:52:35 2025
     24x24x24x72	N4quda4blas4CdotIdfEE	GPU-offline,vol=995328,parity=2,precision=4,order=4,Ns=4,Nc=3	768	1	1	216	1	1	0	-1	-1	-1	-1	0.000142921	# 668.56 Gflop/s, 1337.12 GB/s, tuning took 1.276629 seconds at Tue Mar  4 23:52:48 2025
     24x24x24x72	N4quda4blas4axy_IfEE	GPU-offline,vol=995328,parity=2,precision=4,order=4,Ns=4,Nc=3	320	1	1	216	2	1	0	-1	-1	-1	-1	0.000148041	# 161.36 Gflop/s, 1290.88 GB/s, tuning took 0.035357 seconds at Tue Mar  4 23:52:47 2025
     24x24x24x72	N4quda4blas5Norm2IdfEE	GPU-offline,vol=995328,parity=2,precision=4,order=4,Ns=4,Nc=3	640	1	1	192	1	1	0	-1	-1	-1	-1	7.93994e-05	# 601.71 Gflop/s, 1203.43 GB/s, tuning took 1.016380 seconds at Tue Mar  4 23:52:47 2025
     24x24x24x72	N4quda4blas6caxpy_IfEE	GPU-offline,vol=995328,parity=2,precision=4,order=4,Ns=4,Nc=3	224	2	1	216	1	1	0	-1	-1	-1	-1	0.000213811	# 446.90 Gflop/s, 1340.69 GB/s, tuning took 0.045907 seconds at Tue Mar  4 23:52:48 2025
     24x24x24x72	N4quda7RNGInitE	GPU-offline,vol=995328,parity=2,precision=4,order=4,Ns=4,Nc=3	320	2	1	1556	1	1	0	-1	-1	-1	-1	0.00974165	# 0.00 Gflop/s, 0.00 GB/s, tuning took 1.356503 seconds at Tue Mar  4 23:52:35 2025
     24x24x24x72	N4quda9CopyGaugeINS_12CopyGaugeArgIddLi18ELb0ENS_5gauge11FloatNOrderIdLi18ELi2ELi12EL20QudaStaggeredPhase_s0ELb1EL19QudaGhostExchange_sn2147483648ELb0EEENS2_11QDPJITOrderIdLi18EEEEEEE	GPU-offline,cmem,vol=995328stride=497664precision=8geometry=4Nc=3,vol=995328stride=518400precision=8geometry=4Nc=3	32	1	4	15552	1	2	0	-1	-1	-1	-1	0.000561493	# 0.00 Gflop/s, 1730.10 GB/s, tuning took 0.992472 seconds at Tue Mar  4 23:52:31 2025
     24x24x24x72	N4quda9CopyGaugeINS_12CopyGaugeArgIddLi18ELb0ENS_5gauge11FloatNOrderIdLi18ELi2ELi12EL20QudaStaggeredPhase_s0ELb1EL19QudaGhostExchange_sn2147483648ELb0EEES6_EEEE	GPU-offline,cmem,vol=995328stride=518400precision=8geometry=4Nc=3,vol=995328stride=518400precision=8geometry=4Nc=3,ghost	64	1	1	324	1	8	1639	-1	-1	-1	-1	1.1214e-05	# 0.00 Gflop/s, 2465.48 GB/s, tuning took 0.037340 seconds at Tue Mar  4 23:52:31 2025
     24x24x24x72	N4quda9CopyGaugeINS_12CopyGaugeArgIfdLi18ELb0ENS_5gauge11FloatNOrderIfLi18ELi4ELi12EL20QudaStaggeredPhase_s0ELb1EL19QudaGhostExchange_sn2147483648ELb0EEENS3_IdLi18ELi2ELi12ELS4_0ELb1ELS5_n2147483648ELb0EEEEEEE	GPU-offline,cmem,vol=995328stride=518400precision=8geometry=4Nc=3,vol=995328stride=518400precision=4geometry=4Nc=3	32	1	8	15552	1	1	0	-1	-1	-1	-1	0.000415744	# 0.00 Gflop/s, 1436.45 GB/s, tuning took 0.738606 seconds at Tue Mar  4 23:52:32 2025
     24x24x24x72	N4quda9CopyGaugeINS_12CopyGaugeArgIfdLi18ELb0ENS_5gauge11FloatNOrderIfLi18ELi4ELi12EL20QudaStaggeredPhase_s0ELb1EL19QudaGhostExchange_sn2147483648ELb0EEENS3_IdLi18ELi2ELi12ELS4_0ELb1ELS5_n2147483648ELb0EEEEEEE	GPU-offline,cmem,vol=995328stride=518400precision=8geometry=4Nc=3,vol=995328stride=518400precision=4geometry=4Nc=3,ghost	32	1	1	648	1	8	0	-1	-1	-1	-1	8.68909e-06	# 0.00 Gflop/s, 2386.44 GB/s, tuning took 0.035610 seconds at Tue Mar  4 23:52:32 2025
     24x24x24x72	N4quda9CopyGaugeINS_12CopyGaugeArgIffLi18ELb0ENS_5gauge11FloatNOrderIfLi18ELi2ELi18EL20QudaStaggeredPhase_s0ELb1EL19QudaGhostExchange_sn2147483648ELb0EEENS3_IfLi18ELi4ELi12ELS4_0ELb1ELS5_n2147483648ELb0EEEEEEE	GPU-offline,cmem,vol=995328stride=518400precision=4geometry=4Nc=3,vol=995328stride=518400precision=4geometry=4Nc=3	32	1	1	15552	1	8	0	-1	-1	-1	-1	0.000368299	# 0.00 Gflop/s, 1351.25 GB/s, tuning took 0.660737 seconds at Tue Mar  4 23:52:57 2025
     24x24x24x72	N4quda9CopyGaugeINS_12CopyGaugeArgIffLi18ELb0ENS_5gauge11FloatNOrderIfLi18ELi2ELi18EL20QudaStaggeredPhase_s0ELb1EL19QudaGhostExchange_sn2147483648ELb0EEENS3_IfLi18ELi4ELi12ELS4_0ELb1ELS5_n2147483648ELb0EEEEEEE	GPU-offline,cmem,vol=995328stride=518400precision=4geometry=4Nc=3,vol=995328stride=518400precision=4geometry=4Nc=3,ghost	32	1	3	648	1	3	0	-1	-1	-1	-1	9.35184e-06	# 0.00 Gflop/s, 1847.77 GB/s, tuning took 0.035032 seconds at Tue Mar  4 23:52:57 2025
        2x4x4x18	N4quda10CopySpinorIffLi2ELi32ENS_11colorspinor12FieldOrderCBIfLi2ELi32ELi1EL16QudaFieldOrder_s2EffLb0ELb0EEES4_EE	GPU-offline,cmem,vol=576,parity=1,precision=4,order=2,Ns=2,Nc=32	448	1	1	2	1	1	0	-1	-1	-1	-1	1.42584e-05	# 0.00 Gflop/s, 41.37 GB/s, tuning took 0.011614 seconds at Sun Aug 18 11:54:42 2024
        2x4x4x18	N4quda12DslashCoarseIfffLi2ELi32ELb0ELb1ELb0ELNS_10DslashTypeE2EEE	policy_kernel,GPU-offline,vol=576,parity=1,precision=4,order=2,Ns=2,Nc=32,comm=0001,full,halo=00000011,n_rhs=1	64	1	8	36	1	8	8192	4	1	1	1	8.48457e-06	# 2215.86 Gflop/s, 2294.07 GB/s, tuning took 0.109045 seconds at Sun Aug 18 11:54:23 2024
        2x4x4x18	N4quda12DslashCoarseIfffLi2ELi32ELb0ELb1ELb0ELNS_10DslashTypeE2EEE	policy_kernel,GPU-offline,vol=576,parity=1,precision=4,order=2,Ns=2,Nc=32,comm=0001,full,halo=00000022,n_rhs=1	64	1	8	36	1	8	8192	4	1	1	1	8.45049e-06	# 2224.80 Gflop/s, 2303.32 GB/s, tuning took 0.108524 seconds at Sun Aug 18 11:54:23 2024
        2x4x4x18	N4quda12DslashCoarseIfffLi2ELi32ELb1ELb0ELb0ELNS_10DslashTypeE2EEE	policy_kernel,GPU-offline,vol=576,parity=1,precision=4,order=2,Ns=2,Nc=32,comm=0001,full,halo=00000011,n_rhs=1	32	1	4	18	1	32	3277	1	2	1	1	0.000114688	# 1315.93 Gflop/s, 1339.71 GB/s, tuning took 0.419145 seconds at Sun Aug 18 11:54:22 2024
        2x4x4x18	N4quda12DslashCoarseIfffLi2ELi32ELb1ELb0ELb0ELNS_10DslashTypeE2EEE	policy_kernel,GPU-offline,vol=576,parity=1,precision=4,order=2,Ns=2,Nc=32,comm=0001,full,halo=00000022,n_rhs=1	32	1	12	18	1	11	12289	1	2	1	1	0.000117191	# 1287.82 Gflop/s, 1311.10 GB/s, tuning took 0.434345 seconds at Sun Aug 18 11:54:23 2024
        2x4x4x18	N4quda22DslashCoarsePolicyTuneINS_18DslashCoarseLaunchINS_1DELb0ELi32ELb0ELi1EEEEE	policy,clover,vol=576,parity=1,precision=4,order=2,Ns=2,Nc=32,gauge_prec=4,halo_prec=4,comm=0001,topo=1112,order=01,p2p=3,gdr=0,nvshmem=0,pol=11110000000,full,n_rhs=1	32	1	1	1	1	1	0	3	0	0	0	8.45049e-06	# 2224.80 Gflop/s, 2303.32 GB/s, tuning took 0.003794 seconds at Sun Aug 18 11:54:23 2024
        2x4x4x18	N4quda22DslashCoarsePolicyTuneINS_18DslashCoarseLaunchINS_1DELb0ELi32ELb0ELi1EEEEE	policy,dslash,vol=576,parity=1,precision=4,order=2,Ns=2,Nc=32,gauge_prec=4,halo_prec=4,comm=0001,topo=1112,order=01,p2p=3,gdr=0,nvshmem=0,pol=11110000000,full,n_rhs=1	32	1	1	1	1	1	0	1	0	0	0	0.000161353	# 935.35 Gflop/s, 952.25 GB/s, tuning took 0.007672 seconds at Sun Aug 18 11:54:23 2024
        2x4x4x18	N4quda4blas10CdotNormABIdfEE	GPU-offline,vol=576,parity=1,precision=4,order=2,Ns=2,Nc=32	352	1	1	17	1	1	0	-1	-1	-1	-1	1.13724e-05	# 51.86 Gflop/s, 51.86 GB/s, tuning took 0.043203 seconds at Sun Aug 18 11:54:42 2024
        2x4x4x18	N4quda4blas11axpbyzNorm2IdfEE	GPU-offline,vol=576,parity=1,precision=4,order=2,Ns=2,Nc=32	608	1	1	15	1	1	0	-1	-1	-1	-1	1.06649e-05	# 27.65 Gflop/s, 82.96 GB/s, tuning took 0.041369 seconds at Sun Aug 18 11:54:23 2024
        2x4x4x18	N4quda4blas11multicaxpy_IfEE	GPU-offline,cmem,vol=576,parity=1,precision=4,order=2,Ns=2,Nc=32,Nxz=1,Nyw=1	256	1	1	216	1	1	0	1	0	0	0	1.09303e-05	# 26.98 Gflop/s, 80.94 GB/s, tuning took 0.011759 seconds at Sun Aug 18 11:54:42 2024
        2x4x4x18	N4quda4blas11multicaxpy_IfEE	GPU-offline,cmem,vol=576,parity=1,precision=4,order=2,Ns=2,Nc=32,Nxz=2,Nyw=1	416	1	1	216	1	1	0	1	0	0	0	1.08936e-05	# 54.14 Gflop/s, 108.29 GB/s, tuning took 0.012324 seconds at Sun Aug 18 11:54:42 2024
        2x4x4x18	N4quda4blas11multicaxpy_IfEE	GPU-offline,cmem,vol=576,parity=1,precision=4,order=2,Ns=2,Nc=32,Nxz=3,Nyw=1	416	1	1	216	1	1	0	1	0	0	0	1.01669e-05	# 87.02 Gflop/s, 145.04 GB/s, tuning took 0.012067 seconds at Sun Aug 18 11:54:42 2024
        2x4x4x18	N4quda4blas11multicaxpy_IfEE	GPU-offline,cmem,vol=576,parity=1,precision=4,order=2,Ns=2,Nc=32,Nxz=4,Nyw=1	640	1	1	216	1	1	0	1	0	0	0	9.82204e-06	# 120.10 Gflop/s, 180.15 GB/s, tuning took 0.011811 seconds at Sun Aug 18 11:54:42 2024
        2x4x4x18	N4quda4blas11multicaxpy_IfEE	GPU-offline,cmem,vol=576,parity=1,precision=4,order=2,Ns=2,Nc=32,Nxz=8,Nyw=1	384	1	1	216	1	1	0	1	0	0	0	9.41483e-06	# 250.59 Gflop/s, 313.24 GB/s, tuning took 0.011861 seconds at Sun Aug 18 11:54:42 2024
        2x4x4x18	N4quda4blas12MaxDeviationIdfEE	GPU-offline,vol=576,parity=1,precision=4,order=2,Ns=2,Nc=32	384	1	1	16	1	1	0	-1	-1	-1	-1	1.06082e-05	# 0.00 Gflop/s, 55.60 GB/s, tuning took 0.041188 seconds at Sun Aug 18 11:54:23 2024
        2x4x4x18	N4quda4blas13cabxpyzaxnormIdfEE	GPU-offline,vol=576,parity=1,precision=4,order=2,Ns=2,Nc=32	544	1	1	17	1	1	0	-1	-1	-1	-1	1.07002e-05	# 68.90 Gflop/s, 110.25 GB/s, tuning took 0.042398 seconds at Sun Aug 18 11:54:42 2024
        2x4x4x18	N4quda4blas5Norm2IdfEE	GPU-offline,vol=576,parity=1,precision=4,order=2,Ns=2,Nc=32	768	1	1	12	1	1	0	-1	-1	-1	-1	1.03054e-05	# 14.31 Gflop/s, 28.62 GB/s, tuning took 0.038544 seconds at Sun Aug 18 11:54:23 2024
        2x4x4x18	N4quda4blas7axpbyz_IfEE	GPU-offline,vol=576,parity=1,precision=4,order=2,Ns=2,Nc=32	128	1	1	216	1	1	0	-1	-1	-1	-1	3.27398e-06	# 67.56 Gflop/s, 270.23 GB/s, tuning took 0.008338 seconds at Sun Aug 18 11:54:42 2024
        2x4x4x18	N4quda4blas9multiCdotIdfEE	policy_kernel,GPU-offline,vol=576,parity=1,precision=4,order=2,Ns=2,Nc=32,Nxz=1,Nyw=1,max_nyw_tile=8	512	1	1	18	1	1	0	-1	-1	-1	-1	1.32699e-05	# 22.22 Gflop/s, 44.45 GB/s, tuning took 0.018670 seconds at Sun Aug 18 11:54:42 2024
        2x4x4x18	N4quda4blas9multiCdotIdfEE	policy_kernel,GPU-offline,vol=576,parity=1,precision=4,order=2,Ns=2,Nc=32,Nxz=1,Nyw=2,max_nyw_tile=8	512	1	1	18	1	2	0	-1	-1	-1	-1	1.34729e-05	# 43.78 Gflop/s, 87.56 GB/s, tuning took 0.026315 seconds at Sun Aug 18 11:54:42 2024
        2x4x4x18	N4quda4blas9multiCdotIdfEE	policy_kernel,GPU-offline,vol=576,parity=1,precision=4,order=2,Ns=2,Nc=32,Nxz=1,Nyw=3,max_nyw_tile=8	512	1	1	18	1	3	0	-1	-1	-1	-1	1.36777e-05	# 64.68 Gflop/s, 129.37 GB/s, tuning took 0.033093 seconds at Sun Aug 18 11:54:42 2024
        2x4x4x18	N4quda4blas9multiCdotIdfEE	policy_kernel,GPU-offline,vol=576,parity=1,precision=4,order=2,Ns=2,Nc=32,Nxz=1,Nyw=4,max_nyw_tile=8	512	1	1	18	1	4	0	-1	-1	-1	-1	1.38731e-05	# 85.03 Gflop/s, 170.06 GB/s, tuning took 0.040384 seconds at Sun Aug 18 11:54:42 2024
        2x4x4x18	N4quda4blas9multiCdotIdfEE	policy_kernel,GPU-offline,vol=576,parity=1,precision=4,order=2,Ns=2,Nc=32,Nxz=1,Nyw=5,max_nyw_tile=8	512	1	1	18	1	5	0	-1	-1	-1	-1	1.38825e-05	# 106.22 Gflop/s, 212.43 GB/s, tuning took 0.045796 seconds at Sun Aug 18 11:54:42 2024
        2x4x4x18	N4quda4blas9multiCdotIdfEE	policy_kernel,GPU-offline,vol=576,parity=1,precision=4,order=2,Ns=2,Nc=32,Nxz=1,Nyw=6,max_nyw_tile=8	512	1	1	16	1	6	0	-1	-1	-1	-1	1.41751e-05	# 124.83 Gflop/s, 249.66 GB/s, tuning took 0.051858 seconds at Sun Aug 18 11:54:42 2024
        2x4x4x18	N4quda4blas9multiCdotIdfEE	policy_kernel,GPU-offline,vol=576,parity=1,precision=4,order=2,Ns=2,Nc=32,Nxz=1,Nyw=7,max_nyw_tile=8	512	1	1	18	1	7	0	-1	-1	-1	-1	1.42155e-05	# 145.22 Gflop/s, 290.44 GB/s, tuning took 0.057686 seconds at Sun Aug 18 11:54:42 2024
        2x4x4x18	N4quda4blas9multiCdotIdfEE	policy_kernel,GPU-offline,vol=576,parity=1,precision=4,order=2,Ns=2,Nc=32,Nxz=1,Nyw=8,max_nyw_tile=8	512	1	1	18	1	8	0	-1	-1	-1	-1	1.42758e-05	# 165.27 Gflop/s, 330.53 GB/s, tuning took 0.064077 seconds at Sun Aug 18 11:54:42 2024
      2x4x4x18x1	N4quda9GhostPackIffL16QudaFieldOrder_s2ELi2ELi32EEE	GPU-offline,vol=576,parity=1,precision=4,order=2,Ns=2,Nc=32,halo_prec=4,comm=0001,topo=1112,order=01,dest=00000011,nFace=1,spins_per_thread=2,colors_per_thread=2,shmem=0,batched	160	1	1	1	16	1	0	-1	-1	-1	-1	5.33023e-06	# 0.00 Gflop/s, 12.30 GB/s, tuning took 0.011434 seconds at Sun Aug 18 11:54:22 2024
      2x4x4x18x1	N4quda9GhostPackIffL16QudaFieldOrder_s2ELi2ELi32EEE	GPU-offline,vol=576,parity=1,precision=4,order=2,Ns=2,Nc=32,halo_prec=4,comm=0001,topo=1112,order=01,dest=00000022,nFace=1,spins_per_thread=2,colors_per_thread=2,shmem=0,batched	224	1	1	1	16	1	0	-1	-1	-1	-1	7.48856e-06	# 0.00 Gflop/s, 8.75 GB/s, tuning took 0.012647 seconds at Sun Aug 18 11:54:22 2024
        4x4x4x18	N4quda10CalculateYILb1EL19QudaFieldLocation_s2ENS_13CalculateYArgILb1EfLi2ELi2ELi24ELi32ENS_5gauge10FieldOrderIfLi64ELi2EL21QudaGaugeFieldOrder_s13ELb1EfEENS4_IfLi64ELi2ELS5_13ELb1EiEENS4_IfLi48ELi2ELS5_13ELb1EfEENS_11colorspinor12FieldOrderCBIfLi2ELi24ELi32EL16QudaFieldOrder_s9EffLb0ELb0EEENSA_IfLi4ELi24ELi32ELSB_9EffLb0ELb0EEESC_S8_EEEE	GPU-offline,vol=9216,parity=2,precision=4,order=9,Ns=2,Nc=768,comm=0001,computeCoarseDiagonal,GPU-device	32	1	1	18	2	32	0	1	0	0	0	5.5808e-06	# 13.21 Gflop/s, 211.38 GB/s, tuning took 0.030403 seconds at Sun Aug 18 11:54:01 2024
        4x4x4x18	N4quda10CalculateYILb1EL19QudaFieldLocation_s2ENS_13CalculateYArgILb1EfLi2ELi2ELi24ELi32ENS_5gauge10FieldOrderIfLi64ELi2EL21QudaGaugeFieldOrder_s13ELb1EfEENS4_IfLi64ELi2ELS5_13ELb1EiEENS4_IfLi48ELi2ELS5_13ELb1EfEENS_11colorspinor12FieldOrderCBIfLi2ELi24ELi32EL16QudaFieldOrder_s9EffLb0ELb0EEENSA_IfLi4ELi24ELi32ELSB_9EffLb0ELb0EEESC_S8_EEEE	GPU-offline,vol=9216,parity=2,precision=4,order=9,Ns=2,Nc=768,comm=0001,computeConvert,GPU-device	32	16	1	18	4	32	16385	1	0	0	0	0.000160914	# 0.46 Gflop/s, 469.18 GB/s, tuning took 1.038337 seconds at Sun Aug 18 11:53:58 2024
        4x4x4x18	N4quda11SpinorNoiseIfLi2ELi32EEE	GPU-offline,vol=1152,parity=2,precision=4,order=2,Ns=2,Nc=32,uniform	32	1	1	18	2	1	1821	-1	-1	-1	-1	1.4336e-05	# 0.00 Gflop/s, 41.14 GB/s, tuning took 0.036145 seconds at Sun Aug 18 11:54:19 2024
        4x4x4x18	N4quda12DslashCoarseIfffLi2ELi32ELb1ELb1ELb0ELNS_10DslashTypeE2EEE	policy_kernel,GPU-offline,vol=1152,parity=2,precision=4,order=2,Ns=2,Nc=32,comm=0001,full,halo=00000011,n_rhs=1	128	1	2	18	2	32	4096	4	1	1	1	0.000250624	# 1354.98 Gflop/s, 1379.11 GB/s, tuning took 1.229208 seconds at Sun Aug 18 11:54:21 2024
        4x4x4x18	N4quda12DslashCoarseIfffLi2ELi32ELb1ELb1ELb0ELNS_10DslashTypeE2EEE	policy_kernel,GPU-offline,vol=1152,parity=2,precision=4,order=2,Ns=2,Nc=32,comm=0001,full,halo=00000022,n_rhs=1	32	1	4	36	2	32	16384	2	2	1	1	0.000254208	# 1335.88 Gflop/s, 1359.66 GB/s, tuning took 1.256266 seconds at Sun Aug 18 11:54:22 2024
        4x4x4x18	N4quda12ExtractGhostIfLi64ENS_5gauge10FieldOrderIfLi64ELi1EL21QudaGaugeFieldOrder_s13ELb1EfEEEE	GPU-offline,vol=1152stride=864precision=4geometry=8Nc=64fine-grained,extract	96	1	1	3	64	8	2731	-1	-1	-1	-1	0.000117646	# 0.00 Gflop/s, 516.95 GB/s, tuning took 0.637255 seconds at Sun Aug 18 11:54:02 2024
        4x4x4x18	N4quda12ExtractGhostIfLi64ENS_5gauge10FieldOrderIfLi64ELi1EL21QudaGaugeFieldOrder_s2ELb0EfEEEE	GPU-offline,vol=1152stride=864precision=4geometry=8Nc=64fine-grained,extract	96	1	3	3	64	3	0	-1	-1	-1	-1	0.000100352	# 0.00 Gflop/s, 606.04 GB/s, tuning took 0.800626 seconds at Sun Aug 18 11:54:06 2024
        4x4x4x18	N4quda12ExtractGhostIfLi64ENS_5gauge10FieldOrderIfLi64ELi1EL21QudaGaugeFieldOrder_s2ELb0EfEEEE	GPU-offline,vol=1152stride=864precision=4geometry=8Nc=64fine-grained,inject	320	1	2	1	64	4	0	-1	-1	-1	-1	1.57013e-05	# 0.00 Gflop/s, 3873.39 GB/s, tuning took 0.100408 seconds at Sun Aug 18 11:54:05 2024
        4x4x4x18	N4quda13CalculateYhatIL19QudaFieldLocation_s2EfNS_5gauge10FieldOrderIfLi64ELi1EL21QudaGaugeFieldOrder_s13ELb1EfEES5_S5_Li64ELi4ELi2ELb0ELb1EEE	GPU-offline,vol=1152stride=864precision=4geometry=8Nc=64,GPU-device,comm=0001,mma,1xfp16,m16n8k8	8	1	1	72	32	128	0	0	0	0	0	0.000612352	# 31439.20 Gflop/s, 67070.29 GB/s, tuning took 0.004572 seconds at Sun Aug 18 11:54:02 2024
        4x4x4x18	N4quda22DslashCoarsePolicyTuneINS_18DslashCoarseLaunchINS_1DELb0ELi32ELb0ELi1EEEEE	policy,dslashclover,vol=1152,parity=2,precision=4,order=2,Ns=2,Nc=32,gauge_prec=4,halo_prec=4,comm=0001,topo=1112,order=01,p2p=3,gdr=0,nvshmem=0,pol=11110000000,full,n_rhs=1	32	1	1	1	1	1	0	0	0	0	0	0.000308224	# 1101.77 Gflop/s, 1121.38 GB/s, tuning took 0.010574 seconds at Sun Aug 18 11:54:22 2024
        4x4x4x18	N4quda4blas11axpbyzNorm2IdfEE	GPU-offline,vol=1152,parity=2,precision=4,order=2,Ns=2,Nc=32	576	1	1	32	1	1	0	-1	-1	-1	-1	9.80114e-06	# 60.18 Gflop/s, 180.54 GB/s, tuning took 0.075533 seconds at Sun Aug 18 11:54:19 2024
        4x4x4x18	N4quda4blas12MaxDeviationIdfEE	GPU-offline,vol=1152,parity=2,precision=4,order=2,Ns=2,Nc=32	384	1	1	32	1	1	0	-1	-1	-1	-1	1.05391e-05	# 0.00 Gflop/s, 111.93 GB/s, tuning took 0.076242 seconds at Sun Aug 18 11:54:19 2024
        4x4x4x18	N4quda4blas5Norm2IdfEE	GPU-offline,vol=1152,parity=2,precision=4,order=2,Ns=2,Nc=32	672	1	1	32	1	1	0	-1	-1	-1	-1	9.45633e-06	# 31.19 Gflop/s, 62.37 GB/s, tuning took 0.069852 seconds at Sun Aug 18 11:54:19 2024
        4x4x4x18	N4quda7RNGInitE	GPU-offline,vol=1152,parity=2,precision=4,order=2,Ns=2,Nc=32	128	1	1	5	2	1	0	-1	-1	-1	-1	0.000289024	# 0.00 Gflop/s, 0.00 GB/s, tuning took 0.049257 seconds at Sun Aug 18 11:54:35 2024
        4x4x4x18	N4quda9CopyGaugeINS_12CopyGaugeArgIffLi8192ELb1ENS_5gauge10FieldOrderIfLi64ELi1EL21QudaGaugeFieldOrder_s13ELb1EfEENS3_IfLi64ELi1ELS4_2ELb1EfEEEEEE	GPU-offline,vol=1152stride=576precision=4geometry=1Nc=64,vol=1152stride=576precision=4geometry=1Nc=64,fine-grained	288	1	1	2	64	2	16385	-1	-1	-1	-1	0.000258816	# 0.00 Gflop/s, 291.70 GB/s, tuning took 0.768450 seconds at Sun Aug 18 11:54:18 2024
        4x4x4x18	N4quda9CopyGaugeINS_12CopyGaugeArgIffLi8192ELb1ENS_5gauge10FieldOrderIfLi64ELi1EL21QudaGaugeFieldOrder_s13ELb1EfEENS3_IfLi64ELi1ELS4_2ELb1EfEEEEEE	GPU-offline,vol=1152stride=864precision=4geometry=8Nc=64,vol=1152stride=864precision=4geometry=8Nc=64,fine-grained	32	6	1	18	11	16	7022	-1	-1	-1	-1	0.00203025	# 0.00 Gflop/s, 446.24 GB/s, tuning took 9.340368 seconds at Sun Aug 18 11:54:16 2024
        4x4x4x18	N4quda9CopyGaugeINS_12CopyGaugeArgIffLi8192ELb1ENS_5gauge10FieldOrderIfLi64ELi1EL21QudaGaugeFieldOrder_s13ELb1EfEENS3_IfLi64ELi1ELS4_2ELb1EfEEEEEE	GPU-offline,vol=1152stride=864precision=4geometry=8Nc=64,vol=1152stride=864precision=4geometry=8Nc=64,fine-grained,ghost	96	1	1	2	64	8	3073	-1	-1	-1	-1	0.000180736	# 0.00 Gflop/s, 1009.50 GB/s, tuning took 0.851837 seconds at Sun Aug 18 11:54:17 2024
        4x4x4x18	N4quda9CopyGaugeINS_12CopyGaugeArgIffLi8192ELb1ENS_5gauge10FieldOrderIfLi64ELi1EL21QudaGaugeFieldOrder_s2ELb0EfEENS3_IfLi64ELi1ELS4_2ELb1EfEEEEEE	GPU-offline,vol=1152stride=864precision=4geometry=8Nc=64,vol=1152stride=864precision=4geometry=8Nc=64,fine-grained,ghost	32	8	1	5	8	8	0	-1	-1	-1	-1	6.3872e-05	# 0.00 Gflop/s, 2856.53 GB/s, tuning took 0.516911 seconds at Sun Aug 18 11:54:05 2024
        4x4x4x18	N4quda9CopyGaugeINS_12CopyGaugeArgIffLi8192ELb1ENS_5gauge10FieldOrderIfLi64ELi1EL21QudaGaugeFieldOrder_s2ELb1EfEENS3_IfLi64ELi1ELS4_13ELb1EfEEEEEE	GPU-offline,vol=1152stride=576precision=4geometry=1Nc=64,vol=1152stride=576precision=4geometry=1Nc=64,fine-grained	32	11	1	18	6	2	12289	-1	-1	-1	-1	6.76523e-05	# 0.00 Gflop/s, 1115.96 GB/s, tuning took 0.244128 seconds at Sun Aug 18 11:54:01 2024
        4x4x4x18	N4quda9CopyGaugeINS_12CopyGaugeArgIffLi8192ELb1ENS_5gauge10FieldOrderIfLi64ELi1EL21QudaGaugeFieldOrder_s2ELb1EfEENS3_IfLi64ELi1ELS4_13ELb1EfEEEEEE	GPU-offline,vol=1152stride=864precision=4geometry=8Nc=64,vol=1152stride=864precision=4geometry=8Nc=64,fine-grained	32	6	2	18	11	8	12289	-1	-1	-1	-1	0.000516779	# 0.00 Gflop/s, 1753.11 GB/s, tuning took 2.673601 seconds at Sun Aug 18 11:54:04 2024
        4x4x4x18	N4quda9CopyGaugeINS_12CopyGaugeArgIffLi8192ELb1ENS_5gauge10FieldOrderIfLi64ELi1EL21QudaGaugeFieldOrder_s2ELb1EfEENS3_IfLi64ELi1ELS4_13ELb1EfEEEEEE	GPU-offline,vol=1152stride=864precision=4geometry=8Nc=64,vol=1152stride=864precision=4geometry=8Nc=64,fine-grained,ghost	160	1	3	1	64	3	16385	-1	-1	-1	-1	6.2208e-05	# 0.00 Gflop/s, 2932.94 GB/s, tuning took 0.309361 seconds at Sun Aug 18 11:54:05 2024
        4x4x4x18	N4quda9CopyGaugeINS_12CopyGaugeArgIffLi8192ELb1ENS_5gauge10FieldOrderIfLi64ELi1EL21QudaGaugeFieldOrder_s2ELb1EfEENS3_IfLi64ELi1ELS4_2ELb0EfEEEEEE	GPU-offline,vol=1152stride=864precision=4geometry=8Nc=64,vol=1152stride=864precision=4geometry=8Nc=64,fine-grained,ghost	128	2	1	2	32	8	0	-1	-1	-1	-1	6.4704e-05	# 0.00 Gflop/s, 2819.80 GB/s, tuning took 0.526969 seconds at Sun Aug 18 11:54:07 2024
4x4x4x18,4x8x8x18	N4quda16ProlongateLaunchIffLi2ELi24ELi2ELi32EEE	GPU-offline,vol=1152,parity=2,precision=4,order=2,Ns=2,Nc=32,vol=4608,parity=1,precision=4,order=2,Ns=2,Nc=24	32	1	1	144	1	24	0	-1	-1	-1	-1	4.97859e-05	# 1137.33 Gflop/s, 1185.09 GB/s, tuning took 0.111860 seconds at Sun Aug 18 11:54:43 2024
4x4x4x18,8x8x8x18	N4quda16ProlongateLaunchIffLi2ELi24ELi2ELi32EEE	GPU-offline,vol=1152,parity=2,precision=4,order=2,Ns=2,Nc=32,vol=9216,parity=2,precision=4,order=2,Ns=2,Nc=24	128	2	1	36	1	24	0	-1	-1	-1	-1	9.2928e-05	# 1218.64 Gflop/s, 1263.47 GB/s, tuning took 0.265200 seconds at Sun Aug 18 11:54:19 2024
      4x4x4x18x1	N4quda9GhostPackIffL16QudaFieldOrder_s2ELi2ELi32EEE	GPU-offline,vol=1152,parity=2,precision=4,order=2,Ns=2,Nc=32,halo_prec=4,comm=0001,topo=1112,order=01,dest=00000011,nFace=1,spins_per_thread=2,colors_per_thread=2,shmem=0,batched	384	1	1	1	16	2	0	-1	-1	-1	-1	5.17026e-06	# 0.00 Gflop/s, 12.68 GB/s, tuning took 0.013178 seconds at Sun Aug 18 11:54:19 2024
      4x4x4x18x1	N4quda9GhostPackIffL16QudaFieldOrder_s2ELi2ELi32EEE	GPU-offline,vol=1152,parity=2,precision=4,order=2,Ns=2,Nc=32,halo_prec=4,comm=0001,topo=1112,order=01,dest=00000022,nFace=1,spins_per_thread=2,colors_per_thread=2,shmem=0,batched	256	1	1	1	16	2	0	-1	-1	-1	-1	9.96387e-06	# 0.00 Gflop/s, 6.58 GB/s, tuning took 0.015948 seconds at Sun Aug 18 11:54:21 2024
        4x8x8x18	N4quda10CopySpinorIffLi2ELi24ENS_11colorspinor12FieldOrderCBIfLi2ELi24ELi1EL16QudaFieldOrder_s2EffLb0ELb0EEES4_EE	GPU-offline,cmem,vol=4608,parity=1,precision=4,order=2,Ns=2,Nc=24	576	1	1	8	1	1	0	-1	-1	-1	-1	1.21263e-05	# 0.00 Gflop/s, 291.84 GB/s, tuning took 0.011347 seconds at Sun Aug 18 11:53:23 2024
        4x8x8x18	N4quda12DslashCoarseIfffLi2ELi24ELb0ELb1ELb0ELNS_10DslashTypeE2EEE	policy_kernel,GPU-offline,vol=4608,parity=1,precision=4,order=2,Ns=2,Nc=24,comm=0001,full,halo=00000011,n_rhs=1	128	1	8	36	1	6	16384	1	1	1	1	6.8224e-05	# 1238.45 Gflop/s, 1296.81 GB/s, tuning took 0.656165 seconds at Sun Aug 18 11:52:02 2024
        4x8x8x18	N4quda12DslashCoarseIfffLi2ELi24ELb0ELb1ELb0ELNS_10DslashTypeE2EEE	policy_kernel,GPU-offline,vol=4608,parity=1,precision=4,order=2,Ns=2,Nc=24,comm=0001,full,halo=00000022,n_rhs=1	256	1	4	18	1	12	16384	1	1	1	1	6.816e-05	# 1239.62 Gflop/s, 1298.03 GB/s, tuning took 0.654844 seconds at Sun Aug 18 11:52:02 2024
        4x8x8x18	N4quda12DslashCoarseIfffLi2ELi24ELb1ELb0ELb0ELNS_10DslashTypeE2EEE	policy_kernel,GPU-offline,vol=4608,parity=1,precision=4,order=2,Ns=2,Nc=24,comm=0001,full,halo=00000011,n_rhs=1	32	1	4	144	1	24	3511	1	2	1	1	0.000489472	# 1387.28 Gflop/s, 1420.72 GB/s, tuning took 1.886897 seconds at Sun Aug 18 11:51:59 2024
        4x8x8x18	N4quda12DslashCoarseIfffLi2ELi24ELb1ELb0ELb0ELNS_10DslashTypeE2EEE	policy_kernel,GPU-offline,vol=4608,parity=1,precision=4,order=2,Ns=2,Nc=24,comm=0001,full,halo=00000022,n_rhs=1	32	1	4	144	1	24	2048	1	2	1	1	0.000493227	# 1376.72 Gflop/s, 1409.90 GB/s, tuning took 1.986629 seconds at Sun Aug 18 11:52:01 2024
        4x8x8x18	N4quda12DslashCoarseIfffLi2ELi24ELb1ELb0ELb1ELNS_10DslashTypeE2EEE	policy_kernel,GPU-offline,vol=4608,parity=1,precision=4,order=2,Ns=2,Nc=24,comm=0001,full,halo=00000011,n_rhs=1	32	1	4	144	1	24	3073	1	2	1	1	0.000490155	# 1385.35 Gflop/s, 1418.74 GB/s, tuning took 1.810438 seconds at Sun Aug 18 11:53:21 2024
        4x8x8x18	N4quda12DslashCoarseIfffLi2ELi24ELb1ELb0ELb1ELNS_10DslashTypeE2EEE	policy_kernel,GPU-offline,vol=4608,parity=1,precision=4,order=2,Ns=2,Nc=24,comm=0001,full,halo=00000022,n_rhs=1	32	1	4	144	1	24	3781	1	2	1	1	0.000494592	# 1372.92 Gflop/s, 1406.01 GB/s, tuning took 1.918059 seconds at Sun Aug 18 11:53:23 2024
        4x8x8x18	N4quda22DslashCoarsePolicyTuneINS_18DslashCoarseLaunchINS_1DELb0ELi24ELb0ELi1EEEEE	policy,clover,vol=4608,parity=1,precision=4,order=2,Ns=2,Nc=24,gauge_prec=4,halo_prec=4,comm=0001,topo=1112,order=01,p2p=3,gdr=0,nvshmem=0,pol=11110000000,full,n_rhs=1	32	1	1	1	1	1	0	2	0	0	0	6.79936e-05	# 1242.65 Gflop/s, 1301.20 GB/s, tuning took 0.005448 seconds at Sun Aug 18 11:52:02 2024
        4x8x8x18	N4quda22DslashCoarsePolicyTuneINS_18DslashCoarseLaunchINS_1DELb0ELi24ELb0ELi1EEEEE	policy,dslash,vol=4608,parity=1,precision=4,order=2,Ns=2,Nc=24,gauge_prec=4,halo_prec=4,comm=0001,topo=1112,order=01,p2p=3,gdr=0,nvshmem=0,pol=11110000000,full,n_rhs=1	32	1	1	1	1	1	0	0	0	0	0	0.000602453	# 1127.12 Gflop/s, 1154.28 GB/s, tuning took 0.018502 seconds at Sun Aug 18 11:52:01 2024
        4x8x8x18	N4quda22DslashCoarsePolicyTuneINS_18DslashCoarseLaunchINS_1DELb1ELi24ELb0ELi1EEEEE	policy,dslash,vol=4608,parity=1,precision=4,order=2,Ns=2,Nc=24,gauge_prec=4,halo_prec=4,comm=0001,topo=1112,order=01,p2p=3,gdr=0,nvshmem=0,pol=11110000000,full,n_rhs=1	32	1	1	1	1	1	0	0	0	0	0	0.000589824	# 1151.25 Gflop/s, 1179.00 GB/s, tuning took 0.018185 seconds at Sun Aug 18 11:53:23 2024
        4x8x8x18	N4quda4blas10CdotNormABIdfEE	GPU-offline,vol=4608,parity=1,precision=4,order=2,Ns=2,Nc=24	384	1	1	80	1	1	0	-1	-1	-1	-1	1.17136e-05	# 302.12 Gflop/s, 302.12 GB/s, tuning took 0.075366 seconds at Sun Aug 18 11:54:43 2024
        4x8x8x18	N4quda4blas10caxpyxmaz_IfEE	GPU-offline,vol=4608,parity=1,precision=4,order=2,Ns=2,Nc=24	640	1	1	216	1	1	0	-1	-1	-1	-1	4.92525e-06	# 718.53 Gflop/s, 1796.33 GB/s, tuning took 0.009340 seconds at Sun Aug 18 11:54:43 2024
        4x8x8x18	N4quda4blas10multiaxpy_IfEE	GPU-offline,cmem,vol=4608,parity=1,precision=4,order=2,Ns=2,Nc=24,Nxz=1,Nyw=1	416	1	1	216	1	1	0	1	0	0	0	1.07847e-05	# 82.04 Gflop/s, 492.22 GB/s, tuning took 0.012254 seconds at Sun Aug 18 11:53:23 2024
        4x8x8x18	N4quda4blas11axpbyzNorm2IdfEE	GPU-offline,vol=4608,parity=1,precision=4,order=2,Ns=2,Nc=24	1024	1	1	128	1	1	0	-1	-1	-1	-1	1.01746e-05	# 173.91 Gflop/s, 521.73 GB/s, tuning took 0.072786 seconds at Sun Aug 18 11:52:02 2024
        4x8x8x18	N4quda4blas11multicaxpy_IfEE	GPU-offline,cmem,vol=4608,parity=1,precision=4,order=2,Ns=2,Nc=24,Nxz=1,Nyw=1	512	1	1	216	1	1	0	1	0	0	0	1.09154e-05	# 162.11 Gflop/s, 486.32 GB/s, tuning took 0.012384 seconds at Sun Aug 18 11:54:43 2024
        4x8x8x18	N4quda4blas11multicaxpy_IfEE	GPU-offline,cmem,vol=4608,parity=1,precision=4,order=2,Ns=2,Nc=24,Nxz=2,Nyw=1	832	1	1	216	1	1	0	1	0	0	0	1.08498e-05	# 326.18 Gflop/s, 652.35 GB/s, tuning took 0.011824 seconds at Sun Aug 18 11:54:43 2024
        4x8x8x18	N4quda4blas11multicaxpy_IfEE	GPU-offline,cmem,vol=4608,parity=1,precision=4,order=2,Ns=2,Nc=24,Nxz=3,Nyw=1	480	1	1	216	1	1	0	1	0	0	0	1.03925e-05	# 510.79 Gflop/s, 851.32 GB/s, tuning took 0.011788 seconds at Sun Aug 18 11:54:43 2024
        4x8x8x18	N4quda4blas11multicaxpy_IfEE	GPU-offline,cmem,vol=4608,parity=1,precision=4,order=2,Ns=2,Nc=24,Nxz=4,Nyw=1	544	1	1	216	1	1	0	1	0	0	0	1.00766e-05	# 702.41 Gflop/s, 1053.61 GB/s, tuning took 0.011582 seconds at Sun Aug 18 11:54:43 2024
        4x8x8x18	N4quda4blas11multicaxpy_IfEE	GPU-offline,cmem,vol=4608,parity=1,precision=4,order=2,Ns=2,Nc=24,Nxz=8,Nyw=1	640	1	1	216	1	1	0	1	0	0	0	1.15492e-05	# 1225.70 Gflop/s, 1532.12 GB/s, tuning took 0.011597 seconds at Sun Aug 18 11:55:53 2024
        4x8x8x18	N4quda4blas12MaxDeviationIdfEE	GPU-offline,vol=4608,parity=1,precision=4,order=2,Ns=2,Nc=24	512	1	1	76	1	1	0	-1	-1	-1	-1	1.13483e-05	# 0.00 Gflop/s, 311.85 GB/s, tuning took 0.073515 seconds at Sun Aug 18 11:52:02 2024
        4x8x8x18	N4quda4blas13cabxpyzaxnormIdfEE	GPU-offline,vol=4608,parity=1,precision=4,order=2,Ns=2,Nc=24	1024	1	1	128	1	1	0	-1	-1	-1	-1	1.05276e-05	# 420.20 Gflop/s, 672.31 GB/s, tuning took 0.076761 seconds at Sun Aug 18 11:54:43 2024
        4x8x8x18	N4quda4blas15tripleCGUpdate_IfEE	GPU-offline,vol=4608,parity=1,precision=4,order=2,Ns=2,Nc=24	352	1	1	216	1	1	0	-1	-1	-1	-1	6.05623e-06	# 438.26 Gflop/s, 2045.22 GB/s, tuning took 0.009846 seconds at Sun Aug 18 11:53:23 2024
        4x8x8x18	N4quda4blas18tripleCGReduction_IdfEE	GPU-offline,vol=4608,parity=1,precision=4,order=2,Ns=2,Nc=24	384	1	1	96	1	1	0	-1	-1	-1	-1	1.16511e-05	# 227.81 Gflop/s, 455.61 GB/s, tuning took 0.077828 seconds at Sun Aug 18 11:53:23 2024
        4x8x8x18	N4quda4blas4CdotIdfEE	GPU-offline,vol=4608,parity=1,precision=4,order=2,Ns=2,Nc=24	256	1	1	128	1	1	0	-1	-1	-1	-1	1.08843e-05	# 162.57 Gflop/s, 325.14 GB/s, tuning took 0.072650 seconds at Sun Aug 18 11:53:23 2024
        4x8x8x18	N4quda4blas4axy_IfEE	GPU-offline,vol=4608,parity=1,precision=4,order=2,Ns=2,Nc=24	1024	1	1	216	1	1	0	-1	-1	-1	-1	3.64976e-06	# 121.20 Gflop/s, 969.64 GB/s, tuning took 0.009278 seconds at Sun Aug 18 11:54:43 2024
        4x8x8x18	N4quda4blas5Norm2IdfEE	GPU-offline,vol=4608,parity=1,precision=4,order=2,Ns=2,Nc=24	608	1	1	96	1	1	0	-1	-1	-1	-1	9.59216e-06	# 92.24 Gflop/s, 184.47 GB/s, tuning took 0.067867 seconds at Sun Aug 18 11:52:02 2024
        4x8x8x18	N4quda4blas6caxpy_IfEE	GPU-offline,vol=4608,parity=1,precision=4,order=2,Ns=2,Nc=24	512	1	1	216	1	1	0	-1	-1	-1	-1	3.91837e-06	# 451.58 Gflop/s, 1354.75 GB/s, tuning took 0.009141 seconds at Sun Aug 18 11:53:23 2024
        4x8x8x18	N4quda4blas7axpbyz_IfEE	GPU-offline,vol=4608,parity=1,precision=4,order=2,Ns=2,Nc=24	512	1	1	216	1	1	0	-1	-1	-1	-1	3.92359e-06	# 338.24 Gflop/s, 1352.95 GB/s, tuning took 0.008987 seconds at Sun Aug 18 11:53:19 2024
        4x8x8x18	N4quda4blas9axpyZpbx_IfEE	GPU-offline,vol=4608,parity=1,precision=4,order=2,Ns=2,Nc=24	640	1	1	216	1	1	0	-1	-1	-1	-1	4.92525e-06	# 359.27 Gflop/s, 1796.33 GB/s, tuning took 0.009365 seconds at Sun Aug 18 11:53:23 2024
        4x8x8x18	N4quda4blas9multiCdotIdfEE	policy_kernel,GPU-offline,vol=4608,parity=1,precision=4,order=2,Ns=2,Nc=24,Nxz=1,Nyw=1,max_nyw_tile=8	256	1	1	128	1	1	0	-1	-1	-1	-1	1.20806e-05	# 146.47 Gflop/s, 292.94 GB/s, tuning took 0.026762 seconds at Sun Aug 18 11:54:43 2024
        4x8x8x18	N4quda4blas9multiCdotIdfEE	policy_kernel,GPU-offline,vol=4608,parity=1,precision=4,order=2,Ns=2,Nc=24,Nxz=1,Nyw=2,max_nyw_tile=8	256	1	1	96	1	2	0	-1	-1	-1	-1	1.30291e-05	# 271.62 Gflop/s, 543.24 GB/s, tuning took 0.042467 seconds at Sun Aug 18 11:54:43 2024
        4x8x8x18	N4quda4blas9multiCdotIdfEE	policy_kernel,GPU-offline,vol=4608,parity=1,precision=4,order=2,Ns=2,Nc=24,Nxz=1,Nyw=3,max_nyw_tile=8	256	1	2	96	1	2	0	-1	-1	-1	-1	1.37048e-05	# 387.34 Gflop/s, 774.68 GB/s, tuning took 0.056485 seconds at Sun Aug 18 11:54:43 2024
        4x8x8x18	N4quda4blas9multiCdotIdfEE	policy_kernel,GPU-offline,vol=4608,parity=1,precision=4,order=2,Ns=2,Nc=24,Nxz=1,Nyw=4,max_nyw_tile=8	256	1	2	96	1	2	0	-1	-1	-1	-1	1.44113e-05	# 491.13 Gflop/s, 982.27 GB/s, tuning took 0.070577 seconds at Sun Aug 18 11:54:43 2024
        4x8x8x18	N4quda4blas9multiCdotIdfEE	policy_kernel,GPU-offline,vol=4608,parity=1,precision=4,order=2,Ns=2,Nc=24,Nxz=1,Nyw=5,max_nyw_tile=8	128	1	2	128	1	3	0	-1	-1	-1	-1	1.50497e-05	# 587.88 Gflop/s, 1175.75 GB/s, tuning took 0.083110 seconds at Sun Aug 18 11:54:43 2024
        4x8x8x18	N4quda4blas9multiCdotIdfEE	policy_kernel,GPU-offline,vol=4608,parity=1,precision=4,order=2,Ns=2,Nc=24,Nxz=1,Nyw=6,max_nyw_tile=8	128	1	2	128	1	3	0	-1	-1	-1	-1	1.55417e-05	# 683.12 Gflop/s, 1366.24 GB/s, tuning took 0.095539 seconds at Sun Aug 18 11:54:43 2024
        4x8x8x18	N4quda4blas9multiCdotIdfEE	policy_kernel,GPU-offline,vol=4608,parity=1,precision=4,order=2,Ns=2,Nc=24,Nxz=1,Nyw=7,max_nyw_tile=8	128	1	3	96	1	3	0	-1	-1	-1	-1	1.62645e-05	# 761.55 Gflop/s, 1523.11 GB/s, tuning took 0.110399 seconds at Sun Aug 18 11:55:53 2024
        4x8x8x18	N4quda4blas9multiCdotIdfEE	policy_kernel,GPU-offline,vol=4608,parity=1,precision=4,order=2,Ns=2,Nc=24,Nxz=1,Nyw=8,max_nyw_tile=8	128	1	2	128	1	4	0	-1	-1	-1	-1	1.67018e-05	# 847.56 Gflop/s, 1695.12 GB/s, tuning took 0.122730 seconds at Sun Aug 18 11:55:53 2024
4x8x8x18,4x4x4x18	N4quda14RestrictLaunchIffLi2ELi24ELi2ELi32EEE	GPU-offline,vol=4608,parity=1,precision=4,order=2,Ns=2,Nc=24,vol=1152,parity=2,precision=4,order=2,Ns=2,Nc=32	32	1	4	1152	1	4	0	192	-1	-1	-1	8.73813e-05	# 648.00 Gflop/s, 675.21 GB/s, tuning took 0.577318 seconds at Sun Aug 18 11:54:42 2024
      4x8x8x18x1	N4quda9GhostPackIffL16QudaFieldOrder_s2ELi2ELi24EEE	GPU-offline,vol=4608,parity=1,precision=4,order=2,Ns=2,Nc=24,halo_prec=4,comm=0001,topo=1112,order=01,dest=00000011,nFace=1,spins_per_thread=2,colors_per_thread=2,shmem=0,batched	128	1	1	4	12	1	0	-1	-1	-1	-1	5.5947e-06	# 0.00 Gflop/s, 70.28 GB/s, tuning took 0.011830 seconds at Sun Aug 18 11:51:57 2024
      4x8x8x18x1	N4quda9GhostPackIffL16QudaFieldOrder_s2ELi2ELi24EEE	GPU-offline,vol=4608,parity=1,precision=4,order=2,Ns=2,Nc=24,halo_prec=4,comm=0001,topo=1112,order=01,dest=00000022,nFace=1,spins_per_thread=2,colors_per_thread=2,shmem=0,batched	128	1	1	4	12	1	0	-1	-1	-1	-1	2.01096e-05	# 0.00 Gflop/s, 19.55 GB/s, tuning took 0.017095 seconds at Sun Aug 18 11:51:59 2024
        8x8x8x18	N4quda10BlockOrthoIffLi2ELi1ELi24ELi2ELi32EEE	GPU-offline,cmem,vol=9216,parity=2,precision=4,order=2,Ns=2,Nc=768,block_size=2x2x2x1,n_block_ortho=1,mVec=1	32	1	1	1152	1	2	1891	1	-1	-1	-1	0.00532275	# 675.51 Gflop/s, 372.33 GB/s, tuning took 1.159743 seconds at Sun Aug 18 11:53:57 2024
        8x8x8x18	N4quda10CalculateYILb0EL19QudaFieldLocation_s2ENS_13CalculateYArgILb0EfLi4ELi2ELi3ELi24ENS_5gauge10FieldOrderIfLi48ELi2EL21QudaGaugeFieldOrder_s2ELb1EfEENS4_IfLi48ELi2ELS5_2ELb1EiEENS4_IfLi3ELi1ELS5_2ELb1EfEENS_11colorspinor12FieldOrderCBIfLi4ELi3ELi24EL16QudaFieldOrder_s4EffLb0ELb0EEESC_SC_NS_6clover10FieldOrderIfLi3ELi4EL22QudaCloverFieldOrder_s4EEEEEEE	GPU-offline,cmem,vol=497664,parity=2,precision=4,order=4,Ns=4,Nc=72,comm=0001,computeCoarseDiagonal,GPU-device	512	1	1	9	2	24	0	1	1	1	1	4.94446e-06	# 89.47 Gflop/s, 1431.48 GB/s, tuning took 0.033881 seconds at Sun Aug 18 11:50:23 2024
        8x8x8x18	N4quda10CalculateYILb0EL19QudaFieldLocation_s2ENS_13CalculateYArgILb0EfLi4ELi2ELi3ELi24ENS_5gauge10FieldOrderIfLi48ELi2EL21QudaGaugeFieldOrder_s2ELb1EfEENS4_IfLi48ELi2ELS5_2ELb1EiEENS4_IfLi3ELi1ELS5_2ELb1EfEENS_11colorspinor12FieldOrderCBIfLi4ELi3ELi24EL16QudaFieldOrder_s4EffLb0ELb0EEESC_SC_NS_6clover10FieldOrderIfLi3ELi4EL22QudaCloverFieldOrder_s4EEEEEEE	GPU-offline,cmem,vol=497664,parity=2,precision=4,order=4,Ns=4,Nc=72,comm=0001,computeConvert,GPU-device	64	16	1	72	3	24	0	1	1	1	1	0.000260864	# 1.70 Gflop/s, 1302.36 GB/s, tuning took 1.471865 seconds at Sun Aug 18 11:48:07 2024
        8x8x8x18	N4quda10CalculateYILb1EL19QudaFieldLocation_s2ENS_13CalculateYArgILb1EfLi2ELi2ELi24ELi32ENS_5gauge10FieldOrderIfLi64ELi2EL21QudaGaugeFieldOrder_s13ELb1EfEENS4_IfLi64ELi2ELS5_13ELb1EiEENS4_IfLi48ELi2ELS5_13ELb1EfEENS_11colorspinor12FieldOrderCBIfLi2ELi24ELi32EL16QudaFieldOrder_s9EffLb0ELb0EEENSA_IfLi4ELi24ELi32ELSB_9EffLb0ELb0EEESC_S8_EEEE	GPU-offline,vol=9216,parity=2,precision=4,order=9,Ns=2,Nc=768,comm=0001,computeUV,mma,1xfp16,m16n8k8,dim=0,dir=back,nFace=1,GPU-device	32	1	1	144	12	16	0	3	0	0	0	0.000376491	# 14438.12 Gflop/s, 14738.92 GB/s, tuning took 0.009663 seconds at Sun Aug 18 11:53:59 2024
        8x8x8x18	N4quda10CalculateYILb1EL19QudaFieldLocation_s2ENS_13CalculateYArgILb1EfLi2ELi2ELi24ELi32ENS_5gauge10FieldOrderIfLi64ELi2EL21QudaGaugeFieldOrder_s13ELb1EfEENS4_IfLi64ELi2ELS5_13ELb1EiEENS4_IfLi48ELi2ELS5_13ELb1EfEENS_11colorspinor12FieldOrderCBIfLi2ELi24ELi32EL16QudaFieldOrder_s9EffLb0ELb0EEENSA_IfLi4ELi24ELi32ELSB_9EffLb0ELb0EEESC_S8_EEEE	GPU-offline,vol=9216,parity=2,precision=4,order=9,Ns=2,Nc=768,comm=0001,computeUV,mma,1xfp16,m16n8k8,dim=0,dir=fwd,nFace=1,GPU-device	32	1	1	144	12	16	0	3	0	0	0	0.000376491	# 14438.12 Gflop/s, 14738.92 GB/s, tuning took 0.010832 seconds at Sun Aug 18 11:53:57 2024
        8x8x8x18	N4quda10CalculateYILb1EL19QudaFieldLocation_s2ENS_13CalculateYArgILb1EfLi2ELi2ELi24ELi32ENS_5gauge10FieldOrderIfLi64ELi2EL21QudaGaugeFieldOrder_s13ELb1EfEENS4_IfLi64ELi2ELS5_13ELb1EiEENS4_IfLi48ELi2ELS5_13ELb1EfEENS_11colorspinor12FieldOrderCBIfLi2ELi24ELi32EL16QudaFieldOrder_s9EffLb0ELb0EEENSA_IfLi4ELi24ELi32ELSB_9EffLb0ELb0EEESC_S8_EEEE	GPU-offline,vol=9216,parity=2,precision=4,order=9,Ns=2,Nc=768,comm=0001,computeUV,mma,1xfp16,m16n8k8,dim=1,dir=back,nFace=1,GPU-device	32	1	1	144	12	16	0	3	0	0	0	0.000376491	# 14438.12 Gflop/s, 14738.92 GB/s, tuning took 0.009554 seconds at Sun Aug 18 11:54:00 2024
        8x8x8x18	N4quda10CalculateYILb1EL19QudaFieldLocation_s2ENS_13CalculateYArgILb1EfLi2ELi2ELi24ELi32ENS_5gauge10FieldOrderIfLi64ELi2EL21QudaGaugeFieldOrder_s13ELb1EfEENS4_IfLi64ELi2ELS5_13ELb1EiEENS4_IfLi48ELi2ELS5_13ELb1EfEENS_11colorspinor12FieldOrderCBIfLi2ELi24ELi32EL16QudaFieldOrder_s9EffLb0ELb0EEENSA_IfLi4ELi24ELi32ELSB_9EffLb0ELb0EEESC_S8_EEEE	GPU-offline,vol=9216,parity=2,precision=4,order=9,Ns=2,Nc=768,comm=0001,computeUV,mma,1xfp16,m16n8k8,dim=1,dir=fwd,nFace=1,GPU-device	32	1	1	144	12	16	0	3	0	0	0	0.000375808	# 14464.35 Gflop/s, 14765.69 GB/s, tuning took 0.009220 seconds at Sun Aug 18 11:53:59 2024
        8x8x8x18	N4quda10CalculateYILb1EL19QudaFieldLocation_s2ENS_13CalculateYArgILb1EfLi2ELi2ELi24ELi32ENS_5gauge10FieldOrderIfLi64ELi2EL21QudaGaugeFieldOrder_s13ELb1EfEENS4_IfLi64ELi2ELS5_13ELb1EiEENS4_IfLi48ELi2ELS5_13ELb1EfEENS_11colorspinor12FieldOrderCBIfLi2ELi24ELi32EL16QudaFieldOrder_s9EffLb0ELb0EEENSA_IfLi4ELi24ELi32ELSB_9EffLb0ELb0EEESC_S8_EEEE	GPU-offline,vol=9216,parity=2,precision=4,order=9,Ns=2,Nc=768,comm=0001,computeUV,mma,1xfp16,m16n8k8,dim=2,dir=back,nFace=1,GPU-device	32	1	1	144	12	16	0	3	0	0	0	0.000376832	# 14425.04 Gflop/s, 14725.57 GB/s, tuning took 0.009556 seconds at Sun Aug 18 11:54:00 2024
        8x8x8x18	N4quda10CalculateYILb1EL19QudaFieldLocation_s2ENS_13CalculateYArgILb1EfLi2ELi2ELi24ELi32ENS_5gauge10FieldOrderIfLi64ELi2EL21QudaGaugeFieldOrder_s13ELb1EfEENS4_IfLi64ELi2ELS5_13ELb1EiEENS4_IfLi48ELi2ELS5_13ELb1EfEENS_11colorspinor12FieldOrderCBIfLi2ELi24ELi32EL16QudaFieldOrder_s9EffLb0ELb0EEENSA_IfLi4ELi24ELi32ELSB_9EffLb0ELb0EEESC_S8_EEEE	GPU-offline,vol=9216,parity=2,precision=4,order=9,Ns=2,Nc=768,comm=0001,computeUV,mma,1xfp16,m16n8k8,dim=2,dir=fwd,nFace=1,GPU-device	32	1	1	144	12	16	0	3	0	0	0	0.000376832	# 14425.04 Gflop/s, 14725.57 GB/s, tuning took 0.009681 seconds at Sun Aug 18 11:53:59 2024
        8x8x8x18	N4quda10CalculateYILb1EL19QudaFieldLocation_s2ENS_13CalculateYArgILb1EfLi2ELi2ELi24ELi32ENS_5gauge10FieldOrderIfLi64ELi2EL21QudaGaugeFieldOrder_s13ELb1EfEENS4_IfLi64ELi2ELS5_13ELb1EiEENS4_IfLi48ELi2ELS5_13ELb1EfEENS_11colorspinor12FieldOrderCBIfLi2ELi24ELi32EL16QudaFieldOrder_s9EffLb0ELb0EEENSA_IfLi4ELi24ELi32ELSB_9EffLb0ELb0EEESC_S8_EEEE	GPU-offline,vol=9216,parity=2,precision=4,order=9,Ns=2,Nc=768,comm=0001,computeUV,mma,1xfp16,m16n8k8,dim=3,dir=back,nFace=1,GPU-device	32	1	1	144	12	16	0	3	0	0	0	0.000376832	# 14425.04 Gflop/s, 14725.57 GB/s, tuning took 0.009464 seconds at Sun Aug 18 11:54:00 2024
        8x8x8x18	N4quda10CalculateYILb1EL19QudaFieldLocation_s2ENS_13CalculateYArgILb1EfLi2ELi2ELi24ELi32ENS_5gauge10FieldOrderIfLi64ELi2EL21QudaGaugeFieldOrder_s13ELb1EfEENS4_IfLi64ELi2ELS5_13ELb1EiEENS4_IfLi48ELi2ELS5_13ELb1EfEENS_11colorspinor12FieldOrderCBIfLi2ELi24ELi32EL16QudaFieldOrder_s9EffLb0ELb0EEENSA_IfLi4ELi24ELi32ELSB_9EffLb0ELb0EEESC_S8_EEEE	GPU-offline,vol=9216,parity=2,precision=4,order=9,Ns=2,Nc=768,comm=0001,computeUV,mma,1xfp16,m16n8k8,dim=3,dir=fwd,nFace=1,GPU-device	32	1	1	144	12	16	0	3	0	0	0	0.000377173	# 14411.99 Gflop/s, 14712.24 GB/s, tuning took 0.009696 seconds at Sun Aug 18 11:53:59 2024
        8x8x8x18	N4quda10CalculateYILb1EL19QudaFieldLocation_s2ENS_13CalculateYArgILb1EfLi2ELi2ELi24ELi32ENS_5gauge10FieldOrderIfLi64ELi2EL21QudaGaugeFieldOrder_s13ELb1EfEENS4_IfLi64ELi2ELS5_13ELb1EiEENS4_IfLi48ELi2ELS5_13ELb1EfEENS_11colorspinor12FieldOrderCBIfLi2ELi24ELi32EL16QudaFieldOrder_s9EffLb0ELb0EEENSA_IfLi4ELi24ELi32ELSB_9EffLb0ELb0EEESC_S8_EEEE	GPU-offline,vol=9216,parity=2,precision=4,order=9,Ns=2,Nc=768,comm=0001,computeVUV,mma,1xfp16,m16n8k8,dim=0,dir=back,nFace=1,bidirectional,GPU-device,coarse_vol=4x4x4x18	32	2	1	144	4	4	16384	4	0	0	0	0.000742741	# 9758.12 Gflop/s, 15043.76 GB/s, tuning took 0.022697 seconds at Sun Aug 18 11:54:00 2024
        8x8x8x18	N4quda10CalculateYILb1EL19QudaFieldLocation_s2ENS_13CalculateYArgILb1EfLi2ELi2ELi24ELi32ENS_5gauge10FieldOrderIfLi64ELi2EL21QudaGaugeFieldOrder_s13ELb1EfEENS4_IfLi64ELi2ELS5_13ELb1EiEENS4_IfLi48ELi2ELS5_13ELb1EfEENS_11colorspinor12FieldOrderCBIfLi2ELi24ELi32EL16QudaFieldOrder_s9EffLb0ELb0EEENSA_IfLi4ELi24ELi32ELSB_9EffLb0ELb0EEESC_S8_EEEE	GPU-offline,vol=9216,parity=2,precision=4,order=9,Ns=2,Nc=768,comm=0001,computeVUV,mma,1xfp16,m16n8k8,dim=0,dir=fwd,nFace=1,bidirectional,GPU-device,coarse_vol=4x4x4x18	32	2	1	144	4	4	16384	3	0	0	0	0.000869717	# 8333.46 Gflop/s, 12847.42 GB/s, tuning took 0.026411 seconds at Sun Aug 18 11:53:57 2024
        8x8x8x18	N4quda10CalculateYILb1EL19QudaFieldLocation_s2ENS_13CalculateYArgILb1EfLi2ELi2ELi24ELi32ENS_5gauge10FieldOrderIfLi64ELi2EL21QudaGaugeFieldOrder_s13ELb1EfEENS4_IfLi64ELi2ELS5_13ELb1EiEENS4_IfLi48ELi2ELS5_13ELb1EfEENS_11colorspinor12FieldOrderCBIfLi2ELi24ELi32EL16QudaFieldOrder_s9EffLb0ELb0EEENSA_IfLi4ELi24ELi32ELSB_9EffLb0ELb0EEESC_S8_EEEE	GPU-offline,vol=9216,parity=2,precision=4,order=9,Ns=2,Nc=768,comm=0001,computeVUV,mma,1xfp16,m16n8k8,dim=1,dir=back,nFace=1,bidirectional,GPU-device,coarse_vol=4x4x4x18	32	2	1	144	4	4	16384	4	0	0	0	0.000739328	# 9803.17 Gflop/s, 15113.22 GB/s, tuning took 0.022585 seconds at Sun Aug 18 11:54:00 2024
        8x8x8x18	N4quda10CalculateYILb1EL19QudaFieldLocation_s2ENS_13CalculateYArgILb1EfLi2ELi2ELi24ELi32ENS_5gauge10FieldOrderIfLi64ELi2EL21QudaGaugeFieldOrder_s13ELb1EfEENS4_IfLi64ELi2ELS5_13ELb1EiEENS4_IfLi48ELi2ELS5_13ELb1EfEENS_11colorspinor12FieldOrderCBIfLi2ELi24ELi32EL16QudaFieldOrder_s9EffLb0ELb0EEENSA_IfLi4ELi24ELi32ELSB_9EffLb0ELb0EEESC_S8_EEEE	GPU-offline,vol=9216,parity=2,precision=4,order=9,Ns=2,Nc=768,comm=0001,computeVUV,mma,1xfp16,m16n8k8,dim=1,dir=fwd,nFace=1,bidirectional,GPU-device,coarse_vol=4x4x4x18	32	2	1	144	4	4	16384	3	0	0	0	0.000867328	# 8356.42 Gflop/s, 12882.82 GB/s, tuning took 0.026282 seconds at Sun Aug 18 11:53:59 2024
        8x8x8x18	N4quda10CalculateYILb1EL19QudaFieldLocation_s2ENS_13CalculateYArgILb1EfLi2ELi2ELi24ELi32ENS_5gauge10FieldOrderIfLi64ELi2EL21QudaGaugeFieldOrder_s13ELb1EfEENS4_IfLi64ELi2ELS5_13ELb1EiEENS4_IfLi48ELi2ELS5_13ELb1EfEENS_11colorspinor12FieldOrderCBIfLi2ELi24ELi32EL16QudaFieldOrder_s9EffLb0ELb0EEENSA_IfLi4ELi24ELi32ELSB_9EffLb0ELb0EEESC_S8_EEEE	GPU-offline,vol=9216,parity=2,precision=4,order=9,Ns=2,Nc=768,comm=0001,computeVUV,mma,1xfp16,m16n8k8,dim=2,dir=back,nFace=1,bidirectional,GPU-device,coarse_vol=4x4x4x18	32	2	1	144	4	4	16384	4	0	0	0	0.000738987	# 9807.70 Gflop/s, 15120.20 GB/s, tuning took 0.022563 seconds at Sun Aug 18 11:54:00 2024
        8x8x8x18	N4quda10CalculateYILb1EL19QudaFieldLocation_s2ENS_13CalculateYArgILb1EfLi2ELi2ELi24ELi32ENS_5gauge10FieldOrderIfLi64ELi2EL21QudaGaugeFieldOrder_s13ELb1EfEENS4_IfLi64ELi2ELS5_13ELb1EiEENS4_IfLi48ELi2ELS5_13ELb1EfEENS_11colorspinor12FieldOrderCBIfLi2ELi24ELi32EL16QudaFieldOrder_s9EffLb0ELb0EEENSA_IfLi4ELi24ELi32ELSB_9EffLb0ELb0EEESC_S8_EEEE	GPU-offline,vol=9216,parity=2,precision=4,order=9,Ns=2,Nc=768,comm=0001,computeVUV,mma,1xfp16,m16n8k8,dim=2,dir=fwd,nFace=1,bidirectional,GPU-device,coarse_vol=4x4x4x18	32	2	1	144	4	4	16384	4	0	0	0	0.000865621	# 8372.90 Gflop/s, 12908.21 GB/s, tuning took 0.026253 seconds at Sun Aug 18 11:53:59 2024
        8x8x8x18	N4quda10CalculateYILb1EL19QudaFieldLocation_s2ENS_13CalculateYArgILb1EfLi2ELi2ELi24ELi32ENS_5gauge10FieldOrderIfLi64ELi2EL21QudaGaugeFieldOrder_s13ELb1EfEENS4_IfLi64ELi2ELS5_13ELb1EiEENS4_IfLi48ELi2ELS5_13ELb1EfEENS_11colorspinor12FieldOrderCBIfLi2ELi24ELi32EL16QudaFieldOrder_s9EffLb0ELb0EEENSA_IfLi4ELi24ELi32ELSB_9EffLb0ELb0EEESC_S8_EEEE	GPU-offline,vol=9216,parity=2,precision=4,order=9,Ns=2,Nc=768,comm=0001,computeVUV,mma,1xfp16,m16n8k8,dim=3,dir=back,nFace=1,bidirectional,GPU-device,coarse_vol=4x4x4x18	32	2	1	144	4	4	16384	0	0	0	0	0.000782677	# 9260.21 Gflop/s, 14276.16 GB/s, tuning took 0.023989 seconds at Sun Aug 18 11:54:01 2024
        8x8x8x18	N4quda10CalculateYILb1EL19QudaFieldLocation_s2ENS_13CalculateYArgILb1EfLi2ELi2ELi24ELi32ENS_5gauge10FieldOrderIfLi64ELi2EL21QudaGaugeFieldOrder_s13ELb1EfEENS4_IfLi64ELi2ELS5_13ELb1EiEENS4_IfLi48ELi2ELS5_13ELb1EfEENS_11colorspinor12FieldOrderCBIfLi2ELi24ELi32EL16QudaFieldOrder_s9EffLb0ELb0EEENSA_IfLi4ELi24ELi32ELSB_9EffLb0ELb0EEESC_S8_EEEE	GPU-offline,vol=9216,parity=2,precision=4,order=9,Ns=2,Nc=768,comm=0001,computeVUV,mma,1xfp16,m16n8k8,dim=3,dir=fwd,nFace=1,bidirectional,GPU-device,coarse_vol=4x4x4x18	32	2	1	144	4	4	16384	0	0	0	0	0.000785408	# 9228.02 Gflop/s, 14226.52 GB/s, tuning took 0.023961 seconds at Sun Aug 18 11:53:59 2024
        8x8x8x18	N4quda10CopySpinorIffLi2ELi24ENS_11colorspinor12FieldOrderCBIfLi2ELi24ELi1EL16QudaFieldOrder_s2EffLb0ELb0EEES4_EE	GPU-offline,cmem,vol=9216,parity=2,precision=4,order=2,Ns=2,Nc=24	576	1	1	8	1	1	0	-1	-1	-1	-1	1.15881e-05	# 0.00 Gflop/s, 610.79 GB/s, tuning took 0.011182 seconds at Sun Aug 18 11:53:19 2024
        8x8x8x18	N4quda10CopySpinorIffLi2ELi768ENS_11colorspinor12FieldOrderCBIfLi2ELi768ELi1EL16QudaFieldOrder_s9EffLb0ELb0EEENS2_IfLi2ELi768ELi1ELS3_2EffLb0ELb0EEEEE	GPU-offline,cmem,vol=9216,parity=2,precision=4,order=2,Ns=2,Nc=768	64	1	1	72	1	1	0	-1	-1	-1	-1	0.000883371	# 0.00 Gflop/s, 256.40 GB/s, tuning took 0.186796 seconds at Sun Aug 18 11:53:57 2024
        8x8x8x18	N4quda11SpinorNoiseIfLi2ELi24EEE	GPU-offline,vol=9216,parity=2,precision=4,order=2,Ns=2,Nc=24,uniform	32	1	1	144	2	1	1639	-1	-1	-1	-1	1.29463e-05	# 0.00 Gflop/s, 273.36 GB/s, tuning took 0.034580 seconds at Sun Aug 18 11:51:44 2024
        8x8x8x18	N4quda12DslashCoarseIfffLi2ELi24ELb1ELb1ELb0ELNS_10DslashTypeE2EEE	policy_kernel,GPU-offline,vol=9216,parity=2,precision=4,order=2,Ns=2,Nc=24,comm=0001,full,halo=00000011,n_rhs=1	32	1	12	144	2	8	16385	1	2	1	1	0.00113186	# 1349.93 Gflop/s, 1381.98 GB/s, tuning took 5.989285 seconds at Sun Aug 18 11:51:51 2024
        8x8x8x18	N4quda12DslashCoarseIfffLi2ELi24ELb1ELb1ELb0ELNS_10DslashTypeE2EEE	policy_kernel,GPU-offline,vol=9216,parity=2,precision=4,order=2,Ns=2,Nc=24,comm=0001,full,halo=00000022,n_rhs=1	32	1	12	144	2	8	6144	1	2	1	1	0.00113391	# 1347.50 Gflop/s, 1379.49 GB/s, tuning took 6.297153 seconds at Sun Aug 18 11:51:57 2024
        8x8x8x18	N4quda12DslashCoarseIfffLi2ELi24ELb1ELb1ELb1ELNS_10DslashTypeE2EEE	policy_kernel,GPU-offline,vol=9216,parity=2,precision=4,order=2,Ns=2,Nc=24,comm=0001,full,halo=00000011,n_rhs=1	32	1	12	144	2	8	12289	1	2	1	1	0.00112913	# 1353.20 Gflop/s, 1385.33 GB/s, tuning took 5.869792 seconds at Sun Aug 18 11:54:29 2024
        8x8x8x18	N4quda12DslashCoarseIfffLi2ELi24ELb1ELb1ELb1ELNS_10DslashTypeE2EEE	policy_kernel,GPU-offline,vol=9216,parity=2,precision=4,order=2,Ns=2,Nc=24,comm=0001,full,halo=00000022,n_rhs=1	32	1	12	144	2	8	24577	1	2	1	1	0.00112879	# 1353.61 Gflop/s, 1385.74 GB/s, tuning took 6.187149 seconds at Sun Aug 18 11:54:35 2024
        8x8x8x18	N4quda12ExtractGhostIfLi48ENS_5gauge10FieldOrderIfLi48ELi1EL21QudaGaugeFieldOrder_s13ELb1EfEEEE	GPU-offline,vol=9216stride=5760precision=4geometry=8Nc=48fine-grained,extract	64	1	1	18	48	8	2458	-1	-1	-1	-1	0.000281344	# 0.00 Gflop/s, 519.92 GB/s, tuning took 1.492150 seconds at Sun Aug 18 11:51:09 2024
        8x8x8x18	N4quda12ExtractGhostIfLi48ENS_5gauge10FieldOrderIfLi48ELi1EL21QudaGaugeFieldOrder_s2ELb0EfEEEE	GPU-offline,vol=9216stride=5760precision=4geometry=8Nc=48fine-grained,extract	256	1	1	5	48	8	0	-1	-1	-1	-1	0.000246989	# 0.00 Gflop/s, 592.24 GB/s, tuning took 1.784044 seconds at Sun Aug 18 11:51:16 2024
        8x8x8x18	N4quda12ExtractGhostIfLi48ENS_5gauge10FieldOrderIfLi48ELi1EL21QudaGaugeFieldOrder_s2ELb0EfEEEE	GPU-offline,vol=9216stride=5760precision=4geometry=8Nc=48fine-grained,inject	64	4	4	18	12	2	0	-1	-1	-1	-1	1.80775e-05	# 0.00 Gflop/s, 8091.61 GB/s, tuning took 0.186552 seconds at Sun Aug 18 11:51:30 2024
        8x8x8x18	N4quda13CalculateYhatIL19QudaFieldLocation_s2EfNS_5gauge10FieldOrderIfLi48ELi1EL21QudaGaugeFieldOrder_s13ELb1EfEES5_S5_Li48ELi4ELi2ELb0ELb1EEE	GPU-offline,vol=9216stride=5760precision=4geometry=8Nc=48,GPU-device,comm=0001,mma,1xfp16,m16n8k8	8	1	1	576	24	96	0	0	0	0	0	0.00266718	# 24329.11 Gflop/s, 51970.03 GB/s, tuning took 0.029949 seconds at Sun Aug 18 11:51:17 2024
        8x8x8x18	N4quda22DslashCoarsePolicyTuneINS_18DslashCoarseLaunchINS_1DELb0ELi24ELb0ELi1EEEEE	policy,dslashclover,vol=9216,parity=2,precision=4,order=2,Ns=2,Nc=24,gauge_prec=4,halo_prec=4,comm=0001,topo=1112,order=01,p2p=3,gdr=0,nvshmem=0,pol=11110000000,full,n_rhs=1	32	1	1	1	1	1	0	0	0	0	0	0.00129229	# 1182.35 Gflop/s, 1210.42 GB/s, tuning took 0.039274 seconds at Sun Aug 18 11:51:57 2024
        8x8x8x18	N4quda22DslashCoarsePolicyTuneINS_18DslashCoarseLaunchINS_1DELb1ELi24ELb0ELi1EEEEE	policy,dslashclover,vol=9216,parity=2,precision=4,order=2,Ns=2,Nc=24,gauge_prec=4,halo_prec=4,comm=0001,topo=1112,order=01,p2p=3,gdr=0,nvshmem=0,pol=11110000000,full,n_rhs=1	32	1	1	1	1	1	0	0	0	0	0	0.00134417	# 1136.71 Gflop/s, 1163.70 GB/s, tuning took 0.040576 seconds at Sun Aug 18 11:54:35 2024
        8x8x8x18	N4quda4blas11axpbyzNorm2IdfEE	GPU-offline,vol=9216,parity=2,precision=4,order=2,Ns=2,Nc=24	640	1	1	192	1	1	0	-1	-1	-1	-1	1.11676e-05	# 316.89 Gflop/s, 950.68 GB/s, tuning took 0.079560 seconds at Sun Aug 18 11:51:45 2024
        8x8x8x18	N4quda4blas12MaxDeviationIdfEE	GPU-offline,vol=9216,parity=2,precision=4,order=2,Ns=2,Nc=24	512	1	1	192	1	1	0	-1	-1	-1	-1	1.19508e-05	# 0.00 Gflop/s, 592.25 GB/s, tuning took 0.080879 seconds at Sun Aug 18 11:51:44 2024
        8x8x8x18	N4quda4blas4CdotIdfEE	GPU-offline,vol=9216,parity=2,precision=4,order=2,Ns=2,Nc=24	416	1	1	144	1	1	0	-1	-1	-1	-1	1.20547e-05	# 293.57 Gflop/s, 587.15 GB/s, tuning took 0.082194 seconds at Sun Aug 18 11:53:55 2024
        8x8x8x18	N4quda4blas4axy_IfEE	GPU-offline,vol=9216,parity=2,precision=4,order=2,Ns=2,Nc=24	928	1	1	216	2	1	0	-1	-1	-1	-1	4.96294e-06	# 178.27 Gflop/s, 1426.15 GB/s, tuning took 0.009979 seconds at Sun Aug 18 11:53:55 2024
        8x8x8x18	N4quda4blas5Norm2IdfEE	GPU-offline,vol=9216,parity=2,precision=4,order=2,Ns=2,Nc=24	576	1	1	192	1	1	0	-1	-1	-1	-1	1.00875e-05	# 175.41 Gflop/s, 350.83 GB/s, tuning took 0.072356 seconds at Sun Aug 18 11:51:44 2024
        8x8x8x18	N4quda4blas6caxpy_IfEE	GPU-offline,vol=9216,parity=2,precision=4,order=2,Ns=2,Nc=24	512	1	1	216	2	1	0	-1	-1	-1	-1	4.85615e-06	# 728.76 Gflop/s, 2186.27 GB/s, tuning took 0.009689 seconds at Sun Aug 18 11:53:55 2024
        8x8x8x18	N4quda7RNGInitE	GPU-offline,vol=9216,parity=2,precision=4,order=2,Ns=2,Nc=24	128	1	1	36	2	1	0	-1	-1	-1	-1	0.000330752	# 0.00 Gflop/s, 0.00 GB/s, tuning took 0.053744 seconds at Sun Aug 18 11:53:19 2024
        8x8x8x18	N4quda9CopyGaugeINS_12CopyGaugeArgIffLi4608ELb1ENS_5gauge10FieldOrderIfLi48ELi1EL21QudaGaugeFieldOrder_s13ELb1EfEENS3_IfLi48ELi1ELS4_2ELb1EfEEEEEE	GPU-offline,vol=9216stride=4608precision=4geometry=1Nc=48,vol=9216stride=4608precision=4geometry=1Nc=48,fine-grained	224	1	1	21	48	2	12289	-1	-1	-1	-1	0.00112435	# 0.00 Gflop/s, 302.16 GB/s, tuning took 3.488006 seconds at Sun Aug 18 11:51:13 2024
        8x8x8x18	N4quda9CopyGaugeINS_12CopyGaugeArgIffLi4608ELb1ENS_5gauge10FieldOrderIfLi48ELi1EL21QudaGaugeFieldOrder_s13ELb1EfEENS3_IfLi48ELi1ELS4_2ELb1EfEEEEEE	GPU-offline,vol=9216stride=5760precision=4geometry=8Nc=48,vol=9216stride=5760precision=4geometry=8Nc=48,fine-grained	96	1	2	48	48	8	6145	-1	-1	-1	-1	0.0091136	# 0.00 Gflop/s, 372.78 GB/s, tuning took 42.284823 seconds at Sun Aug 18 11:51:06 2024
        8x8x8x18	N4quda9CopyGaugeINS_12CopyGaugeArgIffLi4608ELb1ENS_5gauge10FieldOrderIfLi48ELi1EL21QudaGaugeFieldOrder_s13ELb1EfEENS3_IfLi48ELi1ELS4_2ELb1EfEEEEEE	GPU-offline,vol=9216stride=5760precision=4geometry=8Nc=48,vol=9216stride=5760precision=4geometry=8Nc=48,fine-grained,ghost	256	1	1	3	48	8	6145	-1	-1	-1	-1	0.000455339	# 0.00 Gflop/s, 803.12 GB/s, tuning took 2.021710 seconds at Sun Aug 18 11:51:08 2024
        8x8x8x18	N4quda9CopyGaugeINS_12CopyGaugeArgIffLi4608ELb1ENS_5gauge10FieldOrderIfLi48ELi1EL21QudaGaugeFieldOrder_s2ELb0EfEENS3_IfLi48ELi1ELS4_2ELb1EfEEEEEE	GPU-offline,vol=9216stride=5760precision=4geometry=8Nc=48,vol=9216stride=5760precision=4geometry=8Nc=48,fine-grained,ghost	96	10	1	6	5	8	0	-1	-1	-1	-1	0.000117988	# 0.00 Gflop/s, 3099.40 GB/s, tuning took 0.903043 seconds at Sun Aug 18 11:51:30 2024
        8x8x8x18	N4quda9CopyGaugeINS_12CopyGaugeArgIffLi4608ELb1ENS_5gauge10FieldOrderIfLi48ELi1EL21QudaGaugeFieldOrder_s2ELb1EfEENS3_IfLi48ELi1ELS4_13ELb1EfEEEEEE	GPU-offline,vol=9216stride=4608precision=4geometry=1Nc=48,vol=9216stride=4608precision=4geometry=1Nc=48,fine-grained	32	24	1	144	2	2	24577	-1	-1	-1	-1	0.000318208	# 0.00 Gflop/s, 1067.66 GB/s, tuning took 1.013692 seconds at Sun Aug 18 11:51:14 2024
        8x8x8x18	N4quda9CopyGaugeINS_12CopyGaugeArgIffLi4608ELb1ENS_5gauge10FieldOrderIfLi48ELi1EL21QudaGaugeFieldOrder_s2ELb1EfEENS3_IfLi48ELi1ELS4_13ELb1EfEEEEEE	GPU-offline,vol=9216stride=5760precision=4geometry=8Nc=48,vol=9216stride=5760precision=4geometry=8Nc=48,fine-grained	32	24	1	144	2	16	24577	-1	-1	-1	-1	0.00243473	# 0.00 Gflop/s, 1395.38 GB/s, tuning took 11.752271 seconds at Sun Aug 18 11:51:28 2024
        8x8x8x18	N4quda9CopyGaugeINS_12CopyGaugeArgIffLi4608ELb1ENS_5gauge10FieldOrderIfLi48ELi1EL21QudaGaugeFieldOrder_s2ELb1EfEENS3_IfLi48ELi1ELS4_13ELb1EfEEEEEE	GPU-offline,vol=9216stride=5760precision=4geometry=8Nc=48,vol=9216stride=5760precision=4geometry=8Nc=48,fine-grained,ghost	32	8	1	18	6	8	6145	-1	-1	-1	-1	0.00013696	# 0.00 Gflop/s, 2670.06 GB/s, tuning took 0.640686 seconds at Sun Aug 18 11:51:29 2024
        8x8x8x18	N4quda9CopyGaugeINS_12CopyGaugeArgIffLi4608ELb1ENS_5gauge10FieldOrderIfLi48ELi1EL21QudaGaugeFieldOrder_s2ELb1EfEENS3_IfLi48ELi1ELS4_2ELb0EfEEEEEE	GPU-offline,vol=9216stride=5760precision=4geometry=8Nc=48,vol=9216stride=5760precision=4geometry=8Nc=48,fine-grained,ghost	32	5	1	18	10	8	0	-1	-1	-1	-1	0.000117305	# 0.00 Gflop/s, 3117.44 GB/s, tuning took 0.899574 seconds at Sun Aug 18 11:51:17 2024
        8x8x8x18	N4quda9GhostPackIffL16QudaFieldOrder_s9ELi2ELi768EEE	GPU-offline,vol=9216,parity=2,precision=4,order=9,Ns=2,Nc=768,halo_prec=4,comm=0001,topo=1112,order=01,dest=00000011,nFace=1,spins_per_thread=2,colors_per_thread=8,shmem=0	32	6	1	16	16	2	0	-1	-1	-1	-1	4.93568e-05	# 0.00 Gflop/s, 254.94 GB/s, tuning took 0.045038 seconds at Sun Aug 18 11:53:57 2024
8x8x8x18,12x24x24x36	N4quda16ProlongateLaunchIffLi4ELi3ELi2ELi24EEE	GPU-offline,vol=9216,parity=2,precision=4,order=2,Ns=2,Nc=24,vol=248832,parity=1,precision=4,order=4,Ns=4,Nc=3	32	1	3	7776	1	1	0	-1	-1	-1	-1	0.000452608	# 1266.68 Gflop/s, 1329.48 GB/s, tuning took 0.555476 seconds at Sun Aug 18 11:54:44 2024
8x8x8x18,24x24x24x36	N4quda16ProlongateLaunchIffLi4ELi3ELi2ELi24EEE	GPU-offline,vol=9216,parity=2,precision=4,order=2,Ns=2,Nc=24,vol=497664,parity=2,precision=4,order=4,Ns=4,Nc=3	32	1	3	7776	2	1	0	-1	-1	-1	-1	0.000897707	# 1277.27 Gflop/s, 1336.65 GB/s, tuning took 1.578354 seconds at Sun Aug 18 11:51:43 2024
8x8x8x18,4x4x4x18	N4quda14RestrictLaunchIffLi2ELi24ELi2ELi32EEE	GPU-offline,vol=9216,parity=2,precision=4,order=2,Ns=2,Nc=24,vol=1152,parity=2,precision=4,order=2,Ns=2,Nc=32	32	1	8	1152	1	2	0	2	-1	-1	-1	0.00013248	# 854.82 Gflop/s, 886.26 GB/s, tuning took 1.239344 seconds at Sun Aug 18 11:54:19 2024
      8x8x8x18x1	N4quda9GhostPackIffL16QudaFieldOrder_s2ELi2ELi24EEE	GPU-offline,vol=9216,parity=2,precision=4,order=2,Ns=2,Nc=24,halo_prec=4,comm=0001,topo=1112,order=01,dest=00000011,nFace=1,spins_per_thread=2,colors_per_thread=2,shmem=0,batched	352	1	1	2	12	2	0	-1	-1	-1	-1	5.39126e-06	# 0.00 Gflop/s, 72.94 GB/s, tuning took 0.012662 seconds at Sun Aug 18 11:51:45 2024
      8x8x8x18x1	N4quda9GhostPackIffL16QudaFieldOrder_s2ELi2ELi24EEE	GPU-offline,vol=9216,parity=2,precision=4,order=2,Ns=2,Nc=24,halo_prec=4,comm=0001,topo=1112,order=01,dest=00000022,nFace=1,spins_per_thread=2,colors_per_thread=2,shmem=0,batched	224	1	2	3	12	1	0	-1	-1	-1	-1	3.5328e-05	# 0.00 Gflop/s, 11.13 GB/s, tuning took 0.028158 seconds at Sun Aug 18 11:51:51 2024
        8x8x8x36	N4quda10CalculateYILb0EL19QudaFieldLocation_s2ENS_13CalculateYArgILb0EfLi4ELi2ELi3ELi24ENS_5gauge10FieldOrderIfLi48ELi2EL21QudaGaugeFieldOrder_s2ELb1EfEENS4_IfLi48ELi2ELS5_2ELb1EiEENS4_IfLi3ELi1ELS5_2ELb1EfEENS_11colorspinor12FieldOrderCBIfLi4ELi3ELi24EL16QudaFieldOrder_s4EffLb0ELb0EEESC_SC_NS_6clover10FieldOrderIfLi3ELi4EL22QudaCloverFieldOrder_s4EEEEEEE	GPU-offline,cmem,vol=995328,parity=2,precision=4,order=4,Ns=4,Nc=72,comm=0000,computeConvert,GPU-device	32	2	1	288	24	24	0	1	1	1	1	0.000516779	# 1.71 Gflop/s, 1314.83 GB/s, tuning took 2.910221 seconds at Tue Mar  4 23:53:58 2025
bytes=1146617856	cudaMemsetAsync	zero,color_spinor_field.cpp,400	32	1	1	1	1	1	0	-1	-1	-1	-1	0.000743083	# 0.00 Gflop/s, 1543.06 GB/s, tuning took 0.005226 seconds at Sun Aug 18 11:47:37 2024
   bytes=1327104	cudaMemcpyDeviceToDevice	exchangeGhost,gauge_field.cpp,527	32	1	1	1	1	1	0	-1	-1	-1	-1	4.12741e-06	# 0.00 Gflop/s, 643.07 GB/s, tuning took 0.000728 seconds at Tue Mar  4 23:52:31 2025
  bytes=13271040	cudaMemset	allocateGhostBuffer,lattice_field.cpp,278	32	1	1	1	1	1	0	-1	-1	-1	-1	9.04882e-06	# 0.00 Gflop/s, 1466.61 GB/s, tuning took 0.001432 seconds at Tue Mar  4 23:52:31 2025
  bytes=13271040	cudaMemset	allocateGhostBuffer,lattice_field.cpp,283	32	1	1	1	1	1	0	-1	-1	-1	-1	9.09617e-06	# 0.00 Gflop/s, 1458.97 GB/s, tuning took 0.000926 seconds at Tue Mar  4 23:52:31 2025
    bytes=147456	cudaMemcpyHostToDevice	BatchInvertMatrix,blas_lapack_cublas.cpp,126	32	1	1	1	1	1	0	-1	-1	-1	-1	1.98482e-05	# 0.00 Gflop/s, 7.43 GB/s, tuning took 0.001055 seconds at Sun Aug 18 11:51:13 2024
 bytes=169869312	cudaMemset	zero,gauge_field.cpp,1186	32	1	1	1	1	1	0	-1	-1	-1	-1	0.000116508	# 0.00 Gflop/s, 1458.00 GB/s, tuning took 0.001540 seconds at Sun Aug 18 11:47:36 2024
bytes=1698693120	cudaMemset	zero,gauge_field.cpp,1186	32	1	1	1	1	1	0	-1	-1	-1	-1	0.00111787	# 0.00 Gflop/s, 1519.58 GB/s, tuning took 0.007875 seconds at Sun Aug 18 11:47:36 2024
   bytes=1769472	cudaMemsetAsync	zero,color_spinor_field.cpp,400	32	1	1	1	1	1	0	-1	-1	-1	-1	3.61688e-06	# 0.00 Gflop/s, 489.23 GB/s, tuning took 0.001141 seconds at Sun Aug 18 11:53:19 2024
     bytes=18432	cudaMemcpyHostToDevice	BatchInvertMatrix,blas_lapack_cublas.cpp,126	32	1	1	1	1	1	0	-1	-1	-1	-1	1.28e-05	# 0.00 Gflop/s, 1.44 GB/s, tuning took 0.000911 seconds at Sun Aug 18 11:54:01 2024
   bytes=1990656	cudaMemcpyDeviceToDevice	exchangeGhost,gauge_field.cpp,527	32	1	1	1	1	1	0	-1	-1	-1	-1	4.76891e-06	# 0.00 Gflop/s, 834.85 GB/s, tuning took 0.000738 seconds at Sun Aug 18 11:46:24 2024
   bytes=1990656	cudaMemcpyHostToDevice	createGeoMap,transfer.cpp,339	32	1	1	1	1	1	0	-1	-1	-1	-1	0.000170325	# 0.00 Gflop/s, 11.69 GB/s, tuning took 0.001740 seconds at Sun Aug 18 11:47:32 2024
   bytes=1990656	cudaMemcpyHostToDevice	createGeoMap,transfer.cpp,340	32	1	1	1	1	1	0	-1	-1	-1	-1	0.000170155	# 0.00 Gflop/s, 11.70 GB/s, tuning took 0.001724 seconds at Sun Aug 18 11:47:32 2024
   bytes=2097152	cudaMemcpyDeviceToDevice	exchangeGhost,gauge_field.cpp,536	32	1	1	1	1	1	0	-1	-1	-1	-1	4.80127e-06	# 0.00 Gflop/s, 873.58 GB/s, tuning took 0.000782 seconds at Sun Aug 18 11:54:02 2024
   bytes=2097152	cudaMemset	create,gauge_field.cpp,219	32	1	1	1	1	1	0	-1	-1	-1	-1	4.24049e-06	# 0.00 Gflop/s, 494.55 GB/s, tuning took 0.000744 seconds at Sun Aug 18 11:53:57 2024
   bytes=2097152	cudaMemset	create,gauge_field.cpp,220	32	1	1	1	1	1	0	-1	-1	-1	-1	4.22164e-06	# 0.00 Gflop/s, 496.76 GB/s, tuning took 0.000737 seconds at Sun Aug 18 11:53:57 2024
  bytes=21233664	cudaMemcpyDeviceToDevice	exchangeGhost,gauge_field.cpp,527	32	1	1	1	1	1	0	-1	-1	-1	-1	3.57262e-05	# 0.00 Gflop/s, 1188.69 GB/s, tuning took 0.001152 seconds at Sun Aug 18 11:51:09 2024
  bytes=21233664	cudaMemcpyDeviceToDevice	exchangeGhost,gauge_field.cpp,536	32	1	1	1	1	1	0	-1	-1	-1	-1	3.64089e-05	# 0.00 Gflop/s, 1166.40 GB/s, tuning took 0.001160 seconds at Sun Aug 18 11:51:09 2024
  bytes=21233664	cudaMemset	create,gauge_field.cpp,219	32	1	1	1	1	1	0	-1	-1	-1	-1	1.35602e-05	# 0.00 Gflop/s, 1565.88 GB/s, tuning took 0.001819 seconds at Sun Aug 18 11:47:36 2024
  bytes=21233664	cudaMemset	create,gauge_field.cpp,220	32	1	1	1	1	1	0	-1	-1	-1	-1	1.34927e-05	# 0.00 Gflop/s, 1573.71 GB/s, tuning took 0.001007 seconds at Sun Aug 18 11:47:36 2024
 bytes=226492416	cudaMemsetAsync	zero,color_spinor_field.cpp,400	32	1	1	1	1	1	0	-1	-1	-1	-1	0.000150967	# 0.00 Gflop/s, 1500.28 GB/s, tuning took 0.001689 seconds at Sun Aug 18 11:53:57 2024
bytes=2293235712	cudaMemsetAsync	zero,color_spinor_field.cpp,400	32	1	1	1	1	1	0	-1	-1	-1	-1	0.00148617	# 0.00 Gflop/s, 1543.06 GB/s, tuning took 0.010433 seconds at Tue Mar  4 23:52:57 2025
  bytes=23887872	cudaMemsetAsync	zero,color_spinor_field.cpp,400	32	1	1	1	1	1	0	-1	-1	-1	-1	1.4464e-05	# 0.00 Gflop/s, 1651.54 GB/s, tuning took 0.001034 seconds at Sun Aug 18 11:46:26 2024
    bytes=294912	cudaMemsetAsync	zero,color_spinor_field.cpp,400	32	1	1	1	1	1	0	-1	-1	-1	-1	3.13469e-06	# 0.00 Gflop/s, 94.08 GB/s, tuning took 0.000811 seconds at Sun Aug 18 11:54:42 2024
 bytes=339738624	cudaMemset	zero,gauge_field.cpp,1186	32	1	1	1	1	1	0	-1	-1	-1	-1	0.000222208	# 0.00 Gflop/s, 1528.92 GB/s, tuning took 0.002143 seconds at Tue Mar  4 23:52:56 2025
bytes=3397386240	cudaMemset	zero,gauge_field.cpp,1186	32	1	1	1	1	1	0	-1	-1	-1	-1	0.00219477	# 0.00 Gflop/s, 1547.94 GB/s, tuning took 0.015407 seconds at Tue Mar  4 23:52:56 2025
   bytes=3538944	cudaMemsetAsync	zero,color_spinor_field.cpp,400	32	1	1	1	1	1	0	-1	-1	-1	-1	4.34337e-06	# 0.00 Gflop/s, 814.79 GB/s, tuning took 0.012581 seconds at Sun Aug 18 11:47:36 2024
     bytes=36864	cudaMemcpyDeviceToHost	BatchInvertMatrix,blas_lapack_cublas.cpp,134	32	1	1	1	1	1	0	-1	-1	-1	-1	9.38858e-06	# 0.00 Gflop/s, 3.93 GB/s, tuning took 0.004471 seconds at Sun Aug 18 11:51:13 2024
     bytes=36864	cudaMemcpyDeviceToHost	BatchInvertMatrix,blas_lapack_cublas.cpp,150	32	1	1	1	1	1	0	-1	-1	-1	-1	9.38466e-06	# 0.00 Gflop/s, 3.93 GB/s, tuning took 0.001897 seconds at Sun Aug 18 11:51:13 2024
     bytes=36864	cudaMemcpyHostToDevice	createGeoMap,transfer.cpp,339	32	1	1	1	1	1	0	-1	-1	-1	-1	1.16297e-05	# 0.00 Gflop/s, 3.17 GB/s, tuning took 0.000744 seconds at Sun Aug 18 11:53:55 2024
     bytes=36864	cudaMemcpyHostToDevice	createGeoMap,transfer.cpp,340	32	1	1	1	1	1	0	-1	-1	-1	-1	1.0752e-05	# 0.00 Gflop/s, 3.43 GB/s, tuning took 0.000950 seconds at Sun Aug 18 11:53:55 2024
  bytes=37748736	cudaMemset	zero,gauge_field.cpp,1186	32	1	1	1	1	1	0	-1	-1	-1	-1	2.85816e-05	# 0.00 Gflop/s, 1320.73 GB/s, tuning took 0.001117 seconds at Sun Aug 18 11:53:57 2024
   bytes=3981312	cudaMemcpyDeviceToDevice	exchangeGhost,gauge_field.cpp,527	32	1	1	1	1	1	0	-1	-1	-1	-1	6.18308e-06	# 0.00 Gflop/s, 1287.81 GB/s, tuning took 0.000897 seconds at Tue Mar  4 23:52:31 2025
   bytes=3981312	cudaMemcpyHostToDevice	createGeoMap,transfer.cpp,339	32	1	1	1	1	1	0	-1	-1	-1	-1	0.000335872	# 0.00 Gflop/s, 11.85 GB/s, tuning took 0.002396 seconds at Tue Mar  4 23:52:49 2025
   bytes=3981312	cudaMemcpyHostToDevice	createGeoMap,transfer.cpp,340	32	1	1	1	1	1	0	-1	-1	-1	-1	0.000338603	# 0.00 Gflop/s, 11.76 GB/s, tuning took 0.002375 seconds at Tue Mar  4 23:52:49 2025
  bytes=42467328	cudaMemset	create,gauge_field.cpp,219	32	1	1	1	1	1	0	-1	-1	-1	-1	3.1168e-05	# 0.00 Gflop/s, 1362.53 GB/s, tuning took 0.003314 seconds at Tue Mar  4 23:52:56 2025
  bytes=42467328	cudaMemset	create,gauge_field.cpp,220	32	1	1	1	1	1	0	-1	-1	-1	-1	3.09512e-05	# 0.00 Gflop/s, 1372.07 GB/s, tuning took 0.001139 seconds at Tue Mar  4 23:52:56 2025
 bytes=452984832	cudaMemset	zero,gauge_field.cpp,1186	32	1	1	1	1	1	0	-1	-1	-1	-1	0.000301312	# 0.00 Gflop/s, 1503.37 GB/s, tuning took 0.002456 seconds at Sun Aug 18 11:53:57 2024
      bytes=4608	cudaMemcpyDeviceToHost	BatchInvertMatrix,blas_lapack_cublas.cpp,134	32	1	1	1	1	1	0	-1	-1	-1	-1	7.07896e-06	# 0.00 Gflop/s, 0.65 GB/s, tuning took 0.001162 seconds at Sun Aug 18 11:54:01 2024
      bytes=4608	cudaMemcpyDeviceToHost	BatchInvertMatrix,blas_lapack_cublas.cpp,150	32	1	1	1	1	1	0	-1	-1	-1	-1	7.04312e-06	# 0.00 Gflop/s, 0.65 GB/s, tuning took 0.001208 seconds at Sun Aug 18 11:54:01 2024
  bytes=47775744	cudaMemsetAsync	zero,color_spinor_field.cpp,400	32	1	1	1	1	1	0	-1	-1	-1	-1	3.39686e-05	# 0.00 Gflop/s, 1406.47 GB/s, tuning took 0.004374 seconds at Sun Aug 18 11:46:26 2024
    bytes=589824	cudaMemsetAsync	zero,color_spinor_field.cpp,400	32	1	1	1	1	1	0	-1	-1	-1	-1	2.83794e-06	# 0.00 Gflop/s, 207.84 GB/s, tuning took 0.005516 seconds at Sun Aug 18 11:53:57 2024
  bytes=63700992	cudaMemset	allocateGhostBuffer,lattice_field.cpp,278	32	1	1	1	1	1	0	-1	-1	-1	-1	4.59404e-05	# 0.00 Gflop/s, 1386.60 GB/s, tuning took 0.001235 seconds at Sun Aug 18 11:47:37 2024
  bytes=63700992	cudaMemset	allocateGhostBuffer,lattice_field.cpp,283	32	1	1	1	1	1	0	-1	-1	-1	-1	4.55215e-05	# 0.00 Gflop/s, 1399.36 GB/s, tuning took 0.001222 seconds at Sun Aug 18 11:47:37 2024
   bytes=7077888	cudaMemsetAsync	zero,color_spinor_field.cpp,400	32	1	1	1	1	1	0	-1	-1	-1	-1	6.29385e-06	# 0.00 Gflop/s, 1124.57 GB/s, tuning took 0.024693 seconds at Tue Mar  4 23:52:56 2025
   bytes=7299072	cudaMemset	allocateGhostBuffer,lattice_field.cpp,278	32	1	1	1	1	1	0	-1	-1	-1	-1	6.98485e-06	# 0.00 Gflop/s, 1044.99 GB/s, tuning took 0.000939 seconds at Sun Aug 18 11:46:24 2024
   bytes=7299072	cudaMemset	allocateGhostBuffer,lattice_field.cpp,283	32	1	1	1	1	1	0	-1	-1	-1	-1	7.01663e-06	# 0.00 Gflop/s, 1040.25 GB/s, tuning took 0.000873 seconds at Sun Aug 18 11:46:24 2024
  bytes=73138176	cudaMemset	allocateGhostBuffer,lattice_field.cpp,278	32	1	1	1	1	1	0	-1	-1	-1	-1	5.21162e-05	# 0.00 Gflop/s, 1403.37 GB/s, tuning took 0.001253 seconds at Sun Aug 18 11:51:08 2024
  bytes=73138176	cudaMemset	allocateGhostBuffer,lattice_field.cpp,283	32	1	1	1	1	1	0	-1	-1	-1	-1	5.19006e-05	# 0.00 Gflop/s, 1409.20 GB/s, tuning took 0.001233 seconds at Sun Aug 18 11:51:08 2024
   bytes=9437184	cudaMemcpyDeviceToDevice	exchangeGhost,gauge_field.cpp,527	32	1	1	1	1	1	0	-1	-1	-1	-1	1.03399e-05	# 0.00 Gflop/s, 1825.39 GB/s, tuning took 0.000936 seconds at Sun Aug 18 11:54:02 2024
   bytes=9437184	cudaMemcpyDeviceToDevice	exchangeGhost,gauge_field.cpp,536	32	1	1	1	1	1	0	-1	-1	-1	-1	1.01651e-05	# 0.00 Gflop/s, 1856.79 GB/s, tuning took 0.000916 seconds at Sun Aug 18 11:51:09 2024
   bytes=9437184	cudaMemset	create,gauge_field.cpp,219	32	1	1	1	1	1	0	-1	-1	-1	-1	7.92895e-06	# 0.00 Gflop/s, 1190.22 GB/s, tuning took 0.000937 seconds at Sun Aug 18 11:47:36 2024
   bytes=9437184	cudaMemset	create,gauge_field.cpp,220	32	1	1	1	1	1	0	-1	-1	-1	-1	7.87259e-06	# 0.00 Gflop/s, 1198.74 GB/s, tuning took 0.000920 seconds at Sun Aug 18 11:47:36 2024
  bytes=95551488	cudaMemsetAsync	zero,color_spinor_field.cpp,400	32	1	1	1	1	1	0	-1	-1	-1	-1	6.4896e-05	# 0.00 Gflop/s, 1472.38 GB/s, tuning took 0.008039 seconds at Tue Mar  4 23:52:35 2025
